log_db/redpajama-3b-q4f32/database_tuning_record.json
[0,[[[["GetBlock",[],["NT_matmul","main"],["b0"]],["GetBlock",[],["T_add","main"],["b1"]],["GetBlock",[],["T_multiply","main"],["b2"]],["GetBlock",[],["compute","main"],["b3"]],["GetBlock",[],["T_multiply_1","main"],["b4"]],["GetBlock",[],["T_add_1","main"],["b5"]],["GetBlock",[],["T_multiply_2","main"],["b6"]],["GetBlock",[],["root","main"],["b7"]],["Annotate",["b0","\"SSSRRSRS\""],["meta_schedule.tiling_structure"],[]],["GetLoops",["b0"],[],["l8","l9","l10","l11"]],["SamplePerfectTile",["l8"],[5,64],["v12","v13","v14","v15","v16"]],["Split",["l8","v12","v13","v14","v15","v16"],[1],["l17","l18","l19","l20","l21"]],["SamplePerfectTile",["l9"],[5,64],["v22","v23","v24","v25","v26"]],["Split",["l9","v22","v23","v24","v25","v26"],[1],["l27","l28","l29","l30","l31"]],["SamplePerfectTile",["l10"],[5,64],["v32","v33","v34","v35","v36"]],["Split",["l10","v32","v33","v34","v35","v36"],[1],["l37","l38","l39","l40","l41"]],["SamplePerfectTile",["l11"],[3,64],["v42","v43","v44"]],["Split",["l11","v42","v43","v44"],[1],["l45","l46","l47"]],["Reorder",["l17","l27","l37","l18","l28","l38","l19","l29","l39","l45","l46","l20","l30","l40","l47","l21","l31","l41"],[],[]],["Fuse",["l17","l27","l37"],[1],["l48"]],["Bind",["l48"],["blockIdx.x"],[]],["Fuse",["l18","l28","l38"],[1],["l49"]],["Bind",["l49"],["vthread.x"],[]],["Fuse",["l19","l29","l39"],[1],["l50"]],["Bind",["l50"],["threadIdx.x"],[]],["Annotate",["b0",32],["meta_schedule.thread_extent_low_inclusive"],[]],["Annotate",["b0",1024],["meta_schedule.thread_extent_high_inclusive"],[]],["CacheWrite",["b0",[]],[0,"local"],["b51"]],["ReverseComputeAt",["b51","l50"],[1,-1],[]],["CacheRead",["b0",["b0"]],[0,"shared"],["b52"]],["ComputeAt",["b52","l45"],[1,-1],[]],["GetLoops",["b52"],[],["l53","l54","l55","l56","l57","l58","l59"]],["Fuse",["l57","l58","l59"],[1],["l60"]],["SampleCategorical",[],[[1,2,3,4],[0.25,0.25,0.25,0.25]],["v61"]],["Annotate",["b52","v61"],["meta_schedule.cooperative_fetch"],[]],["CacheRead",["b0",["b0"]],[1,"shared"],["b62"]],["ComputeAt",["b62","l45"],[1,-1],[]],["GetLoops",["b62"],[],["l63","l64","l65","l66","l67","l68"]],["Fuse",["l67","l68"],[1],["l69"]],["SampleCategorical",[],[[1,2,3,4],[0.25,0.25,0.25,0.25]],["v70"]],["Annotate",["b62","v70"],["meta_schedule.cooperative_fetch"],[]],["ComputeInline",["b5"],[],[]],["ComputeInline",["b4"],[],[]],["ComputeInline",["b3"],[],[]],["ComputeInline",["b2"],[],[]],["ComputeInline",["b1"],[],[]],["ReverseComputeInline",["b6"],[],[]],["SampleCategorical",[],[[0,16,64,512,1024],[0.2000000000000000111,0.2000000000000000111,0.2000000000000000111,0.2000000000000000111,0.2000000000000000111]],["v71"]],["Annotate",["b7","v71"],["meta_schedule.unroll_explicit"],[]],["EnterPostproc",[],[],[]],["Unannotate",["b52"],["meta_schedule.cooperative_fetch"],[]],["GetLoops",["b52"],[],["l72","l73","l74","l75","l76"]],["Split",["l76","None",128,2],[1],["l77","l78","l79"]],["Vectorize",["l79"],[],[]],["Bind",["l78"],["threadIdx.x"],[]],["Unannotate",["b62"],["meta_schedule.cooperative_fetch"],[]],["GetLoops",["b62"],[],["l80","l81","l82","l83","l84"]],["Split",["l84","None",128],[1],["l85","l86"]],["Bind",["l86"],["threadIdx.x"],[]],["GetBlock",[],["root","main"],["b87"]],["Unannotate",["b87"],["meta_schedule.unroll_explicit"],[]],["GetChildBlocks",["b87"],[],["b88","b89","b90","b91"]],["GetLoops",["b88"],[],["l92","l93","l94","l95","l96","l97","l98"]],["GetLoops",["b89"],[],["l99","l100","l101","l102","l103","l104"]],["GetLoops",["b90"],[],["l105","l106","l107","l108","l109","l110","l111","l112","l113","l114","l115","l116"]],["Annotate",["l105",16],["pragma_auto_unroll_max_step"],[]],["Annotate",["l105",1],["pragma_unroll_explicit"],[]],["GetLoops",["b91"],[],["l117","l118","l119","l120","l121","l122"]],["GetBlock",[],["NT_matmul","main"],["b123"]],["GetLoops",["b123"],[],["l124","l125","l126","l127","l128","l129","l130","l131","l132","l133","l134","l135"]],["DecomposeReduction",["b123","l127"],[],["b136"]]],[[10,[1,1,1,1,1]],[12,[1,2,16,2,2]],[14,[320,1,8,4,1]],[16,[160,4,4]],[33,1],[39,2],[47,1]]],[0.0044404722121212120839],{"host":{"keys":["cpu"],"kind":"llvm","tag":""},"keys":["metal","gpu"],"kind":"metal","max_function_args":31,"max_num_threads":256,"max_shared_memory_per_block":32768,"max_threads_per_block":256,"tag":"","thread_warp_size":32},[["TENSOR","float32",[1,128,2560]],["TENSOR","float32",[10240,2560]],["TENSOR","float32",[10240]],["TENSOR","float32",[1,128,10240]]]]]
[1,[[[["GetBlock",[],["decode","main"],["b0"]],["GetLoops",["b0"],[],["l1","l2"]],["Split",["l1","None",8],[1],["l3","l4"]],["SamplePerfectTile",["l3"],[3,4],["v5","v6","v7"]],["SamplePerfectTile",["l2"],[2,16],["v8","v9"]],["Split",["l3","v5","v6","v7"],[1],["l10","l11","l12"]],["Split",["l2","v8","v9"],[1],["l13","l14"]],["Reorder",["l10","l13","l11","l14","l12","l4"],[],[]],["Bind",["l10"],["blockIdx.y"],[]],["Bind",["l13"],["blockIdx.x"],[]],["Bind",["l11"],["threadIdx.y"],[]],["Bind",["l14"],["threadIdx.x"],[]],["Unroll",["l4"],[],[]],["CacheWrite",["b0",[]],[0,"shared"],["b15"]],["ComputeInline",["b15"],[],[]],["GetBlock",[],["T_transpose","main"],["b16"]],["ReverseComputeAt",["b16","l13"],[1,-1],[]],["GetLoops",["b16"],[],["l17","l18","l19","l20"]],["Fuse",["l19","l20"],[1],["l21"]],["Split",["l21","None","v6","v9",4],[1],["l22","l23","l24","l25"]],["Bind",["l23"],["threadIdx.y"],[]],["Bind",["l24"],["threadIdx.x"],[]],["Vectorize",["l25"],[],[]],["StorageAlign",["b0"],[0,0,32,1],[]],["EnterPostproc",[],[],[]]],[[3,[80,16,1]],[4,[160,16]]]],[0.0014826804174757281414],{"host":{"keys":["cpu"],"kind":"llvm","tag":""},"keys":["metal","gpu"],"kind":"metal","max_function_args":31,"max_num_threads":256,"max_shared_memory_per_block":32768,"max_threads_per_block":256,"tag":"","thread_warp_size":32},[["TENSOR","uint32",[1280,2560]],["TENSOR","uint32",[320,2560]],["TENSOR","float32",[2560,10240]]]]]
[2,[[[["GetBlock",[],["decode","main"],["b0"]],["GetLoops",["b0"],[],["l1","l2"]],["Split",["l1","None",8],[1],["l3","l4"]],["SamplePerfectTile",["l3"],[3,4],["v5","v6","v7"]],["SamplePerfectTile",["l2"],[2,16],["v8","v9"]],["Split",["l3","v5","v6","v7"],[1],["l10","l11","l12"]],["Split",["l2","v8","v9"],[1],["l13","l14"]],["Reorder",["l10","l13","l11","l14","l12","l4"],[],[]],["Bind",["l10"],["blockIdx.y"],[]],["Bind",["l13"],["blockIdx.x"],[]],["Bind",["l11"],["threadIdx.y"],[]],["Bind",["l14"],["threadIdx.x"],[]],["Unroll",["l4"],[],[]],["CacheWrite",["b0",[]],[0,"shared"],["b15"]],["ComputeInline",["b15"],[],[]],["GetBlock",[],["T_transpose","main"],["b16"]],["ReverseComputeAt",["b16","l13"],[1,-1],[]],["GetLoops",["b16"],[],["l17","l18","l19","l20"]],["Fuse",["l19","l20"],[1],["l21"]],["Split",["l21","None","v6","v9",4],[1],["l22","l23","l24","l25"]],["Bind",["l23"],["threadIdx.y"],[]],["Bind",["l24"],["threadIdx.x"],[]],["Vectorize",["l25"],[],[]],["StorageAlign",["b0"],[0,0,32,1],[]],["EnterPostproc",[],[],[]]],[[3,[40,8,1]],[4,[10240,1]]]],[0.0014710639223300971644],{"host":{"keys":["cpu"],"kind":"llvm","tag":""},"keys":["metal","gpu"],"kind":"metal","max_function_args":31,"max_num_threads":256,"max_shared_memory_per_block":32768,"max_threads_per_block":256,"tag":"","thread_warp_size":32},[["TENSOR","uint32",[320,10240]],["TENSOR","uint32",[80,10240]],["TENSOR","float32",[10240,2560]]]]]
[3,[[[["GetBlock",[],["NT_matmul","main"],["b0"]],["GetBlock",[],["T_add","main"],["b1"]],["GetBlock",[],["root","main"],["b2"]],["Annotate",["b0","\"SSSRRSRS\""],["meta_schedule.tiling_structure"],[]],["GetLoops",["b0"],[],["l3","l4","l5","l6"]],["SamplePerfectTile",["l3"],[5,64],["v7","v8","v9","v10","v11"]],["Split",["l3","v7","v8","v9","v10","v11"],[1],["l12","l13","l14","l15","l16"]],["SamplePerfectTile",["l4"],[5,64],["v17","v18","v19","v20","v21"]],["Split",["l4","v17","v18","v19","v20","v21"],[1],["l22","l23","l24","l25","l26"]],["SamplePerfectTile",["l5"],[5,64],["v27","v28","v29","v30","v31"]],["Split",["l5","v27","v28","v29","v30","v31"],[1],["l32","l33","l34","l35","l36"]],["SamplePerfectTile",["l6"],[3,64],["v37","v38","v39"]],["Split",["l6","v37","v38","v39"],[1],["l40","l41","l42"]],["Reorder",["l12","l22","l32","l13","l23","l33","l14","l24","l34","l40","l41","l15","l25","l35","l42","l16","l26","l36"],[],[]],["Fuse",["l12","l22","l32"],[1],["l43"]],["Bind",["l43"],["blockIdx.x"],[]],["Fuse",["l13","l23","l33"],[1],["l44"]],["Bind",["l44"],["vthread.x"],[]],["Fuse",["l14","l24","l34"],[1],["l45"]],["Bind",["l45"],["threadIdx.x"],[]],["Annotate",["b0",32],["meta_schedule.thread_extent_low_inclusive"],[]],["Annotate",["b0",256],["meta_schedule.thread_extent_high_inclusive"],[]],["CacheWrite",["b0",[]],[0,"local"],["b46"]],["ReverseComputeAt",["b46","l45"],[1,-1],[]],["CacheRead",["b0",["b0"]],[0,"shared"],["b47"]],["ComputeAt",["b47","l40"],[1,-1],[]],["GetLoops",["b47"],[],["l48","l49","l50","l51","l52","l53","l54"]],["Fuse",["l52","l53","l54"],[1],["l55"]],["SampleCategorical",[],[[1,2,3,4],[0.25,0.25,0.25,0.25]],["v56"]],["Annotate",["b47","v56"],["meta_schedule.cooperative_fetch"],[]],["CacheRead",["b0",["b0"]],[1,"shared"],["b57"]],["ComputeAt",["b57","l40"],[1,-1],[]],["GetLoops",["b57"],[],["l58","l59","l60","l61","l62","l63"]],["Fuse",["l62","l63"],[1],["l64"]],["SampleCategorical",[],[[1,2,3,4],[0.25,0.25,0.25,0.25]],["v65"]],["Annotate",["b57","v65"],["meta_schedule.cooperative_fetch"],[]],["ReverseComputeInline",["b1"],[],[]],["SampleCategorical",[],[[0,16,64,512,1024],[0.2000000000000000111,0.2000000000000000111,0.2000000000000000111,0.2000000000000000111,0.2000000000000000111]],["v66"]],["Annotate",["b2","v66"],["meta_schedule.unroll_explicit"],[]],["EnterPostproc",[],[],[]],["Unannotate",["b47"],["meta_schedule.cooperative_fetch"],[]],["GetLoops",["b47"],[],["l67","l68","l69","l70","l71"]],["Split",["l71","None",64,2],[1],["l72","l73","l74"]],["Vectorize",["l74"],[],[]],["Bind",["l73"],["threadIdx.x"],[]],["Unannotate",["b57"],["meta_schedule.cooperative_fetch"],[]],["GetLoops",["b57"],[],["l75","l76","l77","l78","l79"]],["Split",["l79","None",64],[1],["l80","l81"]],["Bind",["l81"],["threadIdx.x"],[]],["GetBlock",[],["root","main"],["b82"]],["Unannotate",["b82"],["meta_schedule.unroll_explicit"],[]],["GetChildBlocks",["b82"],[],["b83","b84","b85","b86"]],["GetLoops",["b83"],[],["l87","l88","l89","l90","l91","l92","l93"]],["GetLoops",["b84"],[],["l94","l95","l96","l97","l98","l99"]],["GetLoops",["b85"],[],["l100","l101","l102","l103","l104","l105","l106","l107","l108","l109","l110","l111"]],["Annotate",["l100",512],["pragma_auto_unroll_max_step"],[]],["Annotate",["l100",1],["pragma_unroll_explicit"],[]],["GetLoops",["b86"],[],["l112","l113","l114","l115","l116","l117"]],["GetBlock",[],["NT_matmul","main"],["b118"]],["GetLoops",["b118"],[],["l119","l120","l121","l122","l123","l124","l125","l126","l127","l128","l129","l130"]],["DecomposeReduction",["b118","l122"],[],["b131"]]],[[5,[1,1,1,1,1]],[7,[2,4,8,1,2]],[9,[64,5,8,1,1]],[11,[320,2,4]],[28,1],[34,0],[37,3]]],[0.0012703907346938777146],{"host":{"keys":["cpu"],"kind":"llvm","tag":""},"keys":["metal","gpu"],"kind":"metal","max_function_args":31,"max_num_threads":256,"max_shared_memory_per_block":32768,"max_threads_per_block":256,"tag":"","thread_warp_size":32},[["TENSOR","float32",[1,128,2560]],["TENSOR","float32",[2560,2560]],["TENSOR","float32",[2560]],["TENSOR","float32",[1,128,2560]]]]]
[4,[[[["GetBlock",[],["NT_matmul","main"],["b0"]],["GetBlock",[],["T_add","main"],["b1"]],["GetBlock",[],["T_add_1","main"],["b2"]],["GetBlock",[],["root","main"],["b3"]],["Annotate",["b0","\"SSSRRSRS\""],["meta_schedule.tiling_structure"],[]],["GetLoops",["b0"],[],["l4","l5","l6","l7"]],["SamplePerfectTile",["l4"],[5,64],["v8","v9","v10","v11","v12"]],["Split",["l4","v8","v9","v10","v11","v12"],[1],["l13","l14","l15","l16","l17"]],["SamplePerfectTile",["l5"],[5,64],["v18","v19","v20","v21","v22"]],["Split",["l5","v18","v19","v20","v21","v22"],[1],["l23","l24","l25","l26","l27"]],["SamplePerfectTile",["l6"],[5,64],["v28","v29","v30","v31","v32"]],["Split",["l6","v28","v29","v30","v31","v32"],[1],["l33","l34","l35","l36","l37"]],["SamplePerfectTile",["l7"],[3,64],["v38","v39","v40"]],["Split",["l7","v38","v39","v40"],[1],["l41","l42","l43"]],["Reorder",["l13","l23","l33","l14","l24","l34","l15","l25","l35","l41","l42","l16","l26","l36","l43","l17","l27","l37"],[],[]],["Fuse",["l13","l23","l33"],[1],["l44"]],["Bind",["l44"],["blockIdx.x"],[]],["Fuse",["l14","l24","l34"],[1],["l45"]],["Bind",["l45"],["vthread.x"],[]],["Fuse",["l15","l25","l35"],[1],["l46"]],["Bind",["l46"],["threadIdx.x"],[]],["Annotate",["b0",32],["meta_schedule.thread_extent_low_inclusive"],[]],["Annotate",["b0",256],["meta_schedule.thread_extent_high_inclusive"],[]],["CacheWrite",["b0",[]],[0,"local"],["b47"]],["ReverseComputeAt",["b47","l46"],[1,-1],[]],["CacheRead",["b0",["b0"]],[0,"shared"],["b48"]],["ComputeAt",["b48","l41"],[1,-1],[]],["GetLoops",["b48"],[],["l49","l50","l51","l52","l53","l54","l55"]],["Fuse",["l53","l54","l55"],[1],["l56"]],["SampleCategorical",[],[[1,2,3,4],[0.25,0.25,0.25,0.25]],["v57"]],["Annotate",["b48","v57"],["meta_schedule.cooperative_fetch"],[]],["CacheRead",["b0",["b0"]],[1,"shared"],["b58"]],["ComputeAt",["b58","l41"],[1,-1],[]],["GetLoops",["b58"],[],["l59","l60","l61","l62","l63","l64"]],["Fuse",["l63","l64"],[1],["l65"]],["SampleCategorical",[],[[1,2,3,4],[0.25,0.25,0.25,0.25]],["v66"]],["Annotate",["b58","v66"],["meta_schedule.cooperative_fetch"],[]],["ReverseComputeInline",["b2"],[],[]],["ReverseComputeInline",["b1"],[],[]],["SampleCategorical",[],[[0,16,64,512,1024],[0.2000000000000000111,0.2000000000000000111,0.2000000000000000111,0.2000000000000000111,0.2000000000000000111]],["v67"]],["Annotate",["b3","v67"],["meta_schedule.unroll_explicit"],[]],["EnterPostproc",[],[],[]],["Unannotate",["b48"],["meta_schedule.cooperative_fetch"],[]],["GetLoops",["b48"],[],["l68","l69","l70","l71","l72"]],["Split",["l72","None",32,4],[1],["l73","l74","l75"]],["Vectorize",["l75"],[],[]],["Bind",["l74"],["threadIdx.x"],[]],["Unannotate",["b58"],["meta_schedule.cooperative_fetch"],[]],["GetLoops",["b58"],[],["l76","l77","l78","l79","l80"]],["Split",["l80","None",32,4],[1],["l81","l82","l83"]],["Vectorize",["l83"],[],[]],["Bind",["l82"],["threadIdx.x"],[]],["GetBlock",[],["root","main"],["b84"]],["Unannotate",["b84"],["meta_schedule.unroll_explicit"],[]],["GetChildBlocks",["b84"],[],["b85","b86","b87","b88"]],["GetLoops",["b85"],[],["l89","l90","l91","l92","l93","l94","l95"]],["GetLoops",["b86"],[],["l96","l97","l98","l99","l100","l101","l102"]],["GetLoops",["b87"],[],["l103","l104","l105","l106","l107","l108","l109","l110","l111","l112","l113","l114"]],["Annotate",["l103",64],["pragma_auto_unroll_max_step"],[]],["Annotate",["l103",1],["pragma_unroll_explicit"],[]],["GetLoops",["b88"],[],["l115","l116","l117","l118","l119","l120"]],["GetBlock",[],["NT_matmul","main"],["b121"]],["GetLoops",["b121"],[],["l122","l123","l124","l125","l126","l127","l128","l129","l130","l131","l132","l133"]],["DecomposeReduction",["b121","l125"],[],["b134"]]],[[6,[1,1,1,1,1]],[8,[2,2,32,1,1]],[10,[80,2,1,16,1]],[12,[320,1,8]],[29,3],[35,3],[39,2]]],[0.0012556629098360657],{"host":{"keys":["cpu"],"kind":"llvm","tag":""},"keys":["metal","gpu"],"kind":"metal","max_function_args":31,"max_num_threads":256,"max_shared_memory_per_block":32768,"max_threads_per_block":256,"tag":"","thread_warp_size":32},[["TENSOR","float32",[1,128,2560]],["TENSOR","float32",[2560,2560]],["TENSOR","float32",[2560]],["TENSOR","float32",[1,128,2560]],["TENSOR","float32",[1,128,2560]]]]]
[5,[[[["GetBlock",[],["T_reshape","main"],["b0"]],["GetLoops",["b0"],[],["l1","l2","l3","l4"]],["Fuse",["l1","l2","l3","l4"],[1],["l5"]],["SampleCategorical",[],[[32,64,128,256],[0.25,0.25,0.25,0.25]],["v6"]],["Split",["l5","None","v6"],[1],["l7","l8"]],["Bind",["l7"],["blockIdx.x"],[]],["Bind",["l8"],["threadIdx.x"],[]],["EnterPostproc",[],[],[]]],[[3,0]]],[2.7708968209179835615e-05],{"host":{"keys":["cpu"],"kind":"llvm","tag":""},"keys":["metal","gpu"],"kind":"metal","max_function_args":31,"max_num_threads":256,"max_shared_memory_per_block":32768,"max_threads_per_block":256,"tag":"","thread_warp_size":32},[["TENSOR","float32",[1,1,2560]],["TENSOR","float32",[1,1,32,80]]]]]
[6,[[[["GetBlock",[],["matmul","main"],["b0"]],["GetBlock",[],["root","main"],["b1"]],["Annotate",["b0","\"SSSRRSRS\""],["meta_schedule.tiling_structure"],[]],["GetLoops",["b0"],[],["l2","l3","l4","l5","l6"]],["SamplePerfectTile",["l2"],[5,64],["v7","v8","v9","v10","v11"]],["Split",["l2","v7","v8","v9","v10","v11"],[1],["l12","l13","l14","l15","l16"]],["SamplePerfectTile",["l3"],[5,64],["v17","v18","v19","v20","v21"]],["Split",["l3","v17","v18","v19","v20","v21"],[1],["l22","l23","l24","l25","l26"]],["SamplePerfectTile",["l4"],[5,64],["v27","v28","v29","v30","v31"]],["Split",["l4","v27","v28","v29","v30","v31"],[1],["l32","l33","l34","l35","l36"]],["SamplePerfectTile",["l5"],[5,64],["v37","v38","v39","v40","v41"]],["Split",["l5","v37","v38","v39","v40","v41"],[1],["l42","l43","l44","l45","l46"]],["SamplePerfectTile",["l6"],[3,64],["v47","v48","v49"]],["Split",["l6","v47","v48","v49"],[1],["l50","l51","l52"]],["Reorder",["l12","l22","l32","l42","l13","l23","l33","l43","l14","l24","l34","l44","l50","l51","l15","l25","l35","l45","l52","l16","l26","l36","l46"],[],[]],["Fuse",["l12","l22","l32","l42"],[1],["l53"]],["Bind",["l53"],["blockIdx.x"],[]],["Fuse",["l13","l23","l33","l43"],[1],["l54"]],["Bind",["l54"],["vthread.x"],[]],["Fuse",["l14","l24","l34","l44"],[1],["l55"]],["Bind",["l55"],["threadIdx.x"],[]],["Annotate",["b0",32],["meta_schedule.thread_extent_low_inclusive"],[]],["Annotate",["b0",256],["meta_schedule.thread_extent_high_inclusive"],[]],["CacheWrite",["b0",[]],[0,"local"],["b56"]],["ReverseComputeAt",["b56","l55"],[1,-1],[]],["CacheRead",["b0",["b0"]],[0,"shared"],["b57"]],["ComputeAt",["b57","l50"],[1,-1],[]],["GetLoops",["b57"],[],["l58","l59","l60","l61","l62","l63","l64","l65"]],["Fuse",["l62","l63","l64","l65"],[1],["l66"]],["SampleCategorical",[],[[1,2,3,4],[0.25,0.25,0.25,0.25]],["v67"]],["Annotate",["b57","v67"],["meta_schedule.cooperative_fetch"],[]],["CacheRead",["b0",["b0"]],[1,"shared"],["b68"]],["ComputeAt",["b68","l50"],[1,-1],[]],["GetLoops",["b68"],[],["l69","l70","l71","l72","l73","l74","l75","l76"]],["Fuse",["l73","l74","l75","l76"],[1],["l77"]],["SampleCategorical",[],[[1,2,3,4],[0.25,0.25,0.25,0.25]],["v78"]],["Annotate",["b68","v78"],["meta_schedule.cooperative_fetch"],[]],["SampleCategorical",[],[[0,16,64,512,1024],[0.2000000000000000111,0.2000000000000000111,0.2000000000000000111,0.2000000000000000111,0.2000000000000000111]],["v79"]],["Annotate",["b1","v79"],["meta_schedule.unroll_explicit"],[]],["EnterPostproc",[],[],[]],["Unannotate",["b57"],["meta_schedule.cooperative_fetch"],[]],["GetLoops",["b57"],[],["l80","l81","l82","l83","l84"]],["Split",["l84","None",80],[1],["l85","l86"]],["Bind",["l86"],["threadIdx.x"],[]],["Unannotate",["b68"],["meta_schedule.cooperative_fetch"],[]],["GetLoops",["b68"],[],["l87","l88","l89","l90","l91"]],["Split",["l91","None",80],[1],["l92","l93"]],["Bind",["l93"],["threadIdx.x"],[]],["GetBlock",[],["root","main"],["b94"]],["Unannotate",["b94"],["meta_schedule.unroll_explicit"],[]],["GetChildBlocks",["b94"],[],["b95","b96","b97","b98"]],["GetLoops",["b95"],[],["l99","l100","l101","l102","l103","l104"]],["GetLoops",["b96"],[],["l105","l106","l107","l108","l109","l110"]],["GetLoops",["b97"],[],["l111","l112","l113","l114","l115","l116","l117","l118","l119","l120","l121","l122","l123","l124"]],["GetLoops",["b98"],[],["l125","l126","l127","l128","l129","l130","l131"]],["GetBlock",[],["matmul","main"],["b132"]],["GetLoops",["b132"],[],["l133","l134","l135","l136","l137","l138","l139","l140","l141","l142","l143","l144","l145","l146"]],["DecomposeReduction",["b132","l136"],[],["b147"]]],[[4,[1,1,1,1,1]],[6,[16,1,2,1,1]],[8,[1,1,1,1,1]],[10,[2,1,40,1,1]],[12,[8,2,2]],[29,2],[35,2],[37,0]]],[2.8020489330116905478e-05],{"host":{"keys":["cpu"],"kind":"llvm","tag":""},"keys":["metal","gpu"],"kind":"metal","max_function_args":31,"max_num_threads":256,"max_shared_memory_per_block":32768,"max_threads_per_block":256,"tag":"","thread_warp_size":32},[["TENSOR","float32",[1,32,1,32]],["TENSOR","float32",[1,32,32,80]],["TENSOR","float32",[1,32,1,80]]]]]
[7,[[[["GetBlock",[],["NT_matmul","main"],["b0"]],["GetBlock",[],["T_divide","main"],["b1"]],["GetBlock",[],["T_maximum","main"],["b2"]],["GetBlock",[],["T_minimum","main"],["b3"]],["GetBlock",[],["root","main"],["b4"]],["Annotate",["b0","\"SSSRRSRS\""],["meta_schedule.tiling_structure"],[]],["GetLoops",["b0"],[],["l5","l6","l7","l8","l9"]],["SamplePerfectTile",["l5"],[5,64],["v10","v11","v12","v13","v14"]],["Split",["l5","v10","v11","v12","v13","v14"],[1],["l15","l16","l17","l18","l19"]],["SamplePerfectTile",["l6"],[5,64],["v20","v21","v22","v23","v24"]],["Split",["l6","v20","v21","v22","v23","v24"],[1],["l25","l26","l27","l28","l29"]],["SamplePerfectTile",["l7"],[5,64],["v30","v31","v32","v33","v34"]],["Split",["l7","v30","v31","v32","v33","v34"],[1],["l35","l36","l37","l38","l39"]],["SamplePerfectTile",["l8"],[5,64],["v40","v41","v42","v43","v44"]],["Split",["l8","v40","v41","v42","v43","v44"],[1],["l45","l46","l47","l48","l49"]],["SamplePerfectTile",["l9"],[3,64],["v50","v51","v52"]],["Split",["l9","v50","v51","v52"],[1],["l53","l54","l55"]],["Reorder",["l15","l25","l35","l45","l16","l26","l36","l46","l17","l27","l37","l47","l53","l54","l18","l28","l38","l48","l55","l19","l29","l39","l49"],[],[]],["Fuse",["l15","l25","l35","l45"],[1],["l56"]],["Bind",["l56"],["blockIdx.x"],[]],["Fuse",["l16","l26","l36","l46"],[1],["l57"]],["Bind",["l57"],["vthread.x"],[]],["Fuse",["l17","l27","l37","l47"],[1],["l58"]],["Bind",["l58"],["threadIdx.x"],[]],["Annotate",["b0",32],["meta_schedule.thread_extent_low_inclusive"],[]],["Annotate",["b0",256],["meta_schedule.thread_extent_high_inclusive"],[]],["CacheWrite",["b0",[]],[0,"local"],["b59"]],["ReverseComputeAt",["b59","l58"],[1,-1],[]],["CacheRead",["b0",["b0"]],[0,"shared"],["b60"]],["ComputeAt",["b60","l53"],[1,-1],[]],["GetLoops",["b60"],[],["l61","l62","l63","l64","l65","l66","l67","l68"]],["Fuse",["l65","l66","l67","l68"],[1],["l69"]],["SampleCategorical",[],[[1,2,3,4],[0.25,0.25,0.25,0.25]],["v70"]],["Annotate",["b60","v70"],["meta_schedule.cooperative_fetch"],[]],["CacheRead",["b0",["b0"]],[1,"shared"],["b71"]],["ComputeAt",["b71","l53"],[1,-1],[]],["GetLoops",["b71"],[],["l72","l73","l74","l75","l76","l77","l78","l79"]],["Fuse",["l76","l77","l78","l79"],[1],["l80"]],["SampleCategorical",[],[[1,2,3,4],[0.25,0.25,0.25,0.25]],["v81"]],["Annotate",["b71","v81"],["meta_schedule.cooperative_fetch"],[]],["ReverseComputeInline",["b3"],[],[]],["ReverseComputeInline",["b2"],[],[]],["ReverseComputeInline",["b1"],[],[]],["SampleCategorical",[],[[0,16,64,512,1024],[0.2000000000000000111,0.2000000000000000111,0.2000000000000000111,0.2000000000000000111,0.2000000000000000111]],["v82"]],["Annotate",["b4","v82"],["meta_schedule.unroll_explicit"],[]],["EnterPostproc",[],[],[]],["Unannotate",["b60"],["meta_schedule.cooperative_fetch"],[]],["GetLoops",["b60"],[],["l83","l84","l85","l86","l87"]],["Split",["l87","None",32,4],[1],["l88","l89","l90"]],["Vectorize",["l90"],[],[]],["Bind",["l89"],["threadIdx.x"],[]],["Unannotate",["b71"],["meta_schedule.cooperative_fetch"],[]],["GetLoops",["b71"],[],["l91","l92","l93","l94","l95"]],["Split",["l95","None",32],[1],["l96","l97"]],["Bind",["l97"],["threadIdx.x"],[]],["GetBlock",[],["root","main"],["b98"]],["Unannotate",["b98"],["meta_schedule.unroll_explicit"],[]],["GetChildBlocks",["b98"],[],["b99","b100","b101","b102"]],["GetLoops",["b99"],[],["l103","l104","l105","l106","l107","l108","l109"]],["GetLoops",["b100"],[],["l110","l111","l112","l113","l114","l115"]],["GetLoops",["b101"],[],["l116","l117","l118","l119","l120","l121","l122","l123","l124","l125","l126","l127","l128","l129"]],["Annotate",["l116",16],["pragma_auto_unroll_max_step"],[]],["Annotate",["l116",1],["pragma_unroll_explicit"],[]],["GetLoops",["b102"],[],["l130","l131","l132","l133","l134","l135","l136"]],["GetBlock",[],["NT_matmul","main"],["b137"]],["GetLoops",["b137"],[],["l138","l139","l140","l141","l142","l143","l144","l145","l146","l147","l148","l149","l150","l151"]],["DecomposeReduction",["b137","l141"],[],["b152"]]],[[7,[1,1,1,1,1]],[9,[16,1,2,1,1]],[11,[8,1,4,1,4]],[13,[8,1,4,2,2]],[15,[10,4,2]],[32,3],[38,2],[43,1]]],[0.00013468619647577091919],{"host":{"keys":["cpu"],"kind":"llvm","tag":""},"keys":["metal","gpu"],"kind":"metal","max_function_args":31,"max_num_threads":256,"max_shared_memory_per_block":32768,"max_threads_per_block":256,"tag":"","thread_warp_size":32},[["TENSOR","float32",[1,32,128,80]],["TENSOR","float32",[1,32,128,80]],["TENSOR","float32",[1,1,128,128]],["TENSOR","float32",[1,32,128,128]]]]]
[8,[[[["GetBlock",[],["T_transpose","main"],["b0"]],["GetLoops",["b0"],[],["l1","l2","l3","l4"]],["Fuse",["l1","l2","l3","l4"],[1],["l5"]],["SampleCategorical",[],[[32,64,128,256],[0.25,0.25,0.25,0.25]],["v6"]],["Split",["l5","None","v6"],[1],["l7","l8"]],["Bind",["l7"],["blockIdx.x"],[]],["Bind",["l8"],["threadIdx.x"],[]],["EnterPostproc",[],[],[]]],[[3,0]]],[2.7464616815742396556e-05],{"host":{"keys":["cpu"],"kind":"llvm","tag":""},"keys":["metal","gpu"],"kind":"metal","max_function_args":31,"max_num_threads":256,"max_shared_memory_per_block":32768,"max_threads_per_block":256,"tag":"","thread_warp_size":32},[["TENSOR","float32",[1,1,32,80]],["TENSOR","float32",[1,32,1,80]]]]]
[9,[[[["GetBlock",[],["decode","main"],["b0"]],["GetLoops",["b0"],[],["l1","l2"]],["Split",["l1","None",8],[1],["l3","l4"]],["SamplePerfectTile",["l3"],[3,4],["v5","v6","v7"]],["SamplePerfectTile",["l2"],[2,16],["v8","v9"]],["Split",["l3","v5","v6","v7"],[1],["l10","l11","l12"]],["Split",["l2","v8","v9"],[1],["l13","l14"]],["Reorder",["l10","l13","l11","l14","l12","l4"],[],[]],["Bind",["l10"],["blockIdx.y"],[]],["Bind",["l13"],["blockIdx.x"],[]],["Bind",["l11"],["threadIdx.y"],[]],["Bind",["l14"],["threadIdx.x"],[]],["Unroll",["l4"],[],[]],["CacheWrite",["b0",[]],[0,"shared"],["b15"]],["ComputeInline",["b15"],[],[]],["GetBlock",[],["T_transpose","main"],["b16"]],["ReverseComputeAt",["b16","l13"],[1,-1],[]],["GetLoops",["b16"],[],["l17","l18","l19","l20"]],["Fuse",["l19","l20"],[1],["l21"]],["Split",["l21","None","v6","v9",4],[1],["l22","l23","l24","l25"]],["Bind",["l23"],["threadIdx.y"],[]],["Bind",["l24"],["threadIdx.x"],[]],["Vectorize",["l25"],[],[]],["StorageAlign",["b0"],[0,0,32,1],[]],["EnterPostproc",[],[],[]]],[[3,[20,16,1]],[4,[512,5]]]],[0.00032735638904899137455],{"host":{"keys":["cpu"],"kind":"llvm","tag":""},"keys":["metal","gpu"],"kind":"metal","max_function_args":31,"max_num_threads":256,"max_shared_memory_per_block":32768,"max_threads_per_block":256,"tag":"","thread_warp_size":32},[["TENSOR","uint32",[320,2560]],["TENSOR","uint32",[80,2560]],["TENSOR","float32",[2560,2560]]]]]
[10,[[[["GetBlock",[],["A_red_temp","main"],["b0"]],["GetBlock",[],["T_layer_norm","main"],["b1"]],["GetBlock",[],["root","main"],["b2"]],["SampleCategorical",[],[[4,8,16,32,64,128,256,512],[0.125,0.125,0.125,0.125,0.125,0.125,0.125,0.125]],["v3"]],["GetLoops",["b0"],[],["l4","l5","l6"]],["Split",["l6","None","v3"],[1],["l7","l8"]],["Bind",["l8"],["threadIdx.x"],[]],["SampleCategorical",[],[[0,16,64,512,1024],[0.2000000000000000111,0.2000000000000000111,0.2000000000000000111,0.2000000000000000111,0.2000000000000000111]],["v9"]],["Annotate",["b2","v9"],["meta_schedule.unroll_explicit"],[]],["GetLoops",["b1"],[],["l10","l11","l12"]],["Fuse",["l10","l11","l12"],[1],["l13"]],["Split",["l13","None",256,256],[1],["l14","l15","l16"]],["Reorder",["l15","l16","l14"],[],[]],["Bind",["l15"],["blockIdx.x"],[]],["Bind",["l16"],["threadIdx.x"],[]],["GetLoops",["b0"],[],["l17","l18","l19","l20"]],["Fuse",["l17","l18"],[1],["l21"]],["Bind",["l21"],["blockIdx.x"],[]],["EnterPostproc",[],[],[]],["GetBlock",[],["root","main"],["b22"]],["Unannotate",["b22"],["meta_schedule.unroll_explicit"],[]],["GetChildBlocks",["b22"],[],["b23","b24"]],["GetLoops",["b23"],[],["l25","l26","l27"]],["Annotate",["l25",512],["pragma_auto_unroll_max_step"],[]],["Annotate",["l25",1],["pragma_unroll_explicit"],[]],["GetLoops",["b24"],[],["l28","l29","l30"]]],[[3,4],[7,3]]],[6.1336637312186975441e-05],{"host":{"keys":["cpu"],"kind":"llvm","tag":""},"keys":["metal","gpu"],"kind":"metal","max_function_args":31,"max_num_threads":256,"max_shared_memory_per_block":32768,"max_threads_per_block":256,"tag":"","thread_warp_size":32},[["TENSOR","float32",[1,128,2560]],["TENSOR","float32",[2560]],["TENSOR","float32",[2560]],["TENSOR","float32",[1,128,2560]]]]]
[11,[[[["GetBlock",[],["T_divide","main"],["b0"]],["GetLoops",["b0"],[],["l1","l2","l3"]],["Fuse",["l1","l2","l3"],[1],["l4"]],["SampleCategorical",[],[[32,64,128,256],[0.25,0.25,0.25,0.25]],["v5"]],["Split",["l4","None","v5"],[1],["l6","l7"]],["Bind",["l6"],["blockIdx.x"],[]],["Bind",["l7"],["threadIdx.x"],[]],["EnterPostproc",[],[],[]]],[[3,2]]],[2.7704702223829331828e-05],{"host":{"keys":["cpu"],"kind":"llvm","tag":""},"keys":["metal","gpu"],"kind":"metal","max_function_args":31,"max_num_threads":256,"max_shared_memory_per_block":32768,"max_threads_per_block":256,"tag":"","thread_warp_size":32},[["TENSOR","float32",[1,1,50432]],["TENSOR","float32",[]],["TENSOR","float32",[1,1,50432]]]]]
[12,[[[["GetBlock",[],["A_red_temp","main"],["b0"]],["GetBlock",[],["T_layer_norm","main"],["b1"]],["GetBlock",[],["root","main"],["b2"]],["SampleCategorical",[],[[4,8,16,32,64,128,256,512],[0.125,0.125,0.125,0.125,0.125,0.125,0.125,0.125]],["v3"]],["GetLoops",["b0"],[],["l4","l5","l6"]],["Split",["l6","None","v3"],[1],["l7","l8"]],["Bind",["l8"],["threadIdx.x"],[]],["SampleCategorical",[],[[0,16,64,512,1024],[0.2000000000000000111,0.2000000000000000111,0.2000000000000000111,0.2000000000000000111,0.2000000000000000111]],["v9"]],["Annotate",["b2","v9"],["meta_schedule.unroll_explicit"],[]],["GetLoops",["b1"],[],["l10","l11","l12"]],["Fuse",["l10","l11","l12"],[1],["l13"]],["SampleCategorical",[],[[32,64,128,256],[0.25,0.25,0.25,0.25]],["v14"]],["Split",["l13","None","v14"],[1],["l15","l16"]],["Bind",["l15"],["blockIdx.x"],[]],["Bind",["l16"],["threadIdx.x"],[]],["GetLoops",["b0"],[],["l17","l18","l19","l20"]],["Fuse",["l17","l18"],[1],["l21"]],["Bind",["l21"],["blockIdx.x"],[]],["EnterPostproc",[],[],[]],["GetBlock",[],["root","main"],["b22"]],["Unannotate",["b22"],["meta_schedule.unroll_explicit"],[]],["GetChildBlocks",["b22"],[],["b23","b24"]],["GetLoops",["b23"],[],["l25","l26","l27"]],["Annotate",["l25",64],["pragma_auto_unroll_max_step"],[]],["Annotate",["l25",1],["pragma_unroll_explicit"],[]],["GetLoops",["b24"],[],["l28","l29"]]],[[3,1],[7,2],[11,0]]],[5.499494003795066103e-05],{"host":{"keys":["cpu"],"kind":"llvm","tag":""},"keys":["metal","gpu"],"kind":"metal","max_function_args":31,"max_num_threads":256,"max_shared_memory_per_block":32768,"max_threads_per_block":256,"tag":"","thread_warp_size":32},[["TENSOR","float32",[1,1,2560]],["TENSOR","float32",[2560]],["TENSOR","float32",[2560]],["TENSOR","float32",[1,1,2560]]]]]
[13,[[[["GetBlock",[],["slice","main"],["b0"]],["GetBlock",[],["compute","main"],["b1"]],["ReverseComputeInline",["b1"],[],[]],["GetLoops",["b0"],[],["l2","l3","l4"]],["Fuse",["l2","l3","l4"],[1],["l5"]],["SampleCategorical",[],[[32,64,128,256],[0.25,0.25,0.25,0.25]],["v6"]],["Split",["l5","None","v6"],[1],["l7","l8"]],["Bind",["l7"],["blockIdx.x"],[]],["Bind",["l8"],["threadIdx.x"],[]],["EnterPostproc",[],[],[]]],[[5,0]]],[2.747220699815837772e-05],{"host":{"keys":["cpu"],"kind":"llvm","tag":""},"keys":["metal","gpu"],"kind":"metal","max_function_args":31,"max_num_threads":256,"max_shared_memory_per_block":32768,"max_threads_per_block":256,"tag":"","thread_warp_size":32},[["TENSOR","float32",[1,1,2560]],["TENSOR","float32",[1,1,2560]]]]]
[14,[[[["GetBlock",[],["T_softmax_maxelem","main"],["b0"]],["GetBlock",[],["T_softmax_exp","main"],["b1"]],["GetBlock",[],["T_softmax_expsum","main"],["b2"]],["GetBlock",[],["T_softmax_norm","main"],["b3"]],["GetBlock",[],["root","main"],["b4"]],["ComputeInline",["b1"],[],[]],["GetConsumers",["b2"],[],["b5"]],["GetLoops",["b5"],[],["l6","l7","l8"]],["SampleCategorical",[],[[4,8,16,32,64,128,256,512],[0.125,0.125,0.125,0.125,0.125,0.125,0.125,0.125]],["v9"]],["Split",["l8","None","v9"],[1],["l10","l11"]],["Bind",["l11"],["threadIdx.x"],[]],["ComputeAt",["b2","l7"],[1,-1],[]],["SetScope",["b2"],[0,"shared"],[]],["GetLoops",["b2"],[],["l12","l13","l14","l15","l16"]],["Split",["l16","None","v9"],[1],["l17","l18"]],["Bind",["l18"],["threadIdx.x"],[]],["GetConsumers",["b0"],[],["b19","b20"]],["GetLoops",["b19"],[],["l21","l22","l23","l24","l25","l26"]],["ComputeAt",["b0","l22"],[1,-1],[]],["SetScope",["b0"],[0,"shared"],[]],["GetLoops",["b0"],[],["l27","l28","l29","l30","l31"]],["Split",["l31","None","v9"],[1],["l32","l33"]],["Bind",["l33"],["threadIdx.x"],[]],["SampleCategorical",[],[[0,16,64,512,1024],[0.2000000000000000111,0.2000000000000000111,0.2000000000000000111,0.2000000000000000111,0.2000000000000000111]],["v34"]],["Annotate",["b4","v34"],["meta_schedule.unroll_explicit"],[]],["GetLoops",["b3"],[],["l35","l36","l37","l38"]],["Fuse",["l35","l36"],[1],["l39"]],["Bind",["l39"],["blockIdx.x"],[]],["EnterPostproc",[],[],[]],["GetBlock",[],["root","main"],["b40"]],["Unannotate",["b40"],["meta_schedule.unroll_explicit"],[]],["GetChildBlocks",["b40"],[],["b41","b42","b43"]],["GetLoops",["b41"],[],["l44","l45","l46","l47","l48"]],["Annotate",["l44",1024],["pragma_auto_unroll_max_step"],[]],["Annotate",["l44",1],["pragma_unroll_explicit"],[]],["GetLoops",["b42"],[],["l49","l50","l51","l52","l53"]],["Annotate",["l49",1024],["pragma_auto_unroll_max_step"],[]],["Annotate",["l49",1],["pragma_unroll_explicit"],[]],["GetLoops",["b43"],[],["l54","l55","l56"]]],[[8,6],[23,4]]],[7.0029933944069436822e-05],{"host":{"keys":["cpu"],"kind":"llvm","tag":""},"keys":["metal","gpu"],"kind":"metal","max_function_args":31,"max_num_threads":256,"max_shared_memory_per_block":32768,"max_threads_per_block":256,"tag":"","thread_warp_size":32},[["TENSOR","float32",[1,1,50432]],["TENSOR","float32",[1,1,50432]]]]]
[15,[[[["GetBlock",[],["matmul","main"],["b0"]],["GetBlock",[],["root","main"],["b1"]],["Annotate",["b0","\"SSSRRSRS\""],["meta_schedule.tiling_structure"],[]],["GetLoops",["b0"],[],["l2","l3","l4","l5","l6"]],["SamplePerfectTile",["l2"],[5,64],["v7","v8","v9","v10","v11"]],["Split",["l2","v7","v8","v9","v10","v11"],[1],["l12","l13","l14","l15","l16"]],["SamplePerfectTile",["l3"],[5,64],["v17","v18","v19","v20","v21"]],["Split",["l3","v17","v18","v19","v20","v21"],[1],["l22","l23","l24","l25","l26"]],["SamplePerfectTile",["l4"],[5,64],["v27","v28","v29","v30","v31"]],["Split",["l4","v27","v28","v29","v30","v31"],[1],["l32","l33","l34","l35","l36"]],["SamplePerfectTile",["l5"],[5,64],["v37","v38","v39","v40","v41"]],["Split",["l5","v37","v38","v39","v40","v41"],[1],["l42","l43","l44","l45","l46"]],["SamplePerfectTile",["l6"],[3,64],["v47","v48","v49"]],["Split",["l6","v47","v48","v49"],[1],["l50","l51","l52"]],["Reorder",["l12","l22","l32","l42","l13","l23","l33","l43","l14","l24","l34","l44","l50","l51","l15","l25","l35","l45","l52","l16","l26","l36","l46"],[],[]],["Fuse",["l12","l22","l32","l42"],[1],["l53"]],["Bind",["l53"],["blockIdx.x"],[]],["Fuse",["l13","l23","l33","l43"],[1],["l54"]],["Bind",["l54"],["vthread.x"],[]],["Fuse",["l14","l24","l34","l44"],[1],["l55"]],["Bind",["l55"],["threadIdx.x"],[]],["Annotate",["b0",32],["meta_schedule.thread_extent_low_inclusive"],[]],["Annotate",["b0",256],["meta_schedule.thread_extent_high_inclusive"],[]],["CacheWrite",["b0",[]],[0,"local"],["b56"]],["ReverseComputeAt",["b56","l55"],[1,-1],[]],["CacheRead",["b0",["b0"]],[0,"shared"],["b57"]],["ComputeAt",["b57","l50"],[1,-1],[]],["GetLoops",["b57"],[],["l58","l59","l60","l61","l62","l63","l64","l65"]],["Fuse",["l62","l63","l64","l65"],[1],["l66"]],["SampleCategorical",[],[[1,2,3,4],[0.25,0.25,0.25,0.25]],["v67"]],["Annotate",["b57","v67"],["meta_schedule.cooperative_fetch"],[]],["CacheRead",["b0",["b0"]],[1,"shared"],["b68"]],["ComputeAt",["b68","l50"],[1,-1],[]],["GetLoops",["b68"],[],["l69","l70","l71","l72","l73","l74","l75","l76"]],["Fuse",["l73","l74","l75","l76"],[1],["l77"]],["SampleCategorical",[],[[1,2,3,4],[0.25,0.25,0.25,0.25]],["v78"]],["Annotate",["b68","v78"],["meta_schedule.cooperative_fetch"],[]],["SampleCategorical",[],[[0,16,64,512,1024],[0.2000000000000000111,0.2000000000000000111,0.2000000000000000111,0.2000000000000000111,0.2000000000000000111]],["v79"]],["Annotate",["b1","v79"],["meta_schedule.unroll_explicit"],[]],["EnterPostproc",[],[],[]],["Unannotate",["b57"],["meta_schedule.cooperative_fetch"],[]],["GetLoops",["b57"],[],["l80","l81","l82","l83","l84"]],["Split",["l84","None",160,4],[1],["l85","l86","l87"]],["Vectorize",["l87"],[],[]],["Bind",["l86"],["threadIdx.x"],[]],["Unannotate",["b68"],["meta_schedule.cooperative_fetch"],[]],["GetLoops",["b68"],[],["l88","l89","l90","l91","l92"]],["Split",["l92","None",160,2],[1],["l93","l94","l95"]],["Vectorize",["l95"],[],[]],["Bind",["l94"],["threadIdx.x"],[]],["GetBlock",[],["root","main"],["b96"]],["Unannotate",["b96"],["meta_schedule.unroll_explicit"],[]],["GetChildBlocks",["b96"],[],["b97","b98","b99","b100"]],["GetLoops",["b97"],[],["l101","l102","l103","l104","l105","l106","l107"]],["GetLoops",["b98"],[],["l108","l109","l110","l111","l112","l113","l114"]],["GetLoops",["b99"],[],["l115","l116","l117","l118","l119","l120","l121","l122","l123","l124","l125","l126","l127","l128"]],["Annotate",["l115",64],["pragma_auto_unroll_max_step"],[]],["Annotate",["l115",1],["pragma_unroll_explicit"],[]],["GetLoops",["b100"],[],["l129","l130","l131","l132","l133","l134","l135"]],["GetBlock",[],["matmul","main"],["b136"]],["GetLoops",["b136"],[],["l137","l138","l139","l140","l141","l142","l143","l144","l145","l146","l147","l148","l149","l150"]],["DecomposeReduction",["b136","l140"],[],["b151"]]],[[4,[1,1,1,1,1]],[6,[8,4,1,1,1]],[8,[16,4,2,1,1]],[10,[1,1,80,1,1]],[12,[8,4,1]],[29,3],[35,1],[37,2]]],[5.0514485221674876292e-05],{"host":{"keys":["cpu"],"kind":"llvm","tag":""},"keys":["metal","gpu"],"kind":"metal","max_function_args":31,"max_num_threads":256,"max_shared_memory_per_block":32768,"max_threads_per_block":256,"tag":"","thread_warp_size":32},[["TENSOR","float32",[1,32,128,32]],["TENSOR","float32",[1,32,32,80]],["TENSOR","float32",[1,32,128,80]]]]]
[16,[[[["GetBlock",[],["matmul","main"],["b0"]],["GetBlock",[],["decode","main"],["b1"]],["GetBlock",[],["T_add","main"],["b2"]],["GetBlock",[],["T_multiply","main"],["b3"]],["GetBlock",[],["compute","main"],["b4"]],["GetBlock",[],["T_multiply_1","main"],["b5"]],["GetBlock",[],["T_add_1","main"],["b6"]],["GetBlock",[],["T_multiply_2","main"],["b7"]],["CacheWrite",["b0",[]],[0,"local"],["b8"]],["GetLoops",["b0"],[],["l9","l10","l11","l12"]],["SamplePerfectTile",["l11"],[3,-1],["v13","v14","v15"]],["Split",["l11","v13","v14","v15"],[1],["l16","l17","l18"]],["Fuse",["l9","l10","l16"],[1],["l19"]],["Split",["l12","None",8],[1],["l20","l21"]],["SamplePerfectTile",["l20"],[2,-1],["v22","v23"]],["Split",["l20","v22","v23"],[1],["l24","l25"]],["Fuse",["l25","l21"],[1],["l26"]],["Unroll",["l26"],[],[]],["Bind",["l19"],["blockIdx.x"],[]],["Bind",["l17"],["vthread.x"],[]],["Bind",["l18"],["threadIdx.x"],[]],["Reorder",["l19","l17","l18","l24","l26"],[],[]],["ComputeAt",["b1","l24"],[1,-1],[]],["SetScope",["b1"],[0,"local"],[]],["GetLoops",["b1"],[],["l27","l28","l29","l30","l31","l32"]],["Split",["l31","None",8],[1],["l33","l34"]],["Unroll",["l34"],[],[]],["CacheRead",["b0",[]],[0,"shared"],["b35"]],["ComputeAt",["b35","l18"],[1,-1],[]],["GetLoops",["b35"],[],["l36","l37","l38","l39","l40","l41"]],["Fuse",["l40","l41"],[1],["l42"]],["SampleCategorical",[],[[1,2,3,4],[0.25,0.25,0.25,0.25]],["v43"]],["Split",["l42","None","v15","v43"],[1],["l44","l45","l46"]],["Bind",["l45"],["threadIdx.x"],[]],["Vectorize",["l46"],[],[]],["StorageAlign",["b35"],[0,-2,32,8],[]],["ComputeInline",["b2"],[],[]],["ComputeInline",["b3"],[],[]],["ComputeInline",["b4"],[],[]],["ComputeInline",["b5"],[],[]],["ComputeInline",["b6"],[],[]],["ReverseComputeInline",["b7"],[],[]],["ReverseComputeAt",["b8","l18"],[1,-1],[]],["DecomposeReduction",["b0","l24"],[],["b47"]],["EnterPostproc",[],[],[]]],[[10,[40,1,256]],[14,[320,1]],[31,0]]],[0.00020675427049180326497],{"host":{"keys":["cpu"],"kind":"llvm","tag":""},"keys":["metal","gpu"],"kind":"metal","max_function_args":31,"max_num_threads":256,"max_shared_memory_per_block":32768,"max_threads_per_block":256,"tag":"","thread_warp_size":32},[["TENSOR","uint32",[320,10240]],["TENSOR","uint32",[80,10240]],["TENSOR","float32",[1,1,2560]],["TENSOR","float32",[10240]],["TENSOR","float32",[1,1,10240]]]]]
[17,[[[["GetBlock",[],["T_reshape","main"],["b0"]],["GetLoops",["b0"],[],["l1"]],["Fuse",["l1"],[1],["l2"]],["Split",["l2","None",1],[1],["l3","l4"]],["Bind",["l3"],["blockIdx.x"],[]],["Bind",["l4"],["threadIdx.x"],[]],["EnterPostproc",[],[],[]]],[]],[2.8052573037725731962e-05],{"host":{"keys":["cpu"],"kind":"llvm","tag":""},"keys":["metal","gpu"],"kind":"metal","max_function_args":31,"max_num_threads":256,"max_shared_memory_per_block":32768,"max_threads_per_block":256,"tag":"","thread_warp_size":32},[["TENSOR","int32",[1,1]],["TENSOR","int32",[1]]]]]
[18,[[[["GetBlock",[],["T_transpose","main"],["b0"]],["GetBlock",[],["T_reshape","main"],["b1"]],["ReverseComputeInline",["b1"],[],[]],["GetLoops",["b0"],[],["l2","l3","l4","l5"]],["Fuse",["l2","l3","l4","l5"],[1],["l6"]],["SampleCategorical",[],[[32,64,128,256],[0.25,0.25,0.25,0.25]],["v7"]],["Split",["l6","None","v7"],[1],["l8","l9"]],["Bind",["l8"],["blockIdx.x"],[]],["Bind",["l9"],["threadIdx.x"],[]],["EnterPostproc",[],[],[]]],[[5,1]]],[2.7781843296781038975e-05],{"host":{"keys":["cpu"],"kind":"llvm","tag":""},"keys":["metal","gpu"],"kind":"metal","max_function_args":31,"max_num_threads":256,"max_shared_memory_per_block":32768,"max_threads_per_block":256,"tag":"","thread_warp_size":32},[["TENSOR","float32",[1,32,1,80]],["TENSOR","float32",[1,1,2560]]]]]
[19,[[[["GetBlock",[],["NT_matmul","main"],["b0"]],["GetBlock",[],["T_add","main"],["b1"]],["GetBlock",[],["compute","main"],["b2"]],["GetBlock",[],["T_add_1","main"],["b3"]],["GetBlock",[],["root","main"],["b4"]],["Annotate",["b0","\"SSSRRSRS\""],["meta_schedule.tiling_structure"],[]],["GetLoops",["b0"],[],["l5","l6","l7","l8"]],["SamplePerfectTile",["l5"],[5,64],["v9","v10","v11","v12","v13"]],["Split",["l5","v9","v10","v11","v12","v13"],[1],["l14","l15","l16","l17","l18"]],["SamplePerfectTile",["l6"],[5,64],["v19","v20","v21","v22","v23"]],["Split",["l6","v19","v20","v21","v22","v23"],[1],["l24","l25","l26","l27","l28"]],["SamplePerfectTile",["l7"],[5,64],["v29","v30","v31","v32","v33"]],["Split",["l7","v29","v30","v31","v32","v33"],[1],["l34","l35","l36","l37","l38"]],["SamplePerfectTile",["l8"],[3,64],["v39","v40","v41"]],["Split",["l8","v39","v40","v41"],[1],["l42","l43","l44"]],["Reorder",["l14","l24","l34","l15","l25","l35","l16","l26","l36","l42","l43","l17","l27","l37","l44","l18","l28","l38"],[],[]],["Fuse",["l14","l24","l34"],[1],["l45"]],["Bind",["l45"],["blockIdx.x"],[]],["Fuse",["l15","l25","l35"],[1],["l46"]],["Bind",["l46"],["vthread.x"],[]],["Fuse",["l16","l26","l36"],[1],["l47"]],["Bind",["l47"],["threadIdx.x"],[]],["Annotate",["b0",32],["meta_schedule.thread_extent_low_inclusive"],[]],["Annotate",["b0",256],["meta_schedule.thread_extent_high_inclusive"],[]],["CacheWrite",["b0",[]],[0,"local"],["b48"]],["ReverseComputeAt",["b48","l47"],[1,-1],[]],["CacheRead",["b0",["b0"]],[0,"shared"],["b49"]],["ComputeAt",["b49","l42"],[1,-1],[]],["GetLoops",["b49"],[],["l50","l51","l52","l53","l54","l55","l56"]],["Fuse",["l54","l55","l56"],[1],["l57"]],["SampleCategorical",[],[[1,2,3,4],[0.25,0.25,0.25,0.25]],["v58"]],["Annotate",["b49","v58"],["meta_schedule.cooperative_fetch"],[]],["CacheRead",["b0",["b0"]],[1,"shared"],["b59"]],["ComputeAt",["b59","l42"],[1,-1],[]],["GetLoops",["b59"],[],["l60","l61","l62","l63","l64","l65"]],["Fuse",["l64","l65"],[1],["l66"]],["SampleCategorical",[],[[1,2,3,4],[0.25,0.25,0.25,0.25]],["v67"]],["Annotate",["b59","v67"],["meta_schedule.cooperative_fetch"],[]],["ReverseComputeInline",["b3"],[],[]],["ReverseComputeInline",["b2"],[],[]],["ReverseComputeInline",["b1"],[],[]],["SampleCategorical",[],[[0,16,64,512,1024],[0.2000000000000000111,0.2000000000000000111,0.2000000000000000111,0.2000000000000000111,0.2000000000000000111]],["v68"]],["Annotate",["b4","v68"],["meta_schedule.unroll_explicit"],[]],["EnterPostproc",[],[],[]],["Unannotate",["b49"],["meta_schedule.cooperative_fetch"],[]],["GetLoops",["b49"],[],["l69","l70","l71","l72","l73"]],["Split",["l73","None",128,2],[1],["l74","l75","l76"]],["Vectorize",["l76"],[],[]],["Bind",["l75"],["threadIdx.x"],[]],["Unannotate",["b59"],["meta_schedule.cooperative_fetch"],[]],["GetLoops",["b59"],[],["l77","l78","l79","l80","l81"]],["Split",["l81","None",128,2],[1],["l82","l83","l84"]],["Vectorize",["l84"],[],[]],["Bind",["l83"],["threadIdx.x"],[]],["GetBlock",[],["root","main"],["b85"]],["Unannotate",["b85"],["meta_schedule.unroll_explicit"],[]],["GetChildBlocks",["b85"],[],["b86","b87","b88","b89"]],["GetLoops",["b86"],[],["l90","l91","l92","l93","l94","l95","l96"]],["GetLoops",["b87"],[],["l97","l98","l99","l100","l101","l102","l103"]],["GetLoops",["b88"],[],["l104","l105","l106","l107","l108","l109","l110","l111","l112","l113","l114","l115"]],["Annotate",["l104",64],["pragma_auto_unroll_max_step"],[]],["Annotate",["l104",1],["pragma_unroll_explicit"],[]],["GetLoops",["b89"],[],["l116","l117","l118","l119","l120","l121"]],["GetBlock",[],["NT_matmul","main"],["b122"]],["GetLoops",["b122"],[],["l123","l124","l125","l126","l127","l128","l129","l130","l131","l132","l133","l134"]],["DecomposeReduction",["b122","l126"],[],["b135"]]],[[7,[1,1,1,1,1]],[9,[1,4,32,1,1]],[11,[40,1,4,16,1]],[13,[640,4,4]],[30,1],[36,1],[41,2]]],[0.0048878430333333337116],{"host":{"keys":["cpu"],"kind":"llvm","tag":""},"keys":["metal","gpu"],"kind":"metal","max_function_args":31,"max_num_threads":256,"max_shared_memory_per_block":32768,"max_threads_per_block":256,"tag":"","thread_warp_size":32},[["TENSOR","float32",[1,128,10240]],["TENSOR","float32",[2560,10240]],["TENSOR","float32",[2560]],["TENSOR","float32",[1,128,2560]],["TENSOR","float32",[1,128,2560]]]]]
[20,[[[["GetBlock",[],["matmul","main"],["b0"]],["GetBlock",[],["decode","main"],["b1"]],["GetBlock",[],["T_add","main"],["b2"]],["GetBlock",[],["compute","main"],["b3"]],["GetBlock",[],["T_add_1","main"],["b4"]],["CacheWrite",["b0",[]],[0,"local"],["b5"]],["GetLoops",["b0"],[],["l6","l7","l8","l9"]],["SamplePerfectTile",["l8"],[3,-1],["v10","v11","v12"]],["Split",["l8","v10","v11","v12"],[1],["l13","l14","l15"]],["Fuse",["l6","l7","l13"],[1],["l16"]],["Split",["l9","None",8],[1],["l17","l18"]],["SamplePerfectTile",["l17"],[3,-1],["v19","v20","v21"]],["Split",["l17","v19","v20","v21"],[1],["l22","l23","l24"]],["Fuse",["l24","l18"],[1],["l25"]],["Unroll",["l25"],[],[]],["Bind",["l16"],["blockIdx.x"],[]],["Bind",["l14"],["vthread.x"],[]],["Bind",["l15"],["threadIdx.x"],[]],["Reorder",["l16","l14","l15","l22","l23","l25"],[],[]],["ComputeAt",["b1","l23"],[1,-1],[]],["SetScope",["b1"],[0,"local"],[]],["GetLoops",["b1"],[],["l26","l27","l28","l29","l30","l31","l32"]],["Split",["l31","None",8],[1],["l33","l34"]],["Unroll",["l34"],[],[]],["CacheRead",["b0",[]],[0,"shared"],["b35"]],["ComputeAt",["b35","l22"],[1,-1],[]],["GetLoops",["b35"],[],["l36","l37","l38","l39","l40","l41","l42"]],["Fuse",["l41","l42"],[1],["l43"]],["SampleCategorical",[],[[1,2,3,4],[0.25,0.25,0.25,0.25]],["v44"]],["Split",["l43","None","v12","v44"],[1],["l45","l46","l47"]],["Bind",["l46"],["threadIdx.x"],[]],["Vectorize",["l47"],[],[]],["StorageAlign",["b35"],[0,-2,32,8],[]],["ComputeInline",["b2"],[],[]],["ComputeInline",["b3"],[],[]],["ReverseComputeInline",["b4"],[],[]],["ReverseComputeAt",["b5","l15"],[1,-1],[]],["DecomposeReduction",["b0","l22"],[],["b48"]],["EnterPostproc",[],[],[]]],[[7,[80,1,32]],[11,[8,20,8]],[28,3]]],[0.00023137766270430904923],{"host":{"keys":["cpu"],"kind":"llvm","tag":""},"keys":["metal","gpu"],"kind":"metal","max_function_args":31,"max_num_threads":256,"max_shared_memory_per_block":32768,"max_threads_per_block":256,"tag":"","thread_warp_size":32},[["TENSOR","uint32",[1280,2560]],["TENSOR","uint32",[320,2560]],["TENSOR","float32",[1,1,10240]],["TENSOR","float32",[2560]],["TENSOR","float32",[1,1,2560]],["TENSOR","float32",[1,1,2560]]]]]
[21,[[[["GetBlock",[],["matmul","main"],["b0"]],["GetBlock",[],["decode","main"],["b1"]],["GetBlock",[],["T_add","main"],["b2"]],["CacheWrite",["b0",[]],[0,"local"],["b3"]],["GetLoops",["b0"],[],["l4","l5","l6","l7"]],["SamplePerfectTile",["l6"],[3,-1],["v8","v9","v10"]],["Split",["l6","v8","v9","v10"],[1],["l11","l12","l13"]],["Fuse",["l4","l5","l11"],[1],["l14"]],["Split",["l7","None",8],[1],["l15","l16"]],["SamplePerfectTile",["l15"],[2,-1],["v17","v18"]],["Split",["l15","v17","v18"],[1],["l19","l20"]],["Fuse",["l20","l16"],[1],["l21"]],["Unroll",["l21"],[],[]],["Bind",["l14"],["blockIdx.x"],[]],["Bind",["l12"],["vthread.x"],[]],["Bind",["l13"],["threadIdx.x"],[]],["Reorder",["l14","l12","l13","l19","l21"],[],[]],["ComputeAt",["b1","l19"],[1,-1],[]],["SetScope",["b1"],[0,"local"],[]],["GetLoops",["b1"],[],["l22","l23","l24","l25","l26","l27"]],["Split",["l26","None",8],[1],["l28","l29"]],["Unroll",["l29"],[],[]],["CacheRead",["b0",[]],[0,"shared"],["b30"]],["ComputeAt",["b30","l13"],[1,-1],[]],["GetLoops",["b30"],[],["l31","l32","l33","l34","l35","l36"]],["Fuse",["l35","l36"],[1],["l37"]],["SampleCategorical",[],[[1,2,3,4],[0.25,0.25,0.25,0.25]],["v38"]],["Split",["l37","None","v10","v38"],[1],["l39","l40","l41"]],["Bind",["l40"],["threadIdx.x"],[]],["Vectorize",["l41"],[],[]],["StorageAlign",["b30"],[0,-2,32,8],[]],["ReverseComputeInline",["b2"],[],[]],["ReverseComputeAt",["b3","l13"],[1,-1],[]],["DecomposeReduction",["b0","l19"],[],["b42"]],["EnterPostproc",[],[],[]]],[[5,[10,1,256]],[9,[320,1]],[26,0]]],[6.1942807278742752631e-05],{"host":{"keys":["cpu"],"kind":"llvm","tag":""},"keys":["metal","gpu"],"kind":"metal","max_function_args":31,"max_num_threads":256,"max_shared_memory_per_block":32768,"max_threads_per_block":256,"tag":"","thread_warp_size":32},[["TENSOR","uint32",[320,2560]],["TENSOR","uint32",[80,2560]],["TENSOR","float32",[1,1,2560]],["TENSOR","float32",[2560]],["TENSOR","float32",[1,1,2560]]]]]
[22,[[[["GetBlock",[],["compute","main"],["b0"]],["GetLoops",["b0"],[],["l1","l2","l3"]],["Fuse",["l1","l2","l3"],[1],["l4"]],["SampleCategorical",[],[[32,64,128,256],[0.25,0.25,0.25,0.25]],["v5"]],["Split",["l4","None","v5"],[1],["l6","l7"]],["Bind",["l6"],["blockIdx.x"],[]],["Bind",["l7"],["threadIdx.x"],[]],["EnterPostproc",[],[],[]]],[[3,0]]],[2.7479573340769658751e-05],{"host":{"keys":["cpu"],"kind":"llvm","tag":""},"keys":["metal","gpu"],"kind":"metal","max_function_args":31,"max_num_threads":256,"max_shared_memory_per_block":32768,"max_threads_per_block":256,"tag":"","thread_warp_size":32},[["TENSOR","float32",[1,1,2560]],["TENSOR","float32",[1,1,2560]]]]]
[23,[[[["GetBlock",[],["NT_matmul","main"],["b0"]],["GetBlock",[],["T_divide","main"],["b1"]],["GetBlock",[],["T_maximum","main"],["b2"]],["GetBlock",[],["T_minimum","main"],["b3"]],["GetBlock",[],["root","main"],["b4"]],["Annotate",["b0","\"SSSRRSRS\""],["meta_schedule.tiling_structure"],[]],["GetLoops",["b0"],[],["l5","l6","l7","l8","l9"]],["SamplePerfectTile",["l5"],[5,64],["v10","v11","v12","v13","v14"]],["Split",["l5","v10","v11","v12","v13","v14"],[1],["l15","l16","l17","l18","l19"]],["SamplePerfectTile",["l6"],[5,64],["v20","v21","v22","v23","v24"]],["Split",["l6","v20","v21","v22","v23","v24"],[1],["l25","l26","l27","l28","l29"]],["SamplePerfectTile",["l7"],[5,64],["v30","v31","v32","v33","v34"]],["Split",["l7","v30","v31","v32","v33","v34"],[1],["l35","l36","l37","l38","l39"]],["SamplePerfectTile",["l8"],[5,64],["v40","v41","v42","v43","v44"]],["Split",["l8","v40","v41","v42","v43","v44"],[1],["l45","l46","l47","l48","l49"]],["SamplePerfectTile",["l9"],[3,64],["v50","v51","v52"]],["Split",["l9","v50","v51","v52"],[1],["l53","l54","l55"]],["Reorder",["l15","l25","l35","l45","l16","l26","l36","l46","l17","l27","l37","l47","l53","l54","l18","l28","l38","l48","l55","l19","l29","l39","l49"],[],[]],["Fuse",["l15","l25","l35","l45"],[1],["l56"]],["Bind",["l56"],["blockIdx.x"],[]],["Fuse",["l16","l26","l36","l46"],[1],["l57"]],["Bind",["l57"],["vthread.x"],[]],["Fuse",["l17","l27","l37","l47"],[1],["l58"]],["Bind",["l58"],["threadIdx.x"],[]],["Annotate",["b0",32],["meta_schedule.thread_extent_low_inclusive"],[]],["Annotate",["b0",256],["meta_schedule.thread_extent_high_inclusive"],[]],["CacheWrite",["b0",[]],[0,"local"],["b59"]],["ReverseComputeAt",["b59","l58"],[1,-1],[]],["CacheRead",["b0",["b0"]],[0,"shared"],["b60"]],["ComputeAt",["b60","l53"],[1,-1],[]],["GetLoops",["b60"],[],["l61","l62","l63","l64","l65","l66","l67","l68"]],["Fuse",["l65","l66","l67","l68"],[1],["l69"]],["SampleCategorical",[],[[1,2,3,4],[0.25,0.25,0.25,0.25]],["v70"]],["Annotate",["b60","v70"],["meta_schedule.cooperative_fetch"],[]],["CacheRead",["b0",["b0"]],[1,"shared"],["b71"]],["ComputeAt",["b71","l53"],[1,-1],[]],["GetLoops",["b71"],[],["l72","l73","l74","l75","l76","l77","l78","l79"]],["Fuse",["l76","l77","l78","l79"],[1],["l80"]],["SampleCategorical",[],[[1,2,3,4],[0.25,0.25,0.25,0.25]],["v81"]],["Annotate",["b71","v81"],["meta_schedule.cooperative_fetch"],[]],["ReverseComputeInline",["b3"],[],[]],["ReverseComputeInline",["b2"],[],[]],["ReverseComputeInline",["b1"],[],[]],["SampleCategorical",[],[[0,16,64,512,1024],[0.2000000000000000111,0.2000000000000000111,0.2000000000000000111,0.2000000000000000111,0.2000000000000000111]],["v82"]],["Annotate",["b4","v82"],["meta_schedule.unroll_explicit"],[]],["EnterPostproc",[],[],[]],["Unannotate",["b60"],["meta_schedule.cooperative_fetch"],[]],["GetLoops",["b60"],[],["l83","l84","l85","l86","l87"]],["Split",["l87","None",32,2],[1],["l88","l89","l90"]],["Vectorize",["l90"],[],[]],["Bind",["l89"],["threadIdx.x"],[]],["Unannotate",["b71"],["meta_schedule.cooperative_fetch"],[]],["GetLoops",["b71"],[],["l91","l92","l93","l94","l95"]],["Split",["l95","None",32],[1],["l96","l97"]],["Bind",["l97"],["threadIdx.x"],[]],["GetBlock",[],["root","main"],["b98"]],["Unannotate",["b98"],["meta_schedule.unroll_explicit"],[]],["GetChildBlocks",["b98"],[],["b99","b100","b101","b102"]],["GetLoops",["b99"],[],["l103","l104","l105","l106","l107","l108","l109"]],["GetLoops",["b100"],[],["l110","l111","l112","l113","l114","l115"]],["GetLoops",["b101"],[],["l116","l117","l118","l119","l120","l121","l122","l123","l124","l125","l126","l127","l128","l129"]],["GetLoops",["b102"],[],["l130","l131","l132","l133","l134","l135","l136"]],["GetBlock",[],["NT_matmul","main"],["b137"]],["GetLoops",["b137"],[],["l138","l139","l140","l141","l142","l143","l144","l145","l146","l147","l148","l149","l150","l151"]],["DecomposeReduction",["b137","l141"],[],["b152"]]],[[7,[1,1,1,1,1]],[9,[16,2,1,1,1]],[11,[1,1,1,1,1]],[13,[2,1,32,1,2]],[15,[20,2,2]],[32,1],[38,0],[43,0]]],[3.1556419500645715201e-05],{"host":{"keys":["cpu"],"kind":"llvm","tag":""},"keys":["metal","gpu"],"kind":"metal","max_function_args":31,"max_num_threads":256,"max_shared_memory_per_block":32768,"max_threads_per_block":256,"tag":"","thread_warp_size":32},[["TENSOR","float32",[1,32,1,80]],["TENSOR","float32",[1,32,128,80]],["TENSOR","float32",[1,1,1,128]],["TENSOR","float32",[1,32,1,128]]]]]
[24,[[[["GetBlock",[],["take_decode","main"],["b0"]],["GetLoops",["b0"],[],["l1","l2"]],["Fuse",["l1","l2"],[1],["l3"]],["SampleCategorical",[],[[32,64,128,256],[0.25,0.25,0.25,0.25]],["v4"]],["Split",["l3","None","v4"],[1],["l5","l6"]],["Bind",["l5"],["blockIdx.x"],[]],["Bind",["l6"],["threadIdx.x"],[]],["EnterPostproc",[],[],[]]],[[3,1]]],[2.7890118132854578451e-05],{"host":{"keys":["cpu"],"kind":"llvm","tag":""},"keys":["metal","gpu"],"kind":"metal","max_function_args":31,"max_num_threads":256,"max_shared_memory_per_block":32768,"max_threads_per_block":256,"tag":"","thread_warp_size":32},[["TENSOR","uint32",[50432,320]],["TENSOR","uint32",[50432,80]],["TENSOR","int32",[1]],["TENSOR","float32",[1,2560]]]]]
[25,[[[["GetBlock",[],["T_reshape","main"],["b0"]],["GetLoops",["b0"],[],["l1","l2","l3"]],["Fuse",["l1","l2","l3"],[1],["l4"]],["SampleCategorical",[],[[32,64,128,256],[0.25,0.25,0.25,0.25]],["v5"]],["Split",["l4","None","v5"],[1],["l6","l7"]],["Bind",["l6"],["blockIdx.x"],[]],["Bind",["l7"],["threadIdx.x"],[]],["EnterPostproc",[],[],[]]],[[3,0]]],[2.7553402762827408016e-05],{"host":{"keys":["cpu"],"kind":"llvm","tag":""},"keys":["metal","gpu"],"kind":"metal","max_function_args":31,"max_num_threads":256,"max_shared_memory_per_block":32768,"max_threads_per_block":256,"tag":"","thread_warp_size":32},[["TENSOR","float32",[1,2560]],["TENSOR","float32",[1,1,2560]]]]]
[26,[[[["GetBlock",[],["matmul","main"],["b0"]],["GetBlock",[],["decode","main"],["b1"]],["CacheWrite",["b0",[]],[0,"local"],["b2"]],["GetLoops",["b0"],[],["l3","l4","l5","l6"]],["SamplePerfectTile",["l5"],[3,-1],["v7","v8","v9"]],["Split",["l5","v7","v8","v9"],[1],["l10","l11","l12"]],["Fuse",["l3","l4","l10"],[1],["l13"]],["Split",["l6","None",8],[1],["l14","l15"]],["SamplePerfectTile",["l14"],[2,-1],["v16","v17"]],["Split",["l14","v16","v17"],[1],["l18","l19"]],["Fuse",["l19","l15"],[1],["l20"]],["Unroll",["l20"],[],[]],["Bind",["l13"],["blockIdx.x"],[]],["Bind",["l11"],["vthread.x"],[]],["Bind",["l12"],["threadIdx.x"],[]],["Reorder",["l13","l11","l12","l18","l20"],[],[]],["ComputeAt",["b1","l18"],[1,-1],[]],["SetScope",["b1"],[0,"local"],[]],["GetLoops",["b1"],[],["l21","l22","l23","l24","l25","l26"]],["Split",["l25","None",8],[1],["l27","l28"]],["Unroll",["l28"],[],[]],["CacheRead",["b0",[]],[0,"shared"],["b29"]],["ComputeAt",["b29","l12"],[1,-1],[]],["GetLoops",["b29"],[],["l30","l31","l32","l33","l34","l35"]],["Fuse",["l34","l35"],[1],["l36"]],["SampleCategorical",[],[[1,2,3,4],[0.25,0.25,0.25,0.25]],["v37"]],["Split",["l36","None","v9","v37"],[1],["l38","l39","l40"]],["Bind",["l39"],["threadIdx.x"],[]],["Vectorize",["l40"],[],[]],["StorageAlign",["b29"],[0,-2,32,8],[]],["ReverseComputeAt",["b2","l12"],[1,-1],[]],["DecomposeReduction",["b0","l18"],[],["b41"]],["EnterPostproc",[],[],[]]],[[4,[197,4,64]],[8,[160,2]],[25,1]]],[0.00089259919402985077666],{"host":{"keys":["cpu"],"kind":"llvm","tag":""},"keys":["metal","gpu"],"kind":"metal","max_function_args":31,"max_num_threads":256,"max_shared_memory_per_block":32768,"max_threads_per_block":256,"tag":"","thread_warp_size":32},[["TENSOR","uint32",[320,50432]],["TENSOR","uint32",[80,50432]],["TENSOR","float32",[1,1,2560]],["TENSOR","float32",[1,1,50432]]]]]
[27,[[[["GetBlock",[],["matmul","main"],["b0"]],["GetBlock",[],["decode","main"],["b1"]],["GetBlock",[],["T_add","main"],["b2"]],["GetBlock",[],["T_add_1","main"],["b3"]],["CacheWrite",["b0",[]],[0,"local"],["b4"]],["GetLoops",["b0"],[],["l5","l6","l7","l8"]],["SamplePerfectTile",["l7"],[3,-1],["v9","v10","v11"]],["Split",["l7","v9","v10","v11"],[1],["l12","l13","l14"]],["Fuse",["l5","l6","l12"],[1],["l15"]],["Split",["l8","None",8],[1],["l16","l17"]],["SamplePerfectTile",["l16"],[2,-1],["v18","v19"]],["Split",["l16","v18","v19"],[1],["l20","l21"]],["Fuse",["l21","l17"],[1],["l22"]],["Unroll",["l22"],[],[]],["Bind",["l15"],["blockIdx.x"],[]],["Bind",["l13"],["vthread.x"],[]],["Bind",["l14"],["threadIdx.x"],[]],["Reorder",["l15","l13","l14","l20","l22"],[],[]],["ComputeAt",["b1","l20"],[1,-1],[]],["SetScope",["b1"],[0,"local"],[]],["GetLoops",["b1"],[],["l23","l24","l25","l26","l27","l28"]],["Split",["l27","None",8],[1],["l29","l30"]],["Unroll",["l30"],[],[]],["CacheRead",["b0",[]],[0,"shared"],["b31"]],["ComputeAt",["b31","l14"],[1,-1],[]],["GetLoops",["b31"],[],["l32","l33","l34","l35","l36","l37"]],["Fuse",["l36","l37"],[1],["l38"]],["SampleCategorical",[],[[1,2,3,4],[0.25,0.25,0.25,0.25]],["v39"]],["Split",["l38","None","v11","v39"],[1],["l40","l41","l42"]],["Bind",["l41"],["threadIdx.x"],[]],["Vectorize",["l42"],[],[]],["StorageAlign",["b31"],[0,-2,32,8],[]],["ComputeInline",["b2"],[],[]],["ReverseComputeInline",["b3"],[],[]],["ReverseComputeAt",["b4","l14"],[1,-1],[]],["DecomposeReduction",["b0","l20"],[],["b43"]],["EnterPostproc",[],[],[]]],[[6,[80,1,32]],[10,[40,8]],[27,1]]],[8.5862941441441431936e-05],{"host":{"keys":["cpu"],"kind":"llvm","tag":""},"keys":["metal","gpu"],"kind":"metal","max_function_args":31,"max_num_threads":256,"max_shared_memory_per_block":32768,"max_threads_per_block":256,"tag":"","thread_warp_size":32},[["TENSOR","uint32",[320,2560]],["TENSOR","uint32",[80,2560]],["TENSOR","float32",[1,1,2560]],["TENSOR","float32",[2560]],["TENSOR","float32",[1,1,2560]],["TENSOR","float32",[1,1,2560]]]]]
[28,[[[["GetBlock",[],["T_squeeze","main"],["b0"]],["GetLoops",["b0"],[],["l1","l2","l3"]],["Fuse",["l1","l2","l3"],[1],["l4"]],["SampleCategorical",[],[[32,64,128,256],[0.25,0.25,0.25,0.25]],["v5"]],["Split",["l4","None","v5"],[1],["l6","l7"]],["Bind",["l6"],["blockIdx.x"],[]],["Bind",["l7"],["threadIdx.x"],[]],["EnterPostproc",[],[],[]]],[[3,0]]],[2.7549033904484139637e-05],{"host":{"keys":["cpu"],"kind":"llvm","tag":""},"keys":["metal","gpu"],"kind":"metal","max_function_args":31,"max_num_threads":256,"max_shared_memory_per_block":32768,"max_threads_per_block":256,"tag":"","thread_warp_size":32},[["TENSOR","float32",[1,1,32,80]],["TENSOR","float32",[1,32,80]]]]]
[29,[[[["GetBlock",[],["T_reshape","main"],["b0"]],["GetBlock",[],["T_squeeze","main"],["b1"]],["ReverseComputeInline",["b1"],[],[]],["GetLoops",["b0"],[],["l2","l3","l4","l5"]],["Fuse",["l2","l3","l4","l5"],[1],["l6"]],["SampleCategorical",[],[[32,64,128,256],[0.25,0.25,0.25,0.25]],["v7"]],["Split",["l6","None","v7"],[1],["l8","l9"]],["Bind",["l8"],["blockIdx.x"],[]],["Bind",["l9"],["threadIdx.x"],[]],["EnterPostproc",[],[],[]]],[[5,0]]],[2.7523701096043098901e-05],{"host":{"keys":["cpu"],"kind":"llvm","tag":""},"keys":["metal","gpu"],"kind":"metal","max_function_args":31,"max_num_threads":256,"max_shared_memory_per_block":32768,"max_threads_per_block":256,"tag":"","thread_warp_size":32},[["TENSOR","float32",[1,1,2560]],["TENSOR","float32",[1,32,80]]]]]
