log_db/redpajama-3b-q4f16/database_tuning_record.json
[0,[[[["GetBlock",[],["NT_matmul","main"],["b0"]],["GetBlock",[],["T_add","main"],["b1"]],["GetBlock",[],["T_multiply","main"],["b2"]],["GetBlock",[],["compute","main"],["b3"]],["GetBlock",[],["T_multiply_1","main"],["b4"]],["GetBlock",[],["T_add_1","main"],["b5"]],["GetBlock",[],["T_multiply_2","main"],["b6"]],["GetBlock",[],["compute_1","main"],["b7"]],["GetBlock",[],["root","main"],["b8"]],["Annotate",["b0","\"SSSRRSRS\""],["meta_schedule.tiling_structure"],[]],["GetLoops",["b0"],[],["l9","l10","l11","l12"]],["SamplePerfectTile",["l9"],[5,64],["v13","v14","v15","v16","v17"]],["Split",["l9","v13","v14","v15","v16","v17"],[1],["l18","l19","l20","l21","l22"]],["SamplePerfectTile",["l10"],[5,64],["v23","v24","v25","v26","v27"]],["Split",["l10","v23","v24","v25","v26","v27"],[1],["l28","l29","l30","l31","l32"]],["SamplePerfectTile",["l11"],[5,64],["v33","v34","v35","v36","v37"]],["Split",["l11","v33","v34","v35","v36","v37"],[1],["l38","l39","l40","l41","l42"]],["SamplePerfectTile",["l12"],[3,64],["v43","v44","v45"]],["Split",["l12","v43","v44","v45"],[1],["l46","l47","l48"]],["Reorder",["l18","l28","l38","l19","l29","l39","l20","l30","l40","l46","l47","l21","l31","l41","l48","l22","l32","l42"],[],[]],["Fuse",["l18","l28","l38"],[1],["l49"]],["Bind",["l49"],["blockIdx.x"],[]],["Fuse",["l19","l29","l39"],[1],["l50"]],["Bind",["l50"],["vthread.x"],[]],["Fuse",["l20","l30","l40"],[1],["l51"]],["Bind",["l51"],["threadIdx.x"],[]],["Annotate",["b0",32],["meta_schedule.thread_extent_low_inclusive"],[]],["Annotate",["b0",1024],["meta_schedule.thread_extent_high_inclusive"],[]],["CacheWrite",["b0",[]],[0,"local"],["b52"]],["ReverseComputeAt",["b52","l51"],[1,-1],[]],["CacheRead",["b0",["b0"]],[0,"shared"],["b53"]],["ComputeAt",["b53","l46"],[1,-1],[]],["GetLoops",["b53"],[],["l54","l55","l56","l57","l58","l59","l60"]],["Fuse",["l58","l59","l60"],[1],["l61"]],["SampleCategorical",[],[[1,2,4,8],[0.25,0.25,0.25,0.25]],["v62"]],["Annotate",["b53","v62"],["meta_schedule.cooperative_fetch"],[]],["CacheRead",["b0",["b0"]],[1,"shared"],["b63"]],["ComputeAt",["b63","l46"],[1,-1],[]],["GetLoops",["b63"],[],["l64","l65","l66","l67","l68","l69"]],["Fuse",["l68","l69"],[1],["l70"]],["SampleCategorical",[],[[1,2,4,8],[0.25,0.25,0.25,0.25]],["v71"]],["Annotate",["b63","v71"],["meta_schedule.cooperative_fetch"],[]],["ReverseComputeInline",["b7"],[],[]],["ComputeInline",["b5"],[],[]],["ComputeInline",["b4"],[],[]],["ComputeInline",["b3"],[],[]],["ComputeInline",["b2"],[],[]],["ComputeInline",["b1"],[],[]],["ReverseComputeInline",["b6"],[],[]],["SampleCategorical",[],[[0,16,64,512,1024],[0.2000000000000000111,0.2000000000000000111,0.2000000000000000111,0.2000000000000000111,0.2000000000000000111]],["v72"]],["Annotate",["b8","v72"],["meta_schedule.unroll_explicit"],[]],["EnterPostproc",[],[],[]],["Unannotate",["b53"],["meta_schedule.cooperative_fetch"],[]],["GetLoops",["b53"],[],["l73","l74","l75","l76","l77"]],["Split",["l77","None",160,4],[1],["l78","l79","l80"]],["Vectorize",["l80"],[],[]],["Bind",["l79"],["threadIdx.x"],[]],["Unannotate",["b63"],["meta_schedule.cooperative_fetch"],[]],["GetLoops",["b63"],[],["l81","l82","l83","l84","l85"]],["Split",["l85","None",160,2],[1],["l86","l87","l88"]],["Vectorize",["l88"],[],[]],["Bind",["l87"],["threadIdx.x"],[]],["GetBlock",[],["root","main"],["b89"]],["Unannotate",["b89"],["meta_schedule.unroll_explicit"],[]],["GetChildBlocks",["b89"],[],["b90","b91","b92","b93"]],["GetLoops",["b90"],[],["l94","l95","l96","l97","l98","l99","l100"]],["GetLoops",["b91"],[],["l101","l102","l103","l104","l105","l106","l107"]],["GetLoops",["b92"],[],["l108","l109","l110","l111","l112","l113","l114","l115","l116","l117","l118","l119"]],["Annotate",["l108",64],["pragma_auto_unroll_max_step"],[]],["Annotate",["l108",1],["pragma_unroll_explicit"],[]],["GetLoops",["b93"],[],["l120","l121","l122","l123","l124","l125"]],["GetBlock",[],["NT_matmul","main"],["b126"]],["GetLoops",["b126"],[],["l127","l128","l129","l130","l131","l132","l133","l134","l135","l136","l137","l138"]],["DecomposeReduction",["b126","l130"],[],["b139"]]],[[11,[1,1,1,1,1]],[13,[2,1,8,2,4]],[15,[128,2,20,1,2]],[17,[128,5,4]],[34,2],[40,1],[49,2]]],[0.0031547391304347824868],{"host":{"keys":["cpu"],"kind":"llvm","tag":""},"keys":["metal","gpu"],"kind":"metal","max_function_args":31,"max_num_threads":256,"max_shared_memory_per_block":32768,"max_threads_per_block":256,"tag":"","thread_warp_size":32},[["TENSOR","float16",[1,128,2560]],["TENSOR","float16",[10240,2560]],["TENSOR","float32",[10240]],["TENSOR","float16",[1,128,10240]]]]]
[1,[[[["GetBlock",[],["matmul","main"],["b0"]],["GetBlock",[],["decode","main"],["b1"]],["CacheWrite",["b0",[]],[0,"local"],["b2"]],["GetLoops",["b0"],[],["l3","l4","l5","l6"]],["SamplePerfectTile",["l5"],[3,-1],["v7","v8","v9"]],["Split",["l5","v7","v8","v9"],[1],["l10","l11","l12"]],["Fuse",["l3","l4","l10"],[1],["l13"]],["Split",["l6","None",8],[1],["l14","l15"]],["SamplePerfectTile",["l14"],[2,-1],["v16","v17"]],["Split",["l14","v16","v17"],[1],["l18","l19"]],["Fuse",["l19","l15"],[1],["l20"]],["Unroll",["l20"],[],[]],["Bind",["l13"],["blockIdx.x"],[]],["Bind",["l11"],["vthread.x"],[]],["Bind",["l12"],["threadIdx.x"],[]],["Reorder",["l13","l11","l12","l18","l20"],[],[]],["ComputeAt",["b1","l18"],[1,-1],[]],["SetScope",["b1"],[0,"local"],[]],["GetLoops",["b1"],[],["l21","l22","l23","l24","l25","l26"]],["Split",["l25","None",8],[1],["l27","l28"]],["Unroll",["l28"],[],[]],["CacheRead",["b0",[]],[0,"shared"],["b29"]],["ComputeAt",["b29","l12"],[1,-1],[]],["GetLoops",["b29"],[],["l30","l31","l32","l33","l34","l35"]],["Fuse",["l34","l35"],[1],["l36"]],["SampleCategorical",[],[[1,2,3,4],[0.25,0.25,0.25,0.25]],["v37"]],["Split",["l36","None","v9","v37"],[1],["l38","l39","l40"]],["Bind",["l39"],["threadIdx.x"],[]],["Vectorize",["l40"],[],[]],["StorageAlign",["b29"],[0,-2,32,8],[]],["ReverseComputeAt",["b2","l12"],[1,-1],[]],["DecomposeReduction",["b0","l18"],[],["b41"]],["EnterPostproc",[],[],[]]],[[4,[197,2,128]],[8,[80,4]],[25,1]]],[0.0008922719466666665343],{"host":{"keys":["cpu"],"kind":"llvm","tag":""},"keys":["metal","gpu"],"kind":"metal","max_function_args":31,"max_num_threads":256,"max_shared_memory_per_block":32768,"max_threads_per_block":256,"tag":"","thread_warp_size":32},[["TENSOR","uint32",[320,50432]],["TENSOR","float32",[80,50432]],["TENSOR","float32",[1,1,2560]],["TENSOR","float32",[1,1,50432]]]]]
[2,[[[["GetBlock",[],["decode","main"],["b0"]],["GetLoops",["b0"],[],["l1","l2"]],["Split",["l1","None",8],[1],["l3","l4"]],["SamplePerfectTile",["l3"],[3,4],["v5","v6","v7"]],["SamplePerfectTile",["l2"],[2,16],["v8","v9"]],["Split",["l3","v5","v6","v7"],[1],["l10","l11","l12"]],["Split",["l2","v8","v9"],[1],["l13","l14"]],["Reorder",["l10","l13","l11","l14","l12","l4"],[],[]],["Bind",["l10"],["blockIdx.y"],[]],["Bind",["l13"],["blockIdx.x"],[]],["Bind",["l11"],["threadIdx.y"],[]],["Bind",["l14"],["threadIdx.x"],[]],["Unroll",["l4"],[],[]],["CacheWrite",["b0",[]],[0,"shared"],["b15"]],["ComputeInline",["b15"],[],[]],["GetBlock",[],["T_transpose","main"],["b16"]],["ReverseComputeAt",["b16","l13"],[1,-1],[]],["GetLoops",["b16"],[],["l17","l18","l19","l20"]],["Fuse",["l19","l20"],[1],["l21"]],["Split",["l21","None","v6","v9",4],[1],["l22","l23","l24","l25"]],["Bind",["l23"],["threadIdx.y"],[]],["Bind",["l24"],["threadIdx.x"],[]],["Vectorize",["l25"],[],[]],["StorageAlign",["b0"],[0,0,32,1],[]],["EnterPostproc",[],[],[]]],[[3,[80,16,1]],[4,[2560,1]]]],[0.00081500662500000006002],{"host":{"keys":["cpu"],"kind":"llvm","tag":""},"keys":["metal","gpu"],"kind":"metal","max_function_args":31,"max_num_threads":256,"max_shared_memory_per_block":32768,"max_threads_per_block":256,"tag":"","thread_warp_size":32},[["TENSOR","uint32",[1280,2560]],["TENSOR","float16",[320,2560]],["TENSOR","float16",[2560,10240]]]]]
[3,[[[["GetBlock",[],["NT_matmul","main"],["b0"]],["GetBlock",[],["T_add","main"],["b1"]],["GetBlock",[],["compute","main"],["b2"]],["GetBlock",[],["compute_1","main"],["b3"]],["GetBlock",[],["T_add_1","main"],["b4"]],["GetBlock",[],["compute_2","main"],["b5"]],["GetBlock",[],["root","main"],["b6"]],["Annotate",["b0","\"SSSRRSRS\""],["meta_schedule.tiling_structure"],[]],["GetLoops",["b0"],[],["l7","l8","l9","l10"]],["SamplePerfectTile",["l7"],[5,64],["v11","v12","v13","v14","v15"]],["Split",["l7","v11","v12","v13","v14","v15"],[1],["l16","l17","l18","l19","l20"]],["SamplePerfectTile",["l8"],[5,64],["v21","v22","v23","v24","v25"]],["Split",["l8","v21","v22","v23","v24","v25"],[1],["l26","l27","l28","l29","l30"]],["SamplePerfectTile",["l9"],[5,64],["v31","v32","v33","v34","v35"]],["Split",["l9","v31","v32","v33","v34","v35"],[1],["l36","l37","l38","l39","l40"]],["SamplePerfectTile",["l10"],[3,64],["v41","v42","v43"]],["Split",["l10","v41","v42","v43"],[1],["l44","l45","l46"]],["Reorder",["l16","l26","l36","l17","l27","l37","l18","l28","l38","l44","l45","l19","l29","l39","l46","l20","l30","l40"],[],[]],["Fuse",["l16","l26","l36"],[1],["l47"]],["Bind",["l47"],["blockIdx.x"],[]],["Fuse",["l17","l27","l37"],[1],["l48"]],["Bind",["l48"],["vthread.x"],[]],["Fuse",["l18","l28","l38"],[1],["l49"]],["Bind",["l49"],["threadIdx.x"],[]],["Annotate",["b0",32],["meta_schedule.thread_extent_low_inclusive"],[]],["Annotate",["b0",256],["meta_schedule.thread_extent_high_inclusive"],[]],["CacheWrite",["b0",[]],[0,"local"],["b50"]],["ReverseComputeAt",["b50","l49"],[1,-1],[]],["CacheRead",["b0",["b0"]],[0,"shared"],["b51"]],["ComputeAt",["b51","l44"],[1,-1],[]],["GetLoops",["b51"],[],["l52","l53","l54","l55","l56","l57","l58"]],["Fuse",["l56","l57","l58"],[1],["l59"]],["SampleCategorical",[],[[1,2,4,8],[0.25,0.25,0.25,0.25]],["v60"]],["Annotate",["b51","v60"],["meta_schedule.cooperative_fetch"],[]],["CacheRead",["b0",["b0"]],[1,"shared"],["b61"]],["ComputeAt",["b61","l44"],[1,-1],[]],["GetLoops",["b61"],[],["l62","l63","l64","l65","l66","l67"]],["Fuse",["l66","l67"],[1],["l68"]],["SampleCategorical",[],[[1,2,4,8],[0.25,0.25,0.25,0.25]],["v69"]],["Annotate",["b61","v69"],["meta_schedule.cooperative_fetch"],[]],["ReverseComputeInline",["b5"],[],[]],["ReverseComputeInline",["b4"],[],[]],["ReverseComputeInline",["b3"],[],[]],["ReverseComputeInline",["b2"],[],[]],["ReverseComputeInline",["b1"],[],[]],["SampleCategorical",[],[[0,16,64,512,1024],[0.2000000000000000111,0.2000000000000000111,0.2000000000000000111,0.2000000000000000111,0.2000000000000000111]],["v70"]],["Annotate",["b6","v70"],["meta_schedule.unroll_explicit"],[]],["EnterPostproc",[],[],[]],["Unannotate",["b51"],["meta_schedule.cooperative_fetch"],[]],["GetLoops",["b51"],[],["l71","l72","l73","l74","l75"]],["Split",["l75","None",128,4],[1],["l76","l77","l78"]],["Vectorize",["l78"],[],[]],["Bind",["l77"],["threadIdx.x"],[]],["Unannotate",["b61"],["meta_schedule.cooperative_fetch"],[]],["GetLoops",["b61"],[],["l79","l80","l81","l82","l83"]],["Split",["l83","None",128,2],[1],["l84","l85","l86"]],["Vectorize",["l86"],[],[]],["Bind",["l85"],["threadIdx.x"],[]],["GetBlock",[],["root","main"],["b87"]],["Unannotate",["b87"],["meta_schedule.unroll_explicit"],[]],["GetChildBlocks",["b87"],[],["b88","b89","b90","b91"]],["GetLoops",["b88"],[],["l92","l93","l94","l95","l96","l97","l98"]],["GetLoops",["b89"],[],["l99","l100","l101","l102","l103","l104","l105"]],["GetLoops",["b90"],[],["l106","l107","l108","l109","l110","l111","l112","l113","l114","l115","l116","l117"]],["Annotate",["l106",512],["pragma_auto_unroll_max_step"],[]],["Annotate",["l106",1],["pragma_unroll_explicit"],[]],["GetLoops",["b91"],[],["l118","l119","l120","l121","l122","l123"]],["GetBlock",[],["NT_matmul","main"],["b124"]],["GetLoops",["b124"],[],["l125","l126","l127","l128","l129","l130","l131","l132","l133","l134","l135","l136"]],["DecomposeReduction",["b124","l128"],[],["b137"]]],[[9,[1,1,1,1,1]],[11,[1,1,16,1,8]],[13,[40,8,8,1,1]],[15,[320,8,4]],[32,2],[38,1],[45,3]]],[0.0032088240666666668563],{"host":{"keys":["cpu"],"kind":"llvm","tag":""},"keys":["metal","gpu"],"kind":"metal","max_function_args":31,"max_num_threads":256,"max_shared_memory_per_block":32768,"max_threads_per_block":256,"tag":"","thread_warp_size":32},[["TENSOR","float16",[1,128,10240]],["TENSOR","float16",[2560,10240]],["TENSOR","float32",[2560]],["TENSOR","float16",[1,128,2560]],["TENSOR","float32",[1,128,2560]]]]]
[4,[[[["GetBlock",[],["NT_matmul","main"],["b0"]],["GetBlock",[],["T_add","main"],["b1"]],["GetBlock",[],["root","main"],["b2"]],["Annotate",["b0","\"SSSRRSRS\""],["meta_schedule.tiling_structure"],[]],["GetLoops",["b0"],[],["l3","l4","l5","l6"]],["SamplePerfectTile",["l3"],[5,64],["v7","v8","v9","v10","v11"]],["Split",["l3","v7","v8","v9","v10","v11"],[1],["l12","l13","l14","l15","l16"]],["SamplePerfectTile",["l4"],[5,64],["v17","v18","v19","v20","v21"]],["Split",["l4","v17","v18","v19","v20","v21"],[1],["l22","l23","l24","l25","l26"]],["SamplePerfectTile",["l5"],[5,64],["v27","v28","v29","v30","v31"]],["Split",["l5","v27","v28","v29","v30","v31"],[1],["l32","l33","l34","l35","l36"]],["SamplePerfectTile",["l6"],[3,64],["v37","v38","v39"]],["Split",["l6","v37","v38","v39"],[1],["l40","l41","l42"]],["Reorder",["l12","l22","l32","l13","l23","l33","l14","l24","l34","l40","l41","l15","l25","l35","l42","l16","l26","l36"],[],[]],["Fuse",["l12","l22","l32"],[1],["l43"]],["Bind",["l43"],["blockIdx.x"],[]],["Fuse",["l13","l23","l33"],[1],["l44"]],["Bind",["l44"],["vthread.x"],[]],["Fuse",["l14","l24","l34"],[1],["l45"]],["Bind",["l45"],["threadIdx.x"],[]],["Annotate",["b0",32],["meta_schedule.thread_extent_low_inclusive"],[]],["Annotate",["b0",256],["meta_schedule.thread_extent_high_inclusive"],[]],["CacheWrite",["b0",[]],[0,"local"],["b46"]],["ReverseComputeAt",["b46","l45"],[1,-1],[]],["CacheRead",["b0",["b0"]],[0,"shared"],["b47"]],["ComputeAt",["b47","l40"],[1,-1],[]],["GetLoops",["b47"],[],["l48","l49","l50","l51","l52","l53","l54"]],["Fuse",["l52","l53","l54"],[1],["l55"]],["SampleCategorical",[],[[1,2,4,8],[0.25,0.25,0.25,0.25]],["v56"]],["Annotate",["b47","v56"],["meta_schedule.cooperative_fetch"],[]],["CacheRead",["b0",["b0"]],[1,"shared"],["b57"]],["ComputeAt",["b57","l40"],[1,-1],[]],["GetLoops",["b57"],[],["l58","l59","l60","l61","l62","l63"]],["Fuse",["l62","l63"],[1],["l64"]],["SampleCategorical",[],[[1,2,4,8],[0.25,0.25,0.25,0.25]],["v65"]],["Annotate",["b57","v65"],["meta_schedule.cooperative_fetch"],[]],["ReverseComputeInline",["b1"],[],[]],["SampleCategorical",[],[[0,16,64,512,1024],[0.2000000000000000111,0.2000000000000000111,0.2000000000000000111,0.2000000000000000111,0.2000000000000000111]],["v66"]],["Annotate",["b2","v66"],["meta_schedule.unroll_explicit"],[]],["EnterPostproc",[],[],[]],["Unannotate",["b47"],["meta_schedule.cooperative_fetch"],[]],["GetLoops",["b47"],[],["l67","l68","l69","l70","l71"]],["Split",["l71","None",64,4],[1],["l72","l73","l74"]],["Vectorize",["l74"],[],[]],["Bind",["l73"],["threadIdx.x"],[]],["Unannotate",["b57"],["meta_schedule.cooperative_fetch"],[]],["GetLoops",["b57"],[],["l75","l76","l77","l78","l79"]],["Split",["l79","None",64,4],[1],["l80","l81","l82"]],["Vectorize",["l82"],[],[]],["Bind",["l81"],["threadIdx.x"],[]],["GetBlock",[],["root","main"],["b83"]],["Unannotate",["b83"],["meta_schedule.unroll_explicit"],[]],["GetChildBlocks",["b83"],[],["b84","b85","b86","b87"]],["GetLoops",["b84"],[],["l88","l89","l90","l91","l92","l93","l94"]],["GetLoops",["b85"],[],["l95","l96","l97","l98","l99","l100","l101"]],["GetLoops",["b86"],[],["l102","l103","l104","l105","l106","l107","l108","l109","l110","l111","l112","l113"]],["Annotate",["l102",64],["pragma_auto_unroll_max_step"],[]],["Annotate",["l102",1],["pragma_unroll_explicit"],[]],["GetLoops",["b87"],[],["l114","l115","l116","l117","l118","l119"]],["GetBlock",[],["NT_matmul","main"],["b120"]],["GetLoops",["b120"],[],["l121","l122","l123","l124","l125","l126","l127","l128","l129","l130","l131","l132"]],["DecomposeReduction",["b120","l124"],[],["b133"]]],[[5,[1,1,1,1,1]],[7,[4,2,4,2,2]],[9,[40,4,16,1,1]],[11,[160,8,2]],[28,2],[34,2],[37,2]]],[0.00077016790099009903043],{"host":{"keys":["cpu"],"kind":"llvm","tag":""},"keys":["metal","gpu"],"kind":"metal","max_function_args":31,"max_num_threads":256,"max_shared_memory_per_block":32768,"max_threads_per_block":256,"tag":"","thread_warp_size":32},[["TENSOR","float16",[1,128,2560]],["TENSOR","float16",[2560,2560]],["TENSOR","float16",[2560]],["TENSOR","float16",[1,128,2560]]]]]
[5,[[[["GetBlock",[],["matmul","main"],["b0"]],["GetBlock",[],["decode","main"],["b1"]],["GetBlock",[],["T_add","main"],["b2"]],["GetBlock",[],["compute","main"],["b3"]],["GetBlock",[],["compute_1","main"],["b4"]],["GetBlock",[],["T_add_1","main"],["b5"]],["GetBlock",[],["compute_2","main"],["b6"]],["CacheWrite",["b0",[]],[0,"local"],["b7"]],["GetLoops",["b0"],[],["l8","l9","l10","l11"]],["SamplePerfectTile",["l10"],[3,-1],["v12","v13","v14"]],["Split",["l10","v12","v13","v14"],[1],["l15","l16","l17"]],["Fuse",["l8","l9","l15"],[1],["l18"]],["Split",["l11","None",8],[1],["l19","l20"]],["SamplePerfectTile",["l19"],[2,-1],["v21","v22"]],["Split",["l19","v21","v22"],[1],["l23","l24"]],["Fuse",["l24","l20"],[1],["l25"]],["Unroll",["l25"],[],[]],["Bind",["l18"],["blockIdx.x"],[]],["Bind",["l16"],["vthread.x"],[]],["Bind",["l17"],["threadIdx.x"],[]],["Reorder",["l18","l16","l17","l23","l25"],[],[]],["ComputeAt",["b1","l23"],[1,-1],[]],["SetScope",["b1"],[0,"local"],[]],["GetLoops",["b1"],[],["l26","l27","l28","l29","l30","l31"]],["Split",["l30","None",8],[1],["l32","l33"]],["Unroll",["l33"],[],[]],["CacheRead",["b0",[]],[0,"shared"],["b34"]],["ComputeAt",["b34","l17"],[1,-1],[]],["GetLoops",["b34"],[],["l35","l36","l37","l38","l39","l40"]],["Fuse",["l39","l40"],[1],["l41"]],["SampleCategorical",[],[[1,2,3,4],[0.25,0.25,0.25,0.25]],["v42"]],["Split",["l41","None","v14","v42"],[1],["l43","l44","l45"]],["Bind",["l44"],["threadIdx.x"],[]],["Vectorize",["l45"],[],[]],["StorageAlign",["b34"],[0,-2,32,8],[]],["ComputeInline",["b2"],[],[]],["ComputeInline",["b3"],[],[]],["ComputeInline",["b4"],[],[]],["ComputeInline",["b5"],[],[]],["ReverseComputeInline",["b6"],[],[]],["ReverseComputeAt",["b7","l17"],[1,-1],[]],["DecomposeReduction",["b0","l23"],[],["b46"]],["EnterPostproc",[],[],[]]],[[9,[10,1,256]],[13,[80,16]],[30,0]]],[0.00021575663407821229827],{"host":{"keys":["cpu"],"kind":"llvm","tag":""},"keys":["metal","gpu"],"kind":"metal","max_function_args":31,"max_num_threads":256,"max_shared_memory_per_block":32768,"max_threads_per_block":256,"tag":"","thread_warp_size":32},[["TENSOR","uint32",[1280,2560]],["TENSOR","float16",[320,2560]],["TENSOR","float16",[1,1,10240]],["TENSOR","float32",[2560]],["TENSOR","float16",[1,1,2560]],["TENSOR","float32",[1,1,2560]]]]]
[6,[[[["GetBlock",[],["NT_matmul","main"],["b0"]],["GetBlock",[],["T_divide","main"],["b1"]],["GetBlock",[],["T_maximum","main"],["b2"]],["GetBlock",[],["T_minimum","main"],["b3"]],["GetBlock",[],["compute","main"],["b4"]],["GetBlock",[],["root","main"],["b5"]],["Annotate",["b0","\"SSSRRSRS\""],["meta_schedule.tiling_structure"],[]],["GetLoops",["b0"],[],["l6","l7","l8","l9","l10"]],["SamplePerfectTile",["l6"],[5,64],["v11","v12","v13","v14","v15"]],["Split",["l6","v11","v12","v13","v14","v15"],[1],["l16","l17","l18","l19","l20"]],["SamplePerfectTile",["l7"],[5,64],["v21","v22","v23","v24","v25"]],["Split",["l7","v21","v22","v23","v24","v25"],[1],["l26","l27","l28","l29","l30"]],["SamplePerfectTile",["l8"],[5,64],["v31","v32","v33","v34","v35"]],["Split",["l8","v31","v32","v33","v34","v35"],[1],["l36","l37","l38","l39","l40"]],["SamplePerfectTile",["l9"],[5,64],["v41","v42","v43","v44","v45"]],["Split",["l9","v41","v42","v43","v44","v45"],[1],["l46","l47","l48","l49","l50"]],["SamplePerfectTile",["l10"],[3,64],["v51","v52","v53"]],["Split",["l10","v51","v52","v53"],[1],["l54","l55","l56"]],["Reorder",["l16","l26","l36","l46","l17","l27","l37","l47","l18","l28","l38","l48","l54","l55","l19","l29","l39","l49","l56","l20","l30","l40","l50"],[],[]],["Fuse",["l16","l26","l36","l46"],[1],["l57"]],["Bind",["l57"],["blockIdx.x"],[]],["Fuse",["l17","l27","l37","l47"],[1],["l58"]],["Bind",["l58"],["vthread.x"],[]],["Fuse",["l18","l28","l38","l48"],[1],["l59"]],["Bind",["l59"],["threadIdx.x"],[]],["Annotate",["b0",32],["meta_schedule.thread_extent_low_inclusive"],[]],["Annotate",["b0",256],["meta_schedule.thread_extent_high_inclusive"],[]],["CacheWrite",["b0",[]],[0,"local"],["b60"]],["ReverseComputeAt",["b60","l59"],[1,-1],[]],["CacheRead",["b0",["b0"]],[0,"shared"],["b61"]],["ComputeAt",["b61","l54"],[1,-1],[]],["GetLoops",["b61"],[],["l62","l63","l64","l65","l66","l67","l68","l69"]],["Fuse",["l66","l67","l68","l69"],[1],["l70"]],["SampleCategorical",[],[[1,2,4,8],[0.25,0.25,0.25,0.25]],["v71"]],["Annotate",["b61","v71"],["meta_schedule.cooperative_fetch"],[]],["CacheRead",["b0",["b0"]],[1,"shared"],["b72"]],["ComputeAt",["b72","l54"],[1,-1],[]],["GetLoops",["b72"],[],["l73","l74","l75","l76","l77","l78","l79","l80"]],["Fuse",["l77","l78","l79","l80"],[1],["l81"]],["SampleCategorical",[],[[1,2,4,8],[0.25,0.25,0.25,0.25]],["v82"]],["Annotate",["b72","v82"],["meta_schedule.cooperative_fetch"],[]],["ReverseComputeInline",["b4"],[],[]],["ReverseComputeInline",["b3"],[],[]],["ReverseComputeInline",["b2"],[],[]],["ReverseComputeInline",["b1"],[],[]],["SampleCategorical",[],[[0,16,64,512,1024],[0.2000000000000000111,0.2000000000000000111,0.2000000000000000111,0.2000000000000000111,0.2000000000000000111]],["v83"]],["Annotate",["b5","v83"],["meta_schedule.unroll_explicit"],[]],["EnterPostproc",[],[],[]],["Unannotate",["b61"],["meta_schedule.cooperative_fetch"],[]],["GetLoops",["b61"],[],["l84","l85","l86","l87","l88"]],["Split",["l88","None",64,8],[1],["l89","l90","l91"]],["Vectorize",["l91"],[],[]],["Bind",["l90"],["threadIdx.x"],[]],["Unannotate",["b72"],["meta_schedule.cooperative_fetch"],[]],["GetLoops",["b72"],[],["l92","l93","l94","l95","l96"]],["Split",["l96","None",64],[1],["l97","l98"]],["Bind",["l98"],["threadIdx.x"],[]],["GetBlock",[],["root","main"],["b99"]],["Unannotate",["b99"],["meta_schedule.unroll_explicit"],[]],["GetChildBlocks",["b99"],[],["b100","b101","b102","b103"]],["GetLoops",["b100"],[],["l104","l105","l106","l107","l108","l109","l110"]],["GetLoops",["b101"],[],["l111","l112","l113","l114","l115","l116"]],["GetLoops",["b102"],[],["l117","l118","l119","l120","l121","l122","l123","l124","l125","l126","l127","l128","l129","l130"]],["Annotate",["l117",512],["pragma_auto_unroll_max_step"],[]],["Annotate",["l117",1],["pragma_unroll_explicit"],[]],["GetLoops",["b103"],[],["l131","l132","l133","l134","l135","l136","l137"]],["GetBlock",[],["NT_matmul","main"],["b138"]],["GetLoops",["b138"],[],["l139","l140","l141","l142","l143","l144","l145","l146","l147","l148","l149","l150","l151","l152"]],["DecomposeReduction",["b138","l142"],[],["b153"]]],[[8,[1,1,1,1,1]],[10,[2,1,16,1,1]],[12,[1,1,1,1,1]],[14,[16,1,4,1,2]],[16,[2,5,8]],[33,3],[39,0],[45,3]]],[2.8651870780906728812e-05],{"host":{"keys":["cpu"],"kind":"llvm","tag":""},"keys":["metal","gpu"],"kind":"metal","max_function_args":31,"max_num_threads":256,"max_shared_memory_per_block":32768,"max_threads_per_block":256,"tag":"","thread_warp_size":32},[["TENSOR","float16",[1,32,1,80]],["TENSOR","float16",[1,32,128,80]],["TENSOR","float16",[1,1,1,128]],["TENSOR","float32",[1,32,1,128]]]]]
[7,[[[["GetBlock",[],["T_softmax_maxelem","main"],["b0"]],["GetBlock",[],["T_softmax_exp","main"],["b1"]],["GetBlock",[],["T_softmax_expsum","main"],["b2"]],["GetBlock",[],["T_softmax_norm","main"],["b3"]],["GetBlock",[],["root","main"],["b4"]],["ComputeInline",["b1"],[],[]],["GetConsumers",["b2"],[],["b5"]],["GetLoops",["b5"],[],["l6","l7","l8"]],["SampleCategorical",[],[[4,8,16,32,64,128,256,512],[0.125,0.125,0.125,0.125,0.125,0.125,0.125,0.125]],["v9"]],["Split",["l8","None","v9"],[1],["l10","l11"]],["Bind",["l11"],["threadIdx.x"],[]],["ComputeAt",["b2","l7"],[1,-1],[]],["SetScope",["b2"],[0,"shared"],[]],["GetLoops",["b2"],[],["l12","l13","l14","l15","l16"]],["Split",["l16","None","v9"],[1],["l17","l18"]],["Bind",["l18"],["threadIdx.x"],[]],["GetConsumers",["b0"],[],["b19","b20"]],["GetLoops",["b19"],[],["l21","l22","l23","l24","l25","l26"]],["ComputeAt",["b0","l22"],[1,-1],[]],["SetScope",["b0"],[0,"shared"],[]],["GetLoops",["b0"],[],["l27","l28","l29","l30","l31"]],["Split",["l31","None","v9"],[1],["l32","l33"]],["Bind",["l33"],["threadIdx.x"],[]],["SampleCategorical",[],[[0,16,64,512,1024],[0.2000000000000000111,0.2000000000000000111,0.2000000000000000111,0.2000000000000000111,0.2000000000000000111]],["v34"]],["Annotate",["b4","v34"],["meta_schedule.unroll_explicit"],[]],["GetLoops",["b3"],[],["l35","l36","l37","l38"]],["Fuse",["l35","l36"],[1],["l39"]],["Bind",["l39"],["blockIdx.x"],[]],["EnterPostproc",[],[],[]],["GetBlock",[],["root","main"],["b40"]],["Unannotate",["b40"],["meta_schedule.unroll_explicit"],[]],["GetChildBlocks",["b40"],[],["b41","b42","b43"]],["GetLoops",["b41"],[],["l44","l45","l46","l47","l48"]],["Annotate",["l44",1024],["pragma_auto_unroll_max_step"],[]],["Annotate",["l44",1],["pragma_unroll_explicit"],[]],["GetLoops",["b42"],[],["l49","l50","l51","l52","l53"]],["Annotate",["l49",1024],["pragma_auto_unroll_max_step"],[]],["Annotate",["l49",1],["pragma_unroll_explicit"],[]],["GetLoops",["b43"],[],["l54","l55","l56"]]],[[8,6],[23,4]]],[7.0457841284837034713e-05],{"host":{"keys":["cpu"],"kind":"llvm","tag":""},"keys":["metal","gpu"],"kind":"metal","max_function_args":31,"max_num_threads":256,"max_shared_memory_per_block":32768,"max_threads_per_block":256,"tag":"","thread_warp_size":32},[["TENSOR","float32",[1,1,50432]],["TENSOR","float32",[1,1,50432]]]]]
[8,[[[["GetBlock",[],["decode","main"],["b0"]],["GetLoops",["b0"],[],["l1","l2"]],["Split",["l1","None",8],[1],["l3","l4"]],["SamplePerfectTile",["l3"],[3,4],["v5","v6","v7"]],["SamplePerfectTile",["l2"],[2,16],["v8","v9"]],["Split",["l3","v5","v6","v7"],[1],["l10","l11","l12"]],["Split",["l2","v8","v9"],[1],["l13","l14"]],["Reorder",["l10","l13","l11","l14","l12","l4"],[],[]],["Bind",["l10"],["blockIdx.y"],[]],["Bind",["l13"],["blockIdx.x"],[]],["Bind",["l11"],["threadIdx.y"],[]],["Bind",["l14"],["threadIdx.x"],[]],["Unroll",["l4"],[],[]],["CacheWrite",["b0",[]],[0,"shared"],["b15"]],["ComputeInline",["b15"],[],[]],["GetBlock",[],["T_transpose","main"],["b16"]],["ReverseComputeAt",["b16","l13"],[1,-1],[]],["GetLoops",["b16"],[],["l17","l18","l19","l20"]],["Fuse",["l19","l20"],[1],["l21"]],["Split",["l21","None","v6","v9",4],[1],["l22","l23","l24","l25"]],["Bind",["l23"],["threadIdx.y"],[]],["Bind",["l24"],["threadIdx.x"],[]],["Vectorize",["l25"],[],[]],["StorageAlign",["b0"],[0,0,32,1],[]],["EnterPostproc",[],[],[]]],[[3,[10,8,4]],[4,[640,16]]]],[0.00081551529943502825987],{"host":{"keys":["cpu"],"kind":"llvm","tag":""},"keys":["metal","gpu"],"kind":"metal","max_function_args":31,"max_num_threads":256,"max_shared_memory_per_block":32768,"max_threads_per_block":256,"tag":"","thread_warp_size":32},[["TENSOR","uint32",[320,10240]],["TENSOR","float16",[80,10240]],["TENSOR","float16",[10240,2560]]]]]
[9,[[[["GetBlock",[],["A_red_temp","main"],["b0"]],["GetBlock",[],["T_layer_norm","main"],["b1"]],["GetBlock",[],["compute","main"],["b2"]],["GetBlock",[],["root","main"],["b3"]],["ReverseComputeInline",["b2"],[],[]],["SampleCategorical",[],[[4,8,16,32,64,128,256,512],[0.125,0.125,0.125,0.125,0.125,0.125,0.125,0.125]],["v4"]],["GetLoops",["b0"],[],["l5","l6","l7"]],["Split",["l7","None","v4"],[1],["l8","l9"]],["Bind",["l9"],["threadIdx.x"],[]],["SampleCategorical",[],[[0,16,64,512,1024],[0.2000000000000000111,0.2000000000000000111,0.2000000000000000111,0.2000000000000000111,0.2000000000000000111]],["v10"]],["Annotate",["b3","v10"],["meta_schedule.unroll_explicit"],[]],["GetLoops",["b1"],[],["l11","l12","l13"]],["Fuse",["l11","l12","l13"],[1],["l14"]],["Split",["l14","None",256,256],[1],["l15","l16","l17"]],["Reorder",["l16","l17","l15"],[],[]],["Bind",["l16"],["blockIdx.x"],[]],["Bind",["l17"],["threadIdx.x"],[]],["GetLoops",["b0"],[],["l18","l19","l20","l21"]],["Fuse",["l18","l19"],[1],["l22"]],["Bind",["l22"],["blockIdx.x"],[]],["EnterPostproc",[],[],[]],["GetBlock",[],["root","main"],["b23"]],["Unannotate",["b23"],["meta_schedule.unroll_explicit"],[]],["GetChildBlocks",["b23"],[],["b24","b25"]],["GetLoops",["b24"],[],["l26","l27","l28"]],["Annotate",["l26",1024],["pragma_auto_unroll_max_step"],[]],["Annotate",["l26",1],["pragma_unroll_explicit"],[]],["GetLoops",["b25"],[],["l29","l30","l31"]]],[[5,5],[9,4]]],[6.0109946942081812012e-05],{"host":{"keys":["cpu"],"kind":"llvm","tag":""},"keys":["metal","gpu"],"kind":"metal","max_function_args":31,"max_num_threads":256,"max_shared_memory_per_block":32768,"max_threads_per_block":256,"tag":"","thread_warp_size":32},[["TENSOR","float32",[1,128,2560]],["TENSOR","float32",[2560]],["TENSOR","float32",[2560]],["TENSOR","float16",[1,128,2560]]]]]
[10,[[[["GetBlock",[],["NT_matmul","main"],["b0"]],["GetBlock",[],["T_divide","main"],["b1"]],["GetBlock",[],["T_maximum","main"],["b2"]],["GetBlock",[],["T_minimum","main"],["b3"]],["GetBlock",[],["compute","main"],["b4"]],["GetBlock",[],["root","main"],["b5"]],["Annotate",["b0","\"SSSRRSRS\""],["meta_schedule.tiling_structure"],[]],["GetLoops",["b0"],[],["l6","l7","l8","l9","l10"]],["SamplePerfectTile",["l6"],[5,64],["v11","v12","v13","v14","v15"]],["Split",["l6","v11","v12","v13","v14","v15"],[1],["l16","l17","l18","l19","l20"]],["SamplePerfectTile",["l7"],[5,64],["v21","v22","v23","v24","v25"]],["Split",["l7","v21","v22","v23","v24","v25"],[1],["l26","l27","l28","l29","l30"]],["SamplePerfectTile",["l8"],[5,64],["v31","v32","v33","v34","v35"]],["Split",["l8","v31","v32","v33","v34","v35"],[1],["l36","l37","l38","l39","l40"]],["SamplePerfectTile",["l9"],[5,64],["v41","v42","v43","v44","v45"]],["Split",["l9","v41","v42","v43","v44","v45"],[1],["l46","l47","l48","l49","l50"]],["SamplePerfectTile",["l10"],[3,64],["v51","v52","v53"]],["Split",["l10","v51","v52","v53"],[1],["l54","l55","l56"]],["Reorder",["l16","l26","l36","l46","l17","l27","l37","l47","l18","l28","l38","l48","l54","l55","l19","l29","l39","l49","l56","l20","l30","l40","l50"],[],[]],["Fuse",["l16","l26","l36","l46"],[1],["l57"]],["Bind",["l57"],["blockIdx.x"],[]],["Fuse",["l17","l27","l37","l47"],[1],["l58"]],["Bind",["l58"],["vthread.x"],[]],["Fuse",["l18","l28","l38","l48"],[1],["l59"]],["Bind",["l59"],["threadIdx.x"],[]],["Annotate",["b0",32],["meta_schedule.thread_extent_low_inclusive"],[]],["Annotate",["b0",256],["meta_schedule.thread_extent_high_inclusive"],[]],["CacheWrite",["b0",[]],[0,"local"],["b60"]],["ReverseComputeAt",["b60","l59"],[1,-1],[]],["CacheRead",["b0",["b0"]],[0,"shared"],["b61"]],["ComputeAt",["b61","l54"],[1,-1],[]],["GetLoops",["b61"],[],["l62","l63","l64","l65","l66","l67","l68","l69"]],["Fuse",["l66","l67","l68","l69"],[1],["l70"]],["SampleCategorical",[],[[1,2,4,8],[0.25,0.25,0.25,0.25]],["v71"]],["Annotate",["b61","v71"],["meta_schedule.cooperative_fetch"],[]],["CacheRead",["b0",["b0"]],[1,"shared"],["b72"]],["ComputeAt",["b72","l54"],[1,-1],[]],["GetLoops",["b72"],[],["l73","l74","l75","l76","l77","l78","l79","l80"]],["Fuse",["l77","l78","l79","l80"],[1],["l81"]],["SampleCategorical",[],[[1,2,4,8],[0.25,0.25,0.25,0.25]],["v82"]],["Annotate",["b72","v82"],["meta_schedule.cooperative_fetch"],[]],["ReverseComputeInline",["b4"],[],[]],["ReverseComputeInline",["b3"],[],[]],["ReverseComputeInline",["b2"],[],[]],["ReverseComputeInline",["b1"],[],[]],["SampleCategorical",[],[[0,16,64,512,1024],[0.2000000000000000111,0.2000000000000000111,0.2000000000000000111,0.2000000000000000111,0.2000000000000000111]],["v83"]],["Annotate",["b5","v83"],["meta_schedule.unroll_explicit"],[]],["EnterPostproc",[],[],[]],["Unannotate",["b61"],["meta_schedule.cooperative_fetch"],[]],["GetLoops",["b61"],[],["l84","l85","l86","l87","l88"]],["Split",["l88","None",128,4],[1],["l89","l90","l91"]],["Vectorize",["l91"],[],[]],["Bind",["l90"],["threadIdx.x"],[]],["Unannotate",["b72"],["meta_schedule.cooperative_fetch"],[]],["GetLoops",["b72"],[],["l92","l93","l94","l95","l96"]],["Split",["l96","None",128],[1],["l97","l98"]],["Bind",["l98"],["threadIdx.x"],[]],["GetBlock",[],["root","main"],["b99"]],["Unannotate",["b99"],["meta_schedule.unroll_explicit"],[]],["GetChildBlocks",["b99"],[],["b100","b101","b102","b103"]],["GetLoops",["b100"],[],["l104","l105","l106","l107","l108","l109","l110"]],["GetLoops",["b101"],[],["l111","l112","l113","l114","l115","l116"]],["GetLoops",["b102"],[],["l117","l118","l119","l120","l121","l122","l123","l124","l125","l126","l127","l128","l129","l130"]],["Annotate",["l117",16],["pragma_auto_unroll_max_step"],[]],["Annotate",["l117",1],["pragma_unroll_explicit"],[]],["GetLoops",["b103"],[],["l131","l132","l133","l134","l135","l136","l137"]],["GetBlock",[],["NT_matmul","main"],["b138"]],["GetLoops",["b138"],[],["l139","l140","l141","l142","l143","l144","l145","l146","l147","l148","l149","l150","l151","l152"]],["DecomposeReduction",["b138","l142"],[],["b153"]]],[[8,[1,1,1,1,1]],[10,[16,1,2,1,1]],[12,[4,4,8,1,1]],[14,[8,2,8,1,1]],[16,[2,1,40]],[33,2],[39,0],[45,1]]],[7.0513855192588992997e-05],{"host":{"keys":["cpu"],"kind":"llvm","tag":""},"keys":["metal","gpu"],"kind":"metal","max_function_args":31,"max_num_threads":256,"max_shared_memory_per_block":32768,"max_threads_per_block":256,"tag":"","thread_warp_size":32},[["TENSOR","float16",[1,32,128,80]],["TENSOR","float16",[1,32,128,80]],["TENSOR","float16",[1,1,128,128]],["TENSOR","float32",[1,32,128,128]]]]]
[11,[[[["GetBlock",[],["NT_matmul","main"],["b0"]],["GetBlock",[],["T_add","main"],["b1"]],["GetBlock",[],["T_add_1","main"],["b2"]],["GetBlock",[],["root","main"],["b3"]],["Annotate",["b0","\"SSSRRSRS\""],["meta_schedule.tiling_structure"],[]],["GetLoops",["b0"],[],["l4","l5","l6","l7"]],["SamplePerfectTile",["l4"],[5,64],["v8","v9","v10","v11","v12"]],["Split",["l4","v8","v9","v10","v11","v12"],[1],["l13","l14","l15","l16","l17"]],["SamplePerfectTile",["l5"],[5,64],["v18","v19","v20","v21","v22"]],["Split",["l5","v18","v19","v20","v21","v22"],[1],["l23","l24","l25","l26","l27"]],["SamplePerfectTile",["l6"],[5,64],["v28","v29","v30","v31","v32"]],["Split",["l6","v28","v29","v30","v31","v32"],[1],["l33","l34","l35","l36","l37"]],["SamplePerfectTile",["l7"],[3,64],["v38","v39","v40"]],["Split",["l7","v38","v39","v40"],[1],["l41","l42","l43"]],["Reorder",["l13","l23","l33","l14","l24","l34","l15","l25","l35","l41","l42","l16","l26","l36","l43","l17","l27","l37"],[],[]],["Fuse",["l13","l23","l33"],[1],["l44"]],["Bind",["l44"],["blockIdx.x"],[]],["Fuse",["l14","l24","l34"],[1],["l45"]],["Bind",["l45"],["vthread.x"],[]],["Fuse",["l15","l25","l35"],[1],["l46"]],["Bind",["l46"],["threadIdx.x"],[]],["Annotate",["b0",32],["meta_schedule.thread_extent_low_inclusive"],[]],["Annotate",["b0",256],["meta_schedule.thread_extent_high_inclusive"],[]],["CacheWrite",["b0",[]],[0,"local"],["b47"]],["ReverseComputeAt",["b47","l46"],[1,-1],[]],["CacheRead",["b0",["b0"]],[0,"shared"],["b48"]],["ComputeAt",["b48","l41"],[1,-1],[]],["GetLoops",["b48"],[],["l49","l50","l51","l52","l53","l54","l55"]],["Fuse",["l53","l54","l55"],[1],["l56"]],["SampleCategorical",[],[[1,2,4,8],[0.25,0.25,0.25,0.25]],["v57"]],["Annotate",["b48","v57"],["meta_schedule.cooperative_fetch"],[]],["CacheRead",["b0",["b0"]],[1,"shared"],["b58"]],["ComputeAt",["b58","l41"],[1,-1],[]],["GetLoops",["b58"],[],["l59","l60","l61","l62","l63","l64"]],["Fuse",["l63","l64"],[1],["l65"]],["SampleCategorical",[],[[1,2,4,8],[0.25,0.25,0.25,0.25]],["v66"]],["Annotate",["b58","v66"],["meta_schedule.cooperative_fetch"],[]],["ReverseComputeInline",["b2"],[],[]],["ReverseComputeInline",["b1"],[],[]],["SampleCategorical",[],[[0,16,64,512,1024],[0.2000000000000000111,0.2000000000000000111,0.2000000000000000111,0.2000000000000000111,0.2000000000000000111]],["v67"]],["Annotate",["b3","v67"],["meta_schedule.unroll_explicit"],[]],["EnterPostproc",[],[],[]],["Unannotate",["b48"],["meta_schedule.cooperative_fetch"],[]],["GetLoops",["b48"],[],["l68","l69","l70","l71","l72"]],["Split",["l72","None",160,4],[1],["l73","l74","l75"]],["Vectorize",["l75"],[],[]],["Bind",["l74"],["threadIdx.x"],[]],["Unannotate",["b58"],["meta_schedule.cooperative_fetch"],[]],["GetLoops",["b58"],[],["l76","l77","l78","l79","l80"]],["Split",["l80","None",160],[1],["l81","l82"]],["Bind",["l82"],["threadIdx.x"],[]],["GetBlock",[],["root","main"],["b83"]],["Unannotate",["b83"],["meta_schedule.unroll_explicit"],[]],["GetChildBlocks",["b83"],[],["b84","b85","b86","b87"]],["GetLoops",["b84"],[],["l88","l89","l90","l91","l92","l93","l94"]],["GetLoops",["b85"],[],["l95","l96","l97","l98","l99","l100"]],["GetLoops",["b86"],[],["l101","l102","l103","l104","l105","l106","l107","l108","l109","l110","l111","l112"]],["Annotate",["l101",64],["pragma_auto_unroll_max_step"],[]],["Annotate",["l101",1],["pragma_unroll_explicit"],[]],["GetLoops",["b87"],[],["l113","l114","l115","l116","l117","l118"]],["GetBlock",[],["NT_matmul","main"],["b119"]],["GetLoops",["b119"],[],["l120","l121","l122","l123","l124","l125","l126","l127","l128","l129","l130","l131"]],["DecomposeReduction",["b119","l123"],[],["b132"]]],[[6,[1,1,1,1,1]],[8,[2,1,16,1,4]],[10,[64,4,10,1,1]],[12,[128,10,2]],[29,2],[35,0],[39,2]]],[0.00078777166500000009742],{"host":{"keys":["cpu"],"kind":"llvm","tag":""},"keys":["metal","gpu"],"kind":"metal","max_function_args":31,"max_num_threads":256,"max_shared_memory_per_block":32768,"max_threads_per_block":256,"tag":"","thread_warp_size":32},[["TENSOR","float16",[1,128,2560]],["TENSOR","float16",[2560,2560]],["TENSOR","float16",[2560]],["TENSOR","float16",[1,128,2560]],["TENSOR","float16",[1,128,2560]]]]]
[12,[[[["GetBlock",[],["A_red_temp","main"],["b0"]],["GetBlock",[],["T_layer_norm","main"],["b1"]],["GetBlock",[],["compute","main"],["b2"]],["GetBlock",[],["root","main"],["b3"]],["ReverseComputeInline",["b2"],[],[]],["SampleCategorical",[],[[4,8,16,32,64,128,256,512],[0.125,0.125,0.125,0.125,0.125,0.125,0.125,0.125]],["v4"]],["GetLoops",["b0"],[],["l5","l6","l7"]],["Split",["l7","None","v4"],[1],["l8","l9"]],["Bind",["l9"],["threadIdx.x"],[]],["SampleCategorical",[],[[0,16,64,512,1024],[0.2000000000000000111,0.2000000000000000111,0.2000000000000000111,0.2000000000000000111,0.2000000000000000111]],["v10"]],["Annotate",["b3","v10"],["meta_schedule.unroll_explicit"],[]],["GetLoops",["b1"],[],["l11","l12","l13"]],["Fuse",["l11","l12","l13"],[1],["l14"]],["SampleCategorical",[],[[32,64,128,256],[0.25,0.25,0.25,0.25]],["v15"]],["Split",["l14","None","v15"],[1],["l16","l17"]],["Bind",["l16"],["blockIdx.x"],[]],["Bind",["l17"],["threadIdx.x"],[]],["GetLoops",["b0"],[],["l18","l19","l20","l21"]],["Fuse",["l18","l19"],[1],["l22"]],["Bind",["l22"],["blockIdx.x"],[]],["EnterPostproc",[],[],[]],["GetBlock",[],["root","main"],["b23"]],["Unannotate",["b23"],["meta_schedule.unroll_explicit"],[]],["GetChildBlocks",["b23"],[],["b24","b25"]],["GetLoops",["b24"],[],["l26","l27","l28"]],["Annotate",["l26",512],["pragma_auto_unroll_max_step"],[]],["Annotate",["l26",1],["pragma_unroll_explicit"],[]],["GetLoops",["b25"],[],["l29","l30"]]],[[5,2],[9,3],[13,0]]],[5.486335153707052356e-05],{"host":{"keys":["cpu"],"kind":"llvm","tag":""},"keys":["metal","gpu"],"kind":"metal","max_function_args":31,"max_num_threads":256,"max_shared_memory_per_block":32768,"max_threads_per_block":256,"tag":"","thread_warp_size":32},[["TENSOR","float32",[1,1,2560]],["TENSOR","float32",[2560]],["TENSOR","float32",[2560]],["TENSOR","float16",[1,1,2560]]]]]
[13,[[[["GetBlock",[],["A_red_temp","main"],["b0"]],["GetBlock",[],["T_layer_norm","main"],["b1"]],["GetBlock",[],["root","main"],["b2"]],["SampleCategorical",[],[[4,8,16,32,64,128,256,512],[0.125,0.125,0.125,0.125,0.125,0.125,0.125,0.125]],["v3"]],["GetLoops",["b0"],[],["l4","l5","l6"]],["Split",["l6","None","v3"],[1],["l7","l8"]],["Bind",["l8"],["threadIdx.x"],[]],["SampleCategorical",[],[[0,16,64,512,1024],[0.2000000000000000111,0.2000000000000000111,0.2000000000000000111,0.2000000000000000111,0.2000000000000000111]],["v9"]],["Annotate",["b2","v9"],["meta_schedule.unroll_explicit"],[]],["GetLoops",["b1"],[],["l10","l11","l12"]],["Fuse",["l10","l11","l12"],[1],["l13"]],["Split",["l13","None",256,256],[1],["l14","l15","l16"]],["Reorder",["l15","l16","l14"],[],[]],["Bind",["l15"],["blockIdx.x"],[]],["Bind",["l16"],["threadIdx.x"],[]],["GetLoops",["b0"],[],["l17","l18","l19","l20"]],["Fuse",["l17","l18"],[1],["l21"]],["Bind",["l21"],["blockIdx.x"],[]],["EnterPostproc",[],[],[]],["GetBlock",[],["root","main"],["b22"]],["Unannotate",["b22"],["meta_schedule.unroll_explicit"],[]],["GetChildBlocks",["b22"],[],["b23","b24"]],["GetLoops",["b23"],[],["l25","l26","l27"]],["Annotate",["l25",1024],["pragma_auto_unroll_max_step"],[]],["Annotate",["l25",1],["pragma_unroll_explicit"],[]],["GetLoops",["b24"],[],["l28","l29","l30"]]],[[3,3],[7,4]]],[6.1417441487114483542e-05],{"host":{"keys":["cpu"],"kind":"llvm","tag":""},"keys":["metal","gpu"],"kind":"metal","max_function_args":31,"max_num_threads":256,"max_shared_memory_per_block":32768,"max_threads_per_block":256,"tag":"","thread_warp_size":32},[["TENSOR","float32",[1,128,2560]],["TENSOR","float32",[2560]],["TENSOR","float32",[2560]],["TENSOR","float32",[1,128,2560]]]]]
[14,[[[["GetBlock",[],["matmul","main"],["b0"]],["GetBlock",[],["decode","main"],["b1"]],["GetBlock",[],["T_add","main"],["b2"]],["CacheWrite",["b0",[]],[0,"local"],["b3"]],["GetLoops",["b0"],[],["l4","l5","l6","l7"]],["SamplePerfectTile",["l6"],[3,-1],["v8","v9","v10"]],["Split",["l6","v8","v9","v10"],[1],["l11","l12","l13"]],["Fuse",["l4","l5","l11"],[1],["l14"]],["Split",["l7","None",8],[1],["l15","l16"]],["SamplePerfectTile",["l15"],[2,-1],["v17","v18"]],["Split",["l15","v17","v18"],[1],["l19","l20"]],["Fuse",["l20","l16"],[1],["l21"]],["Unroll",["l21"],[],[]],["Bind",["l14"],["blockIdx.x"],[]],["Bind",["l12"],["vthread.x"],[]],["Bind",["l13"],["threadIdx.x"],[]],["Reorder",["l14","l12","l13","l19","l21"],[],[]],["ComputeAt",["b1","l19"],[1,-1],[]],["SetScope",["b1"],[0,"local"],[]],["GetLoops",["b1"],[],["l22","l23","l24","l25","l26","l27"]],["Split",["l26","None",8],[1],["l28","l29"]],["Unroll",["l29"],[],[]],["CacheRead",["b0",[]],[0,"shared"],["b30"]],["ComputeAt",["b30","l13"],[1,-1],[]],["GetLoops",["b30"],[],["l31","l32","l33","l34","l35","l36"]],["Fuse",["l35","l36"],[1],["l37"]],["SampleCategorical",[],[[1,2,3,4],[0.25,0.25,0.25,0.25]],["v38"]],["Split",["l37","None","v10","v38"],[1],["l39","l40","l41"]],["Bind",["l40"],["threadIdx.x"],[]],["Vectorize",["l41"],[],[]],["StorageAlign",["b30"],[0,-2,32,8],[]],["ReverseComputeInline",["b2"],[],[]],["ReverseComputeAt",["b3","l13"],[1,-1],[]],["DecomposeReduction",["b0","l19"],[],["b42"]],["EnterPostproc",[],[],[]]],[[5,[40,1,64]],[9,[40,8]],[26,3]]],[5.3628879329608939439e-05],{"host":{"keys":["cpu"],"kind":"llvm","tag":""},"keys":["metal","gpu"],"kind":"metal","max_function_args":31,"max_num_threads":256,"max_shared_memory_per_block":32768,"max_threads_per_block":256,"tag":"","thread_warp_size":32},[["TENSOR","uint32",[320,2560]],["TENSOR","float16",[80,2560]],["TENSOR","float16",[1,1,2560]],["TENSOR","float16",[2560]],["TENSOR","float16",[1,1,2560]]]]]
[15,[[[["GetBlock",[],["decode","main"],["b0"]],["GetLoops",["b0"],[],["l1","l2"]],["Split",["l1","None",8],[1],["l3","l4"]],["SamplePerfectTile",["l3"],[3,4],["v5","v6","v7"]],["SamplePerfectTile",["l2"],[2,16],["v8","v9"]],["Split",["l3","v5","v6","v7"],[1],["l10","l11","l12"]],["Split",["l2","v8","v9"],[1],["l13","l14"]],["Reorder",["l10","l13","l11","l14","l12","l4"],[],[]],["Bind",["l10"],["blockIdx.y"],[]],["Bind",["l13"],["blockIdx.x"],[]],["Bind",["l11"],["threadIdx.y"],[]],["Bind",["l14"],["threadIdx.x"],[]],["Unroll",["l4"],[],[]],["CacheWrite",["b0",[]],[0,"shared"],["b15"]],["ComputeInline",["b15"],[],[]],["GetBlock",[],["T_transpose","main"],["b16"]],["ReverseComputeAt",["b16","l13"],[1,-1],[]],["GetLoops",["b16"],[],["l17","l18","l19","l20"]],["Fuse",["l19","l20"],[1],["l21"]],["Split",["l21","None","v6","v9",4],[1],["l22","l23","l24","l25"]],["Bind",["l23"],["threadIdx.y"],[]],["Bind",["l24"],["threadIdx.x"],[]],["Vectorize",["l25"],[],[]],["StorageAlign",["b0"],[0,0,32,1],[]],["EnterPostproc",[],[],[]]],[[3,[40,4,2]],[4,[320,8]]]],[0.00015633006470588237829],{"host":{"keys":["cpu"],"kind":"llvm","tag":""},"keys":["metal","gpu"],"kind":"metal","max_function_args":31,"max_num_threads":256,"max_shared_memory_per_block":32768,"max_threads_per_block":256,"tag":"","thread_warp_size":32},[["TENSOR","uint32",[320,2560]],["TENSOR","float16",[80,2560]],["TENSOR","float16",[2560,2560]]]]]
[16,[[[["GetBlock",[],["compute","main"],["b0"]],["GetLoops",["b0"],[],["l1","l2","l3"]],["Fuse",["l1","l2","l3"],[1],["l4"]],["SampleCategorical",[],[[32,64,128,256],[0.25,0.25,0.25,0.25]],["v5"]],["Split",["l4","None","v5"],[1],["l6","l7"]],["Bind",["l6"],["blockIdx.x"],[]],["Bind",["l7"],["threadIdx.x"],[]],["EnterPostproc",[],[],[]]],[[3,0]]],[2.7742246882793013984e-05],{"host":{"keys":["cpu"],"kind":"llvm","tag":""},"keys":["metal","gpu"],"kind":"metal","max_function_args":31,"max_num_threads":256,"max_shared_memory_per_block":32768,"max_threads_per_block":256,"tag":"","thread_warp_size":32},[["TENSOR","float16",[1,1,2560]],["TENSOR","float32",[1,1,2560]]]]]
[17,[[[["GetBlock",[],["matmul","main"],["b0"]],["GetBlock",[],["decode","main"],["b1"]],["GetBlock",[],["T_add","main"],["b2"]],["GetBlock",[],["T_add_1","main"],["b3"]],["CacheWrite",["b0",[]],[0,"local"],["b4"]],["GetLoops",["b0"],[],["l5","l6","l7","l8"]],["SamplePerfectTile",["l7"],[3,-1],["v9","v10","v11"]],["Split",["l7","v9","v10","v11"],[1],["l12","l13","l14"]],["Fuse",["l5","l6","l12"],[1],["l15"]],["Split",["l8","None",8],[1],["l16","l17"]],["SamplePerfectTile",["l16"],[2,-1],["v18","v19"]],["Split",["l16","v18","v19"],[1],["l20","l21"]],["Fuse",["l21","l17"],[1],["l22"]],["Unroll",["l22"],[],[]],["Bind",["l15"],["blockIdx.x"],[]],["Bind",["l13"],["vthread.x"],[]],["Bind",["l14"],["threadIdx.x"],[]],["Reorder",["l15","l13","l14","l20","l22"],[],[]],["ComputeAt",["b1","l20"],[1,-1],[]],["SetScope",["b1"],[0,"local"],[]],["GetLoops",["b1"],[],["l23","l24","l25","l26","l27","l28"]],["Split",["l27","None",8],[1],["l29","l30"]],["Unroll",["l30"],[],[]],["CacheRead",["b0",[]],[0,"shared"],["b31"]],["ComputeAt",["b31","l14"],[1,-1],[]],["GetLoops",["b31"],[],["l32","l33","l34","l35","l36","l37"]],["Fuse",["l36","l37"],[1],["l38"]],["SampleCategorical",[],[[1,2,3,4],[0.25,0.25,0.25,0.25]],["v39"]],["Split",["l38","None","v11","v39"],[1],["l40","l41","l42"]],["Bind",["l41"],["threadIdx.x"],[]],["Vectorize",["l42"],[],[]],["StorageAlign",["b31"],[0,-2,32,8],[]],["ComputeInline",["b2"],[],[]],["ReverseComputeInline",["b3"],[],[]],["ReverseComputeAt",["b4","l14"],[1,-1],[]],["DecomposeReduction",["b0","l20"],[],["b43"]],["EnterPostproc",[],[],[]]],[[6,[40,1,64]],[10,[40,8]],[27,3]]],[5.3080191127541588765e-05],{"host":{"keys":["cpu"],"kind":"llvm","tag":""},"keys":["metal","gpu"],"kind":"metal","max_function_args":31,"max_num_threads":256,"max_shared_memory_per_block":32768,"max_threads_per_block":256,"tag":"","thread_warp_size":32},[["TENSOR","uint32",[320,2560]],["TENSOR","float16",[80,2560]],["TENSOR","float16",[1,1,2560]],["TENSOR","float16",[2560]],["TENSOR","float16",[1,1,2560]],["TENSOR","float16",[1,1,2560]]]]]
[18,[[[["GetBlock",[],["T_divide","main"],["b0"]],["GetLoops",["b0"],[],["l1","l2","l3"]],["Fuse",["l1","l2","l3"],[1],["l4"]],["SampleCategorical",[],[[32,64,128,256],[0.25,0.25,0.25,0.25]],["v5"]],["Split",["l4","None","v5"],[1],["l6","l7"]],["Bind",["l6"],["blockIdx.x"],[]],["Bind",["l7"],["threadIdx.x"],[]],["EnterPostproc",[],[],[]]],[[3,0]]],[2.7757464245810053603e-05],{"host":{"keys":["cpu"],"kind":"llvm","tag":""},"keys":["metal","gpu"],"kind":"metal","max_function_args":31,"max_num_threads":256,"max_shared_memory_per_block":32768,"max_threads_per_block":256,"tag":"","thread_warp_size":32},[["TENSOR","float32",[1,1,50432]],["TENSOR","float32",[]],["TENSOR","float32",[1,1,50432]]]]]
[19,[[[["GetBlock",[],["T_squeeze","main"],["b0"]],["GetLoops",["b0"],[],["l1","l2","l3"]],["Fuse",["l1","l2","l3"],[1],["l4"]],["SampleCategorical",[],[[32,64,128,256],[0.25,0.25,0.25,0.25]],["v5"]],["Split",["l4","None","v5"],[1],["l6","l7"]],["Bind",["l6"],["blockIdx.x"],[]],["Bind",["l7"],["threadIdx.x"],[]],["EnterPostproc",[],[],[]]],[[3,0]]],[2.7315636893911777327e-05],{"host":{"keys":["cpu"],"kind":"llvm","tag":""},"keys":["metal","gpu"],"kind":"metal","max_function_args":31,"max_num_threads":256,"max_shared_memory_per_block":32768,"max_threads_per_block":256,"tag":"","thread_warp_size":32},[["TENSOR","float16",[1,1,32,80]],["TENSOR","float16",[1,32,80]]]]]
[20,[[[["GetBlock",[],["T_reshape","main"],["b0"]],["GetLoops",["b0"],[],["l1","l2","l3"]],["Fuse",["l1","l2","l3"],[1],["l4"]],["SampleCategorical",[],[[32,64,128,256],[0.25,0.25,0.25,0.25]],["v5"]],["Split",["l4","None","v5"],[1],["l6","l7"]],["Bind",["l6"],["blockIdx.x"],[]],["Bind",["l7"],["threadIdx.x"],[]],["EnterPostproc",[],[],[]]],[[3,0]]],[2.7665893218158424236e-05],{"host":{"keys":["cpu"],"kind":"llvm","tag":""},"keys":["metal","gpu"],"kind":"metal","max_function_args":31,"max_num_threads":256,"max_shared_memory_per_block":32768,"max_threads_per_block":256,"tag":"","thread_warp_size":32},[["TENSOR","float16",[1,2560]],["TENSOR","float16",[1,1,2560]]]]]
[21,[[[["GetBlock",[],["A_red_temp","main"],["b0"]],["GetBlock",[],["T_layer_norm","main"],["b1"]],["GetBlock",[],["root","main"],["b2"]],["SampleCategorical",[],[[4,8,16,32,64,128,256,512],[0.125,0.125,0.125,0.125,0.125,0.125,0.125,0.125]],["v3"]],["GetLoops",["b0"],[],["l4","l5","l6"]],["Split",["l6","None","v3"],[1],["l7","l8"]],["Bind",["l8"],["threadIdx.x"],[]],["SampleCategorical",[],[[0,16,64,512,1024],[0.2000000000000000111,0.2000000000000000111,0.2000000000000000111,0.2000000000000000111,0.2000000000000000111]],["v9"]],["Annotate",["b2","v9"],["meta_schedule.unroll_explicit"],[]],["GetLoops",["b1"],[],["l10","l11","l12"]],["Fuse",["l10","l11","l12"],[1],["l13"]],["SampleCategorical",[],[[32,64,128,256],[0.25,0.25,0.25,0.25]],["v14"]],["Split",["l13","None","v14"],[1],["l15","l16"]],["Bind",["l15"],["blockIdx.x"],[]],["Bind",["l16"],["threadIdx.x"],[]],["GetLoops",["b0"],[],["l17","l18","l19","l20"]],["Fuse",["l17","l18"],[1],["l21"]],["Bind",["l21"],["blockIdx.x"],[]],["EnterPostproc",[],[],[]],["GetBlock",[],["root","main"],["b22"]],["Unannotate",["b22"],["meta_schedule.unroll_explicit"],[]],["GetChildBlocks",["b22"],[],["b23","b24"]],["GetLoops",["b23"],[],["l25","l26","l27"]],["GetLoops",["b24"],[],["l28","l29"]]],[[3,1],[7,0],[11,0]]],[5.5090997626582272019e-05],{"host":{"keys":["cpu"],"kind":"llvm","tag":""},"keys":["metal","gpu"],"kind":"metal","max_function_args":31,"max_num_threads":256,"max_shared_memory_per_block":32768,"max_threads_per_block":256,"tag":"","thread_warp_size":32},[["TENSOR","float32",[1,1,2560]],["TENSOR","float32",[2560]],["TENSOR","float32",[2560]],["TENSOR","float32",[1,1,2560]]]]]
[22,[[[["GetBlock",[],["T_transpose","main"],["b0"]],["GetLoops",["b0"],[],["l1","l2","l3","l4"]],["Fuse",["l1","l2","l3","l4"],[1],["l5"]],["SampleCategorical",[],[[32,64,128,256],[0.25,0.25,0.25,0.25]],["v6"]],["Split",["l5","None","v6"],[1],["l7","l8"]],["Bind",["l7"],["blockIdx.x"],[]],["Bind",["l8"],["threadIdx.x"],[]],["EnterPostproc",[],[],[]]],[[3,1]]],[2.7697540873663222428e-05],{"host":{"keys":["cpu"],"kind":"llvm","tag":""},"keys":["metal","gpu"],"kind":"metal","max_function_args":31,"max_num_threads":256,"max_shared_memory_per_block":32768,"max_threads_per_block":256,"tag":"","thread_warp_size":32},[["TENSOR","float16",[1,1,32,80]],["TENSOR","float16",[1,32,1,80]]]]]
[23,[[[["GetBlock",[],["matmul","main"],["b0"]],["GetBlock",[],["root","main"],["b1"]],["Annotate",["b0","\"SSSRRSRS\""],["meta_schedule.tiling_structure"],[]],["GetLoops",["b0"],[],["l2","l3","l4","l5","l6"]],["SamplePerfectTile",["l2"],[5,64],["v7","v8","v9","v10","v11"]],["Split",["l2","v7","v8","v9","v10","v11"],[1],["l12","l13","l14","l15","l16"]],["SamplePerfectTile",["l3"],[5,64],["v17","v18","v19","v20","v21"]],["Split",["l3","v17","v18","v19","v20","v21"],[1],["l22","l23","l24","l25","l26"]],["SamplePerfectTile",["l4"],[5,64],["v27","v28","v29","v30","v31"]],["Split",["l4","v27","v28","v29","v30","v31"],[1],["l32","l33","l34","l35","l36"]],["SamplePerfectTile",["l5"],[5,64],["v37","v38","v39","v40","v41"]],["Split",["l5","v37","v38","v39","v40","v41"],[1],["l42","l43","l44","l45","l46"]],["SamplePerfectTile",["l6"],[3,64],["v47","v48","v49"]],["Split",["l6","v47","v48","v49"],[1],["l50","l51","l52"]],["Reorder",["l12","l22","l32","l42","l13","l23","l33","l43","l14","l24","l34","l44","l50","l51","l15","l25","l35","l45","l52","l16","l26","l36","l46"],[],[]],["Fuse",["l12","l22","l32","l42"],[1],["l53"]],["Bind",["l53"],["blockIdx.x"],[]],["Fuse",["l13","l23","l33","l43"],[1],["l54"]],["Bind",["l54"],["vthread.x"],[]],["Fuse",["l14","l24","l34","l44"],[1],["l55"]],["Bind",["l55"],["threadIdx.x"],[]],["Annotate",["b0",32],["meta_schedule.thread_extent_low_inclusive"],[]],["Annotate",["b0",256],["meta_schedule.thread_extent_high_inclusive"],[]],["CacheWrite",["b0",[]],[0,"local"],["b56"]],["ReverseComputeAt",["b56","l55"],[1,-1],[]],["CacheRead",["b0",["b0"]],[0,"shared"],["b57"]],["ComputeAt",["b57","l50"],[1,-1],[]],["GetLoops",["b57"],[],["l58","l59","l60","l61","l62","l63","l64","l65"]],["Fuse",["l62","l63","l64","l65"],[1],["l66"]],["SampleCategorical",[],[[1,2,4,8],[0.25,0.25,0.25,0.25]],["v67"]],["Annotate",["b57","v67"],["meta_schedule.cooperative_fetch"],[]],["CacheRead",["b0",["b0"]],[1,"shared"],["b68"]],["ComputeAt",["b68","l50"],[1,-1],[]],["GetLoops",["b68"],[],["l69","l70","l71","l72","l73","l74","l75","l76"]],["Fuse",["l73","l74","l75","l76"],[1],["l77"]],["SampleCategorical",[],[[1,2,4,8],[0.25,0.25,0.25,0.25]],["v78"]],["Annotate",["b68","v78"],["meta_schedule.cooperative_fetch"],[]],["SampleCategorical",[],[[0,16,64,512,1024],[0.2000000000000000111,0.2000000000000000111,0.2000000000000000111,0.2000000000000000111,0.2000000000000000111]],["v79"]],["Annotate",["b1","v79"],["meta_schedule.unroll_explicit"],[]],["EnterPostproc",[],[],[]],["Unannotate",["b57"],["meta_schedule.cooperative_fetch"],[]],["GetLoops",["b57"],[],["l80","l81","l82","l83","l84"]],["Split",["l84","None",80,8],[1],["l85","l86","l87"]],["Vectorize",["l87"],[],[]],["Bind",["l86"],["threadIdx.x"],[]],["Unannotate",["b68"],["meta_schedule.cooperative_fetch"],[]],["GetLoops",["b68"],[],["l88","l89","l90","l91","l92"]],["Split",["l92","None",80],[1],["l93","l94"]],["Bind",["l94"],["threadIdx.x"],[]],["GetBlock",[],["root","main"],["b95"]],["Unannotate",["b95"],["meta_schedule.unroll_explicit"],[]],["GetChildBlocks",["b95"],[],["b96","b97","b98","b99"]],["GetLoops",["b96"],[],["l100","l101","l102","l103","l104","l105","l106"]],["GetLoops",["b97"],[],["l107","l108","l109","l110","l111","l112"]],["GetLoops",["b98"],[],["l113","l114","l115","l116","l117","l118","l119","l120","l121","l122","l123","l124","l125","l126"]],["GetLoops",["b99"],[],["l127","l128","l129","l130","l131","l132","l133"]],["GetBlock",[],["matmul","main"],["b134"]],["GetLoops",["b134"],[],["l135","l136","l137","l138","l139","l140","l141","l142","l143","l144","l145","l146","l147","l148"]],["DecomposeReduction",["b134","l138"],[],["b149"]]],[[4,[1,1,1,1,1]],[6,[1,2,16,1,1]],[8,[1,1,1,1,1]],[10,[8,1,5,1,2]],[12,[8,2,2]],[29,3],[35,0],[37,0]]],[2.8242842455621300769e-05],{"host":{"keys":["cpu"],"kind":"llvm","tag":""},"keys":["metal","gpu"],"kind":"metal","max_function_args":31,"max_num_threads":256,"max_shared_memory_per_block":32768,"max_threads_per_block":256,"tag":"","thread_warp_size":32},[["TENSOR","float16",[1,32,1,32]],["TENSOR","float16",[1,32,32,80]],["TENSOR","float16",[1,32,1,80]]]]]
[24,[[[["GetBlock",[],["T_reshape","main"],["b0"]],["GetLoops",["b0"],[],["l1","l2","l3","l4"]],["Fuse",["l1","l2","l3","l4"],[1],["l5"]],["SampleCategorical",[],[[32,64,128,256],[0.25,0.25,0.25,0.25]],["v6"]],["Split",["l5","None","v6"],[1],["l7","l8"]],["Bind",["l7"],["blockIdx.x"],[]],["Bind",["l8"],["threadIdx.x"],[]],["EnterPostproc",[],[],[]]],[[3,0]]],[2.764459724950883986e-05],{"host":{"keys":["cpu"],"kind":"llvm","tag":""},"keys":["metal","gpu"],"kind":"metal","max_function_args":31,"max_num_threads":256,"max_shared_memory_per_block":32768,"max_threads_per_block":256,"tag":"","thread_warp_size":32},[["TENSOR","float16",[1,1,2560]],["TENSOR","float16",[1,1,32,80]]]]]
[25,[[[["GetBlock",[],["T_reshape","main"],["b0"]],["GetBlock",[],["T_squeeze","main"],["b1"]],["ReverseComputeInline",["b1"],[],[]],["GetLoops",["b0"],[],["l2","l3","l4","l5"]],["Fuse",["l2","l3","l4","l5"],[1],["l6"]],["SampleCategorical",[],[[32,64,128,256],[0.25,0.25,0.25,0.25]],["v7"]],["Split",["l6","None","v7"],[1],["l8","l9"]],["Bind",["l8"],["blockIdx.x"],[]],["Bind",["l9"],["threadIdx.x"],[]],["EnterPostproc",[],[],[]]],[[5,0]]],[2.7547048997772831619e-05],{"host":{"keys":["cpu"],"kind":"llvm","tag":""},"keys":["metal","gpu"],"kind":"metal","max_function_args":31,"max_num_threads":256,"max_shared_memory_per_block":32768,"max_threads_per_block":256,"tag":"","thread_warp_size":32},[["TENSOR","float16",[1,1,2560]],["TENSOR","float16",[1,32,80]]]]]
[26,[[[["GetBlock",[],["matmul","main"],["b0"]],["GetBlock",[],["decode","main"],["b1"]],["GetBlock",[],["T_add","main"],["b2"]],["GetBlock",[],["T_multiply","main"],["b3"]],["GetBlock",[],["compute","main"],["b4"]],["GetBlock",[],["T_multiply_1","main"],["b5"]],["GetBlock",[],["T_add_1","main"],["b6"]],["GetBlock",[],["T_multiply_2","main"],["b7"]],["GetBlock",[],["compute_1","main"],["b8"]],["CacheWrite",["b0",[]],[0,"local"],["b9"]],["GetLoops",["b0"],[],["l10","l11","l12","l13"]],["SamplePerfectTile",["l12"],[3,-1],["v14","v15","v16"]],["Split",["l12","v14","v15","v16"],[1],["l17","l18","l19"]],["Fuse",["l10","l11","l17"],[1],["l20"]],["Split",["l13","None",8],[1],["l21","l22"]],["SamplePerfectTile",["l21"],[2,-1],["v23","v24"]],["Split",["l21","v23","v24"],[1],["l25","l26"]],["Fuse",["l26","l22"],[1],["l27"]],["Unroll",["l27"],[],[]],["Bind",["l20"],["blockIdx.x"],[]],["Bind",["l18"],["vthread.x"],[]],["Bind",["l19"],["threadIdx.x"],[]],["Reorder",["l20","l18","l19","l25","l27"],[],[]],["ComputeAt",["b1","l25"],[1,-1],[]],["SetScope",["b1"],[0,"local"],[]],["GetLoops",["b1"],[],["l28","l29","l30","l31","l32","l33"]],["Split",["l32","None",8],[1],["l34","l35"]],["Unroll",["l35"],[],[]],["CacheRead",["b0",[]],[0,"shared"],["b36"]],["ComputeAt",["b36","l19"],[1,-1],[]],["GetLoops",["b36"],[],["l37","l38","l39","l40","l41","l42"]],["Fuse",["l41","l42"],[1],["l43"]],["SampleCategorical",[],[[1,2,3,4],[0.25,0.25,0.25,0.25]],["v44"]],["Split",["l43","None","v16","v44"],[1],["l45","l46","l47"]],["Bind",["l46"],["threadIdx.x"],[]],["Vectorize",["l47"],[],[]],["StorageAlign",["b36"],[0,-2,32,8],[]],["ComputeInline",["b2"],[],[]],["ComputeInline",["b3"],[],[]],["ComputeInline",["b4"],[],[]],["ComputeInline",["b5"],[],[]],["ComputeInline",["b6"],[],[]],["ComputeInline",["b7"],[],[]],["ReverseComputeInline",["b8"],[],[]],["ReverseComputeAt",["b9","l19"],[1,-1],[]],["DecomposeReduction",["b0","l25"],[],["b48"]],["EnterPostproc",[],[],[]]],[[11,[40,1,256]],[15,[160,2]],[32,1]]],[0.0001936372300995024972],{"host":{"keys":["cpu"],"kind":"llvm","tag":""},"keys":["metal","gpu"],"kind":"metal","max_function_args":31,"max_num_threads":256,"max_shared_memory_per_block":32768,"max_threads_per_block":256,"tag":"","thread_warp_size":32},[["TENSOR","uint32",[320,10240]],["TENSOR","float16",[80,10240]],["TENSOR","float16",[1,1,2560]],["TENSOR","float32",[10240]],["TENSOR","float16",[1,1,10240]]]]]
[27,[[[["GetBlock",[],["take_decode","main"],["b0"]],["GetLoops",["b0"],[],["l1","l2"]],["Fuse",["l1","l2"],[1],["l3"]],["SampleCategorical",[],[[32,64,128,256],[0.25,0.25,0.25,0.25]],["v4"]],["Split",["l3","None","v4"],[1],["l5","l6"]],["Bind",["l5"],["blockIdx.x"],[]],["Bind",["l6"],["threadIdx.x"],[]],["EnterPostproc",[],[],[]]],[[3,0]]],[2.7583473389355740474e-05],{"host":{"keys":["cpu"],"kind":"llvm","tag":""},"keys":["metal","gpu"],"kind":"metal","max_function_args":31,"max_num_threads":256,"max_shared_memory_per_block":32768,"max_threads_per_block":256,"tag":"","thread_warp_size":32},[["TENSOR","uint32",[50432,320]],["TENSOR","float16",[50432,80]],["TENSOR","int32",[1]],["TENSOR","float16",[1,2560]]]]]
