log_db/rwkv-raven-7b/database_tuning_record.json
[0,[[[["GetBlock",[],["compute","main"],["b0"]],["GetBlock",[],["T_add","main"],["b1"]],["GetBlock",[],["T_multiply","main"],["b2"]],["GetBlock",[],["T_multiply_1","main"],["b3"]],["GetBlock",[],["T_add_1","main"],["b4"]],["GetBlock",[],["T_add_2","main"],["b5"]],["GetBlock",[],["matmul","main"],["b6"]],["GetBlock",[],["root","main"],["b7"]],["Annotate",["b6","\"SSSRRSRS\""],["meta_schedule.tiling_structure"],[]],["GetLoops",["b6"],[],["l8","l9","l10"]],["SamplePerfectTile",["l8"],[5,64],["v11","v12","v13","v14","v15"]],["Split",["l8","v11","v12","v13","v14","v15"],[1],["l16","l17","l18","l19","l20"]],["SamplePerfectTile",["l9"],[5,64],["v21","v22","v23","v24","v25"]],["Split",["l9","v21","v22","v23","v24","v25"],[1],["l26","l27","l28","l29","l30"]],["SamplePerfectTile",["l10"],[3,64],["v31","v32","v33"]],["Split",["l10","v31","v32","v33"],[1],["l34","l35","l36"]],["Reorder",["l16","l26","l17","l27","l18","l28","l34","l35","l19","l29","l36","l20","l30"],[],[]],["Fuse",["l16","l26"],[1],["l37"]],["Bind",["l37"],["blockIdx.x"],[]],["Fuse",["l17","l27"],[1],["l38"]],["Bind",["l38"],["vthread.x"],[]],["Fuse",["l18","l28"],[1],["l39"]],["Bind",["l39"],["threadIdx.x"],[]],["Annotate",["b6",32],["meta_schedule.thread_extent_low_inclusive"],[]],["Annotate",["b6",256],["meta_schedule.thread_extent_high_inclusive"],[]],["CacheWrite",["b6",[]],[0,"local"],["b40"]],["ReverseComputeAt",["b40","l39"],[1,-1],[]],["CacheRead",["b6",["b6"]],[0,"shared"],["b41"]],["ComputeAt",["b41","l34"],[1,-1],[]],["GetLoops",["b41"],[],["l42","l43","l44","l45","l46","l47"]],["Fuse",["l46","l47"],[1],["l48"]],["SampleCategorical",[],[[1,2,4,8],[0.25,0.25,0.25,0.25]],["v49"]],["Annotate",["b41","v49"],["meta_schedule.cooperative_fetch"],[]],["CacheRead",["b6",["b6"]],[1,"shared"],["b50"]],["ComputeAt",["b50","l34"],[1,-1],[]],["GetLoops",["b50"],[],["l51","l52","l53","l54","l55","l56"]],["Fuse",["l55","l56"],[1],["l57"]],["SampleCategorical",[],[[1,2,4,8],[0.25,0.25,0.25,0.25]],["v58"]],["Annotate",["b50","v58"],["meta_schedule.cooperative_fetch"],[]],["ComputeInline",["b5"],[],[]],["ComputeInline",["b4"],[],[]],["ComputeInline",["b3"],[],[]],["ComputeInline",["b2"],[],[]],["ComputeInline",["b1"],[],[]],["ComputeInline",["b0"],[],[]],["SampleCategorical",[],[[0,16,64,512,1024],[0.2000000000000000111,0.2000000000000000111,0.2000000000000000111,0.2000000000000000111,0.2000000000000000111]],["v59"]],["Annotate",["b7","v59"],["meta_schedule.unroll_explicit"],[]],["EnterPostproc",[],[],[]],["Unannotate",["b41"],["meta_schedule.cooperative_fetch"],[]],["GetLoops",["b41"],[],["l60","l61","l62","l63","l64"]],["Split",["l64","None",64],[1],["l65","l66"]],["Bind",["l66"],["threadIdx.x"],[]],["Unannotate",["b50"],["meta_schedule.cooperative_fetch"],[]],["GetLoops",["b50"],[],["l67","l68","l69","l70","l71"]],["Split",["l71","None",64,4],[1],["l72","l73","l74"]],["Vectorize",["l74"],[],[]],["Bind",["l73"],["threadIdx.x"],[]],["GetBlock",[],["root","main"],["b75"]],["Unannotate",["b75"],["meta_schedule.unroll_explicit"],[]],["GetChildBlocks",["b75"],[],["b76","b77","b78","b79"]],["GetLoops",["b76"],[],["l80","l81","l82","l83","l84","l85"]],["GetLoops",["b77"],[],["l86","l87","l88","l89","l90","l91","l92"]],["GetLoops",["b78"],[],["l93","l94","l95","l96","l97","l98","l99","l100","l101","l102"]],["Annotate",["l93",1024],["pragma_auto_unroll_max_step"],[]],["Annotate",["l93",1],["pragma_unroll_explicit"],[]],["GetLoops",["b79"],[],["l103","l104","l105","l106","l107"]],["GetBlock",[],["matmul","main"],["b108"]],["GetLoops",["b108"],[],["l109","l110","l111","l112","l113","l114","l115","l116","l117","l118"]],["DecomposeReduction",["b108","l112"],[],["b119"]]],[[10,[1,1,1,1,1]],[12,[64,1,64,1,1]],[14,[512,8,4]],[31,0],[37,2],[45,4]]],[0.00081771050980392143842],{"host":{"keys":["cpu"],"kind":"llvm","tag":""},"keys":["metal","gpu"],"kind":"metal","max_function_args":31,"max_num_threads":256,"max_shared_memory_per_block":32768,"max_threads_per_block":256,"tag":"","thread_warp_size":32},[["TENSOR","uint8",[16384,4096]],["TENSOR","float16",[1,4096]],["TENSOR","float16",[1,4096]],["TENSOR","float16",[16384,1]],["TENSOR","float16",[16384,1]],["TENSOR","float16",[1,16384]],["TENSOR","float16",[1,4096]]]]]
[1,[[[["GetBlock",[],["compute","main"],["b0"]],["GetBlock",[],["T_add","main"],["b1"]],["GetBlock",[],["T_multiply","main"],["b2"]],["GetBlock",[],["T_multiply_1","main"],["b3"]],["GetBlock",[],["T_add_1","main"],["b4"]],["GetBlock",[],["T_add_2","main"],["b5"]],["GetBlock",[],["matmul","main"],["b6"]],["GetBlock",[],["compute_1","main"],["b7"]],["GetBlock",[],["T_add_3","main"],["b8"]],["GetBlock",[],["T_maximum","main"],["b9"]],["GetBlock",[],["T_subtract","main"],["b10"]],["GetBlock",[],["compute_1_1","main"],["b11"]],["GetBlock",[],["T_subtract_1","main"],["b12"]],["GetBlock",[],["compute_2","main"],["b13"]],["GetBlock",[],["T_multiply_2","main"],["b14"]],["GetBlock",[],["T_multiply_1_1","main"],["b15"]],["GetBlock",[],["T_add_1_1","main"],["b16"]],["GetBlock",[],["T_multiply_2_1","main"],["b17"]],["GetBlock",[],["T_add_2_1","main"],["b18"]],["GetBlock",[],["T_divide","main"],["b19"]],["GetBlock",[],["compute_3","main"],["b20"]],["GetBlock",[],["T_multiply_3","main"],["b21"]],["GetBlock",[],["root","main"],["b22"]],["Annotate",["b6","\"SSSRRSRS\""],["meta_schedule.tiling_structure"],[]],["GetLoops",["b6"],[],["l23","l24","l25"]],["SamplePerfectTile",["l23"],[5,64],["v26","v27","v28","v29","v30"]],["Split",["l23","v26","v27","v28","v29","v30"],[1],["l31","l32","l33","l34","l35"]],["SamplePerfectTile",["l24"],[5,64],["v36","v37","v38","v39","v40"]],["Split",["l24","v36","v37","v38","v39","v40"],[1],["l41","l42","l43","l44","l45"]],["SamplePerfectTile",["l25"],[3,64],["v46","v47","v48"]],["Split",["l25","v46","v47","v48"],[1],["l49","l50","l51"]],["Reorder",["l31","l41","l32","l42","l33","l43","l49","l50","l34","l44","l51","l35","l45"],[],[]],["Fuse",["l31","l41"],[1],["l52"]],["Bind",["l52"],["blockIdx.x"],[]],["Fuse",["l32","l42"],[1],["l53"]],["Bind",["l53"],["vthread.x"],[]],["Fuse",["l33","l43"],[1],["l54"]],["Bind",["l54"],["threadIdx.x"],[]],["Annotate",["b6",32],["meta_schedule.thread_extent_low_inclusive"],[]],["Annotate",["b6",256],["meta_schedule.thread_extent_high_inclusive"],[]],["CacheWrite",["b6",[]],[0,"local"],["b55"]],["ReverseComputeAt",["b55","l54"],[1,-1],[]],["CacheRead",["b6",["b6"]],[0,"shared"],["b56"]],["ComputeAt",["b56","l49"],[1,-1],[]],["GetLoops",["b56"],[],["l57","l58","l59","l60","l61","l62"]],["Fuse",["l61","l62"],[1],["l63"]],["SampleCategorical",[],[[1,2,4,8],[0.25,0.25,0.25,0.25]],["v64"]],["Annotate",["b56","v64"],["meta_schedule.cooperative_fetch"],[]],["CacheRead",["b6",["b6"]],[1,"shared"],["b65"]],["ComputeAt",["b65","l49"],[1,-1],[]],["GetLoops",["b65"],[],["l66","l67","l68","l69","l70","l71"]],["Fuse",["l70","l71"],[1],["l72"]],["SampleCategorical",[],[[1,2,4,8],[0.25,0.25,0.25,0.25]],["v73"]],["Annotate",["b65","v73"],["meta_schedule.cooperative_fetch"],[]],["ComputeInline",["b20"],[],[]],["ComputeInline",["b19"],[],[]],["ComputeInline",["b18"],[],[]],["ComputeInline",["b17"],[],[]],["ComputeInline",["b16"],[],[]],["ComputeInline",["b15"],[],[]],["ComputeInline",["b14"],[],[]],["ComputeInline",["b13"],[],[]],["ComputeInline",["b12"],[],[]],["ComputeInline",["b11"],[],[]],["ComputeInline",["b10"],[],[]],["ComputeInline",["b9"],[],[]],["ComputeInline",["b8"],[],[]],["ComputeInline",["b7"],[],[]],["ComputeInline",["b5"],[],[]],["ComputeInline",["b4"],[],[]],["ComputeInline",["b3"],[],[]],["ComputeInline",["b2"],[],[]],["ComputeInline",["b1"],[],[]],["ComputeInline",["b0"],[],[]],["SampleCategorical",[],[[0,16,64,512,1024],[0.2000000000000000111,0.2000000000000000111,0.2000000000000000111,0.2000000000000000111,0.2000000000000000111]],["v74"]],["Annotate",["b22","v74"],["meta_schedule.unroll_explicit"],[]],["GetLoops",["b21"],[],["l75","l76"]],["Fuse",["l75","l76"],[1],["l77"]],["SampleCategorical",[],[[32,64,128,256],[0.25,0.25,0.25,0.25]],["v78"]],["Split",["l77","None","v78"],[1],["l79","l80"]],["Bind",["l79"],["blockIdx.x"],[]],["Bind",["l80"],["threadIdx.x"],[]],["EnterPostproc",[],[],[]],["Unannotate",["b56"],["meta_schedule.cooperative_fetch"],[]],["GetLoops",["b56"],[],["l81","l82","l83","l84","l85"]],["Split",["l85","None",64,2],[1],["l86","l87","l88"]],["Vectorize",["l88"],[],[]],["Bind",["l87"],["threadIdx.x"],[]],["Unannotate",["b65"],["meta_schedule.cooperative_fetch"],[]],["GetLoops",["b65"],[],["l89","l90","l91","l92","l93"]],["Split",["l93","None",64,4],[1],["l94","l95","l96"]],["Vectorize",["l96"],[],[]],["Bind",["l95"],["threadIdx.x"],[]],["GetBlock",[],["root","main"],["b97"]],["Unannotate",["b97"],["meta_schedule.unroll_explicit"],[]],["GetChildBlocks",["b97"],[],["b98","b99","b100","b101","b102"]],["GetLoops",["b98"],[],["l103","l104","l105","l106","l107","l108","l109"]],["GetLoops",["b99"],[],["l110","l111","l112","l113","l114","l115","l116"]],["GetLoops",["b100"],[],["l117","l118","l119","l120","l121","l122","l123","l124","l125","l126"]],["Annotate",["l117",512],["pragma_auto_unroll_max_step"],[]],["Annotate",["l117",1],["pragma_unroll_explicit"],[]],["GetLoops",["b101"],[],["l127","l128","l129","l130","l131"]],["GetLoops",["b102"],[],["l132","l133"]],["GetBlock",[],["matmul","main"],["b134"]],["GetLoops",["b134"],[],["l135","l136","l137","l138","l139","l140","l141","l142","l143","l144"]],["DecomposeReduction",["b134","l138"],[],["b145"]]],[[25,[1,1,1,1,1]],[27,[64,1,64,1,1]],[29,[128,16,2]],[46,1],[52,2],[74,3],[78,0]]],[0.00020230852692867541784],{"host":{"keys":["cpu"],"kind":"llvm","tag":""},"keys":["metal","gpu"],"kind":"metal","max_function_args":31,"max_num_threads":256,"max_shared_memory_per_block":32768,"max_threads_per_block":256,"tag":"","thread_warp_size":32},[["TENSOR","uint8",[4096,4096]],["TENSOR","float16",[1,4096]],["TENSOR","float16",[1,4096]],["TENSOR","float16",[4096,1]],["TENSOR","float16",[4096,1]],["TENSOR","float16",[1,4096]],["TENSOR","float32",[1,4096]],["TENSOR","float32",[4096]],["TENSOR","float32",[1,4096]],["TENSOR","float32",[1,4096]],["TENSOR","float32",[1,4096]],["TENSOR","float32",[1,4096]],["TENSOR","float16",[1,4096]]]]]
[2,[[[["GetBlock",[],["compute","main"],["b0"]],["GetBlock",[],["T_add","main"],["b1"]],["GetBlock",[],["T_multiply","main"],["b2"]],["GetBlock",[],["T_multiply_1","main"],["b3"]],["GetBlock",[],["T_add_1","main"],["b4"]],["GetBlock",[],["T_add_2","main"],["b5"]],["GetBlock",[],["matmul","main"],["b6"]],["GetBlock",[],["T_add_3","main"],["b7"]],["GetBlock",[],["root","main"],["b8"]],["Annotate",["b6","\"SSSRRSRS\""],["meta_schedule.tiling_structure"],[]],["GetLoops",["b6"],[],["l9","l10","l11"]],["SamplePerfectTile",["l9"],[5,64],["v12","v13","v14","v15","v16"]],["Split",["l9","v12","v13","v14","v15","v16"],[1],["l17","l18","l19","l20","l21"]],["SamplePerfectTile",["l10"],[5,64],["v22","v23","v24","v25","v26"]],["Split",["l10","v22","v23","v24","v25","v26"],[1],["l27","l28","l29","l30","l31"]],["SamplePerfectTile",["l11"],[3,64],["v32","v33","v34"]],["Split",["l11","v32","v33","v34"],[1],["l35","l36","l37"]],["Reorder",["l17","l27","l18","l28","l19","l29","l35","l36","l20","l30","l37","l21","l31"],[],[]],["Fuse",["l17","l27"],[1],["l38"]],["Bind",["l38"],["blockIdx.x"],[]],["Fuse",["l18","l28"],[1],["l39"]],["Bind",["l39"],["vthread.x"],[]],["Fuse",["l19","l29"],[1],["l40"]],["Bind",["l40"],["threadIdx.x"],[]],["Annotate",["b6",32],["meta_schedule.thread_extent_low_inclusive"],[]],["Annotate",["b6",256],["meta_schedule.thread_extent_high_inclusive"],[]],["CacheWrite",["b6",[]],[0,"local"],["b41"]],["ReverseComputeAt",["b41","l40"],[1,-1],[]],["CacheRead",["b6",["b6"]],[0,"shared"],["b42"]],["ComputeAt",["b42","l35"],[1,-1],[]],["GetLoops",["b42"],[],["l43","l44","l45","l46","l47","l48"]],["Fuse",["l47","l48"],[1],["l49"]],["SampleCategorical",[],[[1,2,4,8],[0.25,0.25,0.25,0.25]],["v50"]],["Annotate",["b42","v50"],["meta_schedule.cooperative_fetch"],[]],["CacheRead",["b6",["b6"]],[1,"shared"],["b51"]],["ComputeAt",["b51","l35"],[1,-1],[]],["GetLoops",["b51"],[],["l52","l53","l54","l55","l56","l57"]],["Fuse",["l56","l57"],[1],["l58"]],["SampleCategorical",[],[[1,2,4,8],[0.25,0.25,0.25,0.25]],["v59"]],["Annotate",["b51","v59"],["meta_schedule.cooperative_fetch"],[]],["ReverseComputeInline",["b7"],[],[]],["ComputeInline",["b5"],[],[]],["ComputeInline",["b4"],[],[]],["ComputeInline",["b3"],[],[]],["ComputeInline",["b2"],[],[]],["ComputeInline",["b1"],[],[]],["ComputeInline",["b0"],[],[]],["SampleCategorical",[],[[0,16,64,512,1024],[0.2000000000000000111,0.2000000000000000111,0.2000000000000000111,0.2000000000000000111,0.2000000000000000111]],["v60"]],["Annotate",["b8","v60"],["meta_schedule.unroll_explicit"],[]],["EnterPostproc",[],[],[]],["Unannotate",["b42"],["meta_schedule.cooperative_fetch"],[]],["GetLoops",["b42"],[],["l61","l62","l63","l64","l65"]],["Split",["l65","None",64,2],[1],["l66","l67","l68"]],["Vectorize",["l68"],[],[]],["Bind",["l67"],["threadIdx.x"],[]],["Unannotate",["b51"],["meta_schedule.cooperative_fetch"],[]],["GetLoops",["b51"],[],["l69","l70","l71","l72","l73"]],["Split",["l73","None",64,4],[1],["l74","l75","l76"]],["Vectorize",["l76"],[],[]],["Bind",["l75"],["threadIdx.x"],[]],["GetBlock",[],["root","main"],["b77"]],["Unannotate",["b77"],["meta_schedule.unroll_explicit"],[]],["GetChildBlocks",["b77"],[],["b78","b79","b80","b81"]],["GetLoops",["b78"],[],["l82","l83","l84","l85","l86","l87","l88"]],["GetLoops",["b79"],[],["l89","l90","l91","l92","l93","l94","l95"]],["GetLoops",["b80"],[],["l96","l97","l98","l99","l100","l101","l102","l103","l104","l105"]],["Annotate",["l96",64],["pragma_auto_unroll_max_step"],[]],["Annotate",["l96",1],["pragma_unroll_explicit"],[]],["GetLoops",["b81"],[],["l106","l107","l108","l109","l110"]],["GetBlock",[],["matmul","main"],["b111"]],["GetLoops",["b111"],[],["l112","l113","l114","l115","l116","l117","l118","l119","l120","l121"]],["DecomposeReduction",["b111","l115"],[],["b122"]]],[[11,[1,1,1,1,1]],[13,[64,1,64,1,1]],[15,[128,1,32]],[32,1],[38,2],[47,2]]],[0.00018944001849217640679],{"host":{"keys":["cpu"],"kind":"llvm","tag":""},"keys":["metal","gpu"],"kind":"metal","max_function_args":31,"max_num_threads":256,"max_shared_memory_per_block":32768,"max_threads_per_block":256,"tag":"","thread_warp_size":32},[["TENSOR","uint8",[4096,4096]],["TENSOR","float16",[1,4096]],["TENSOR","float16",[1,4096]],["TENSOR","float16",[4096,1]],["TENSOR","float16",[4096,1]],["TENSOR","float16",[1,4096]],["TENSOR","float16",[1,4096]],["TENSOR","float16",[1,4096]]]]]
[3,[[[["GetBlock",[],["compute","main"],["b0"]],["GetBlock",[],["T_add","main"],["b1"]],["GetBlock",[],["T_multiply","main"],["b2"]],["GetBlock",[],["T_multiply_1","main"],["b3"]],["GetBlock",[],["T_add_1","main"],["b4"]],["GetBlock",[],["T_add_2","main"],["b5"]],["GetBlock",[],["matmul","main"],["b6"]],["GetBlock",[],["root","main"],["b7"]],["PadEinsum",["b6"],[[1,64,64]],[]],["GetProducers",["b6"],[],["b8"]],["GetConsumers",["b6"],[],["b9"]],["Annotate",["b6","\"SSSRRSRS\""],["meta_schedule.tiling_structure"],[]],["GetLoops",["b6"],[],["l10","l11","l12"]],["Split",["l10",1,1,1,1,1],[1],["l13","l14","l15","l16","l17"]],["Split",["l11","None",1,64,1,2],[1],["l18","l19","l20","l21","l22"]],["Split",["l12","None",4,4],[1],["l23","l24","l25"]],["Reorder",["l13","l18","l14","l19","l15","l20","l23","l24","l16","l21","l25","l17","l22"],[],[]],["Fuse",["l13","l18"],[1],["l26"]],["Bind",["l26"],["blockIdx.x"],[]],["Fuse",["l14","l19"],[1],["l27"]],["Bind",["l27"],["vthread.x"],[]],["Fuse",["l15","l20"],[1],["l28"]],["Bind",["l28"],["threadIdx.x"],[]],["Annotate",["b6",32],["meta_schedule.thread_extent_low_inclusive"],[]],["Annotate",["b6",1024],["meta_schedule.thread_extent_high_inclusive"],[]],["CacheWrite",["b6",[]],[0,"local"],["b29"]],["ReverseComputeAt",["b29","l28"],[1,-1],[]],["CacheRead",["b6",["b6"]],[0,"shared"],["b30"]],["ComputeAt",["b30","l23"],[1,-1],[]],["GetLoops",["b30"],[],["l31","l32","l33","l34","l35","l36"]],["Fuse",["l35","l36"],[1],["l37"]],["SampleCategorical",[],[[1,2,4,8],[0.25,0.25,0.25,0.25]],["v38"]],["Annotate",["b30","v38"],["meta_schedule.cooperative_fetch"],[]],["CacheRead",["b6",["b6"]],[1,"shared"],["b39"]],["ComputeAt",["b39","l23"],[1,-1],[]],["GetLoops",["b39"],[],["l40","l41","l42","l43","l44","l45"]],["Fuse",["l44","l45"],[1],["l46"]],["SampleCategorical",[],[[1,2,4,8],[0.25,0.25,0.25,0.25]],["v47"]],["Annotate",["b39","v47"],["meta_schedule.cooperative_fetch"],[]],["ComputeInline",["b5"],[],[]],["ComputeInline",["b4"],[],[]],["ComputeInline",["b3"],[],[]],["ComputeInline",["b2"],[],[]],["ComputeInline",["b1"],[],[]],["ComputeInline",["b0"],[],[]],["SampleCategorical",[],[[0,16,64,512,1024],[0.2000000000000000111,0.2000000000000000111,0.2000000000000000111,0.2000000000000000111,0.2000000000000000111]],["v48"]],["Annotate",["b7","v48"],["meta_schedule.unroll_explicit"],[]],["Unannotate",["b30"],["meta_schedule.cooperative_fetch"],[]],["GetLoops",["b30"],[],["l49","l50","l51","l52","l53"]],["Split",["l53","None",64],[1],["l54","l55"]],["Bind",["l55"],["threadIdx.x"],[]],["Unannotate",["b39"],["meta_schedule.cooperative_fetch"],[]],["GetLoops",["b39"],[],["l56","l57","l58","l59","l60"]],["Split",["l60","None",64,8],[1],["l61","l62","l63"]],["Vectorize",["l63"],[],[]],["Bind",["l62"],["threadIdx.x"],[]],["GetBlock",[],["root","main"],["b64"]],["Unannotate",["b64"],["meta_schedule.unroll_explicit"],[]],["GetChildBlocks",["b64"],[],["b65","b66","b67","b68","b69","b70"]],["GetLoops",["b68"],[],["l71","l72","l73","l74","l75","l76","l77","l78","l79","l80"]],["Annotate",["l71",64],["pragma_auto_unroll_max_step"],[]],["Annotate",["l71",1],["pragma_unroll_explicit"],[]],["GetBlock",[],["matmul","main"],["b81"]],["GetLoops",["b81"],[],["l82","l83","l84","l85","l86","l87","l88","l89","l90","l91"]],["DecomposeReduction",["b81","l85"],[],["b92"]],["ComputeInline",["b8"],[],[]],["ReverseComputeInline",["b9"],[],[]],["EnterPostproc",[],[],[]]],[[31,3],[37,2],[45,1]]],[0.0068273389333333329987],{"host":{"keys":["cpu"],"kind":"llvm","tag":""},"keys":["metal","gpu"],"kind":"metal","max_function_args":31,"max_num_threads":256,"max_shared_memory_per_block":32768,"max_threads_per_block":256,"tag":"","thread_warp_size":32},[["TENSOR","uint8",[4096,50277]],["TENSOR","float16",[1,50277]],["TENSOR","float16",[1,50277]],["TENSOR","float16",[4096,1]],["TENSOR","float16",[4096,1]],["TENSOR","float16",[1,4096]],["TENSOR","float16",[1,50277]]]]]
[4,[[[["GetBlock",[],["compute","main"],["b0"]],["GetBlock",[],["T_add","main"],["b1"]],["GetBlock",[],["T_multiply","main"],["b2"]],["GetBlock",[],["T_multiply_1","main"],["b3"]],["GetBlock",[],["T_add_1","main"],["b4"]],["GetBlock",[],["T_add_2","main"],["b5"]],["GetBlock",[],["matmul","main"],["b6"]],["GetBlock",[],["compute_1","main"],["b7"]],["GetBlock",[],["T_multiply_2","main"],["b8"]],["GetBlock",[],["T_add_3","main"],["b9"]],["GetBlock",[],["root","main"],["b10"]],["Annotate",["b6","\"SSSRRSRS\""],["meta_schedule.tiling_structure"],[]],["GetLoops",["b6"],[],["l11","l12","l13"]],["SamplePerfectTile",["l11"],[5,64],["v14","v15","v16","v17","v18"]],["Split",["l11","v14","v15","v16","v17","v18"],[1],["l19","l20","l21","l22","l23"]],["SamplePerfectTile",["l12"],[5,64],["v24","v25","v26","v27","v28"]],["Split",["l12","v24","v25","v26","v27","v28"],[1],["l29","l30","l31","l32","l33"]],["SamplePerfectTile",["l13"],[3,64],["v34","v35","v36"]],["Split",["l13","v34","v35","v36"],[1],["l37","l38","l39"]],["Reorder",["l19","l29","l20","l30","l21","l31","l37","l38","l22","l32","l39","l23","l33"],[],[]],["Fuse",["l19","l29"],[1],["l40"]],["Bind",["l40"],["blockIdx.x"],[]],["Fuse",["l20","l30"],[1],["l41"]],["Bind",["l41"],["vthread.x"],[]],["Fuse",["l21","l31"],[1],["l42"]],["Bind",["l42"],["threadIdx.x"],[]],["Annotate",["b6",32],["meta_schedule.thread_extent_low_inclusive"],[]],["Annotate",["b6",256],["meta_schedule.thread_extent_high_inclusive"],[]],["CacheWrite",["b6",[]],[0,"local"],["b43"]],["ReverseComputeAt",["b43","l42"],[1,-1],[]],["CacheRead",["b6",["b6"]],[0,"shared"],["b44"]],["ComputeAt",["b44","l37"],[1,-1],[]],["GetLoops",["b44"],[],["l45","l46","l47","l48","l49","l50"]],["Fuse",["l49","l50"],[1],["l51"]],["SampleCategorical",[],[[1,2,4,8],[0.25,0.25,0.25,0.25]],["v52"]],["Annotate",["b44","v52"],["meta_schedule.cooperative_fetch"],[]],["CacheRead",["b6",["b6"]],[1,"shared"],["b53"]],["ComputeAt",["b53","l37"],[1,-1],[]],["GetLoops",["b53"],[],["l54","l55","l56","l57","l58","l59"]],["Fuse",["l58","l59"],[1],["l60"]],["SampleCategorical",[],[[1,2,4,8],[0.25,0.25,0.25,0.25]],["v61"]],["Annotate",["b53","v61"],["meta_schedule.cooperative_fetch"],[]],["ReverseComputeInline",["b9"],[],[]],["ReverseComputeInline",["b8"],[],[]],["ReverseComputeInline",["b7"],[],[]],["ComputeInline",["b5"],[],[]],["ComputeInline",["b4"],[],[]],["ComputeInline",["b3"],[],[]],["ComputeInline",["b2"],[],[]],["ComputeInline",["b1"],[],[]],["ComputeInline",["b0"],[],[]],["SampleCategorical",[],[[0,16,64,512,1024],[0.2000000000000000111,0.2000000000000000111,0.2000000000000000111,0.2000000000000000111,0.2000000000000000111]],["v62"]],["Annotate",["b10","v62"],["meta_schedule.unroll_explicit"],[]],["EnterPostproc",[],[],[]],["Unannotate",["b44"],["meta_schedule.cooperative_fetch"],[]],["GetLoops",["b44"],[],["l63","l64","l65","l66","l67"]],["Split",["l67","None",64,4],[1],["l68","l69","l70"]],["Vectorize",["l70"],[],[]],["Bind",["l69"],["threadIdx.x"],[]],["Unannotate",["b53"],["meta_schedule.cooperative_fetch"],[]],["GetLoops",["b53"],[],["l71","l72","l73","l74","l75"]],["Split",["l75","None",64,4],[1],["l76","l77","l78"]],["Vectorize",["l78"],[],[]],["Bind",["l77"],["threadIdx.x"],[]],["GetBlock",[],["root","main"],["b79"]],["Unannotate",["b79"],["meta_schedule.unroll_explicit"],[]],["GetChildBlocks",["b79"],[],["b80","b81","b82","b83"]],["GetLoops",["b80"],[],["l84","l85","l86","l87","l88","l89","l90"]],["GetLoops",["b81"],[],["l91","l92","l93","l94","l95","l96","l97"]],["GetLoops",["b82"],[],["l98","l99","l100","l101","l102","l103","l104","l105","l106","l107"]],["Annotate",["l98",64],["pragma_auto_unroll_max_step"],[]],["Annotate",["l98",1],["pragma_unroll_explicit"],[]],["GetLoops",["b83"],[],["l108","l109","l110","l111","l112"]],["GetBlock",[],["matmul","main"],["b113"]],["GetLoops",["b113"],[],["l114","l115","l116","l117","l118","l119","l120","l121","l122","l123"]],["DecomposeReduction",["b113","l117"],[],["b124"]]],[[13,[1,1,1,1,1]],[15,[64,1,64,1,1]],[17,[128,1,32]],[34,2],[40,2],[51,2]]],[0.00019069126035502960317],{"host":{"keys":["cpu"],"kind":"llvm","tag":""},"keys":["metal","gpu"],"kind":"metal","max_function_args":31,"max_num_threads":256,"max_shared_memory_per_block":32768,"max_threads_per_block":256,"tag":"","thread_warp_size":32},[["TENSOR","uint8",[4096,4096]],["TENSOR","float16",[1,4096]],["TENSOR","float16",[1,4096]],["TENSOR","float16",[4096,1]],["TENSOR","float16",[4096,1]],["TENSOR","float16",[1,4096]],["TENSOR","float16",[1,4096]],["TENSOR","float16",[1,4096]],["TENSOR","float16",[1,4096]]]]]
[5,[[[["GetBlock",[],["compute","main"],["b0"]],["GetBlock",[],["T_add","main"],["b1"]],["GetBlock",[],["T_multiply","main"],["b2"]],["GetBlock",[],["T_multiply_1","main"],["b3"]],["GetBlock",[],["T_add_1","main"],["b4"]],["GetBlock",[],["T_add_2","main"],["b5"]],["GetBlock",[],["matmul","main"],["b6"]],["GetBlock",[],["compute_1","main"],["b7"]],["GetBlock",[],["T_multiply_2","main"],["b8"]],["GetBlock",[],["T_add_3","main"],["b9"]],["GetBlock",[],["T_divide","main"],["b10"]],["GetBlock",[],["root","main"],["b11"]],["Annotate",["b6","\"SSSRRSRS\""],["meta_schedule.tiling_structure"],[]],["GetLoops",["b6"],[],["l12","l13","l14"]],["SamplePerfectTile",["l12"],[5,64],["v15","v16","v17","v18","v19"]],["Split",["l12","v15","v16","v17","v18","v19"],[1],["l20","l21","l22","l23","l24"]],["SamplePerfectTile",["l13"],[5,64],["v25","v26","v27","v28","v29"]],["Split",["l13","v25","v26","v27","v28","v29"],[1],["l30","l31","l32","l33","l34"]],["SamplePerfectTile",["l14"],[3,64],["v35","v36","v37"]],["Split",["l14","v35","v36","v37"],[1],["l38","l39","l40"]],["Reorder",["l20","l30","l21","l31","l22","l32","l38","l39","l23","l33","l40","l24","l34"],[],[]],["Fuse",["l20","l30"],[1],["l41"]],["Bind",["l41"],["blockIdx.x"],[]],["Fuse",["l21","l31"],[1],["l42"]],["Bind",["l42"],["vthread.x"],[]],["Fuse",["l22","l32"],[1],["l43"]],["Bind",["l43"],["threadIdx.x"],[]],["Annotate",["b6",32],["meta_schedule.thread_extent_low_inclusive"],[]],["Annotate",["b6",256],["meta_schedule.thread_extent_high_inclusive"],[]],["CacheWrite",["b6",[]],[0,"local"],["b44"]],["ReverseComputeAt",["b44","l43"],[1,-1],[]],["CacheRead",["b6",["b6"]],[0,"shared"],["b45"]],["ComputeAt",["b45","l38"],[1,-1],[]],["GetLoops",["b45"],[],["l46","l47","l48","l49","l50","l51"]],["Fuse",["l50","l51"],[1],["l52"]],["SampleCategorical",[],[[1,2,4,8],[0.25,0.25,0.25,0.25]],["v53"]],["Annotate",["b45","v53"],["meta_schedule.cooperative_fetch"],[]],["CacheRead",["b6",["b6"]],[1,"shared"],["b54"]],["ComputeAt",["b54","l38"],[1,-1],[]],["GetLoops",["b54"],[],["l55","l56","l57","l58","l59","l60"]],["Fuse",["l59","l60"],[1],["l61"]],["SampleCategorical",[],[[1,2,4,8],[0.25,0.25,0.25,0.25]],["v62"]],["Annotate",["b54","v62"],["meta_schedule.cooperative_fetch"],[]],["ReverseComputeInline",["b10"],[],[]],["ReverseComputeInline",["b9"],[],[]],["ReverseComputeInline",["b8"],[],[]],["ReverseComputeInline",["b7"],[],[]],["ComputeInline",["b5"],[],[]],["ComputeInline",["b4"],[],[]],["ComputeInline",["b3"],[],[]],["ComputeInline",["b2"],[],[]],["ComputeInline",["b1"],[],[]],["ComputeInline",["b0"],[],[]],["SampleCategorical",[],[[0,16,64,512,1024],[0.2000000000000000111,0.2000000000000000111,0.2000000000000000111,0.2000000000000000111,0.2000000000000000111]],["v63"]],["Annotate",["b11","v63"],["meta_schedule.unroll_explicit"],[]],["EnterPostproc",[],[],[]],["Unannotate",["b45"],["meta_schedule.cooperative_fetch"],[]],["GetLoops",["b45"],[],["l64","l65","l66","l67","l68"]],["Split",["l68","None",64,2],[1],["l69","l70","l71"]],["Vectorize",["l71"],[],[]],["Bind",["l70"],["threadIdx.x"],[]],["Unannotate",["b54"],["meta_schedule.cooperative_fetch"],[]],["GetLoops",["b54"],[],["l72","l73","l74","l75","l76"]],["Split",["l76","None",64,4],[1],["l77","l78","l79"]],["Vectorize",["l79"],[],[]],["Bind",["l78"],["threadIdx.x"],[]],["GetBlock",[],["root","main"],["b80"]],["Unannotate",["b80"],["meta_schedule.unroll_explicit"],[]],["GetChildBlocks",["b80"],[],["b81","b82","b83","b84"]],["GetLoops",["b81"],[],["l85","l86","l87","l88","l89","l90","l91"]],["GetLoops",["b82"],[],["l92","l93","l94","l95","l96","l97","l98"]],["GetLoops",["b83"],[],["l99","l100","l101","l102","l103","l104","l105","l106","l107","l108"]],["Annotate",["l99",64],["pragma_auto_unroll_max_step"],[]],["Annotate",["l99",1],["pragma_unroll_explicit"],[]],["GetLoops",["b84"],[],["l109","l110","l111","l112","l113"]],["GetBlock",[],["matmul","main"],["b114"]],["GetLoops",["b114"],[],["l115","l116","l117","l118","l119","l120","l121","l122","l123","l124"]],["DecomposeReduction",["b114","l118"],[],["b125"]]],[[14,[1,1,1,1,1]],[16,[64,1,64,1,1]],[18,[128,32,1]],[35,1],[41,2],[53,2]]],[0.00018882332207792207638],{"host":{"keys":["cpu"],"kind":"llvm","tag":""},"keys":["metal","gpu"],"kind":"metal","max_function_args":31,"max_num_threads":256,"max_shared_memory_per_block":32768,"max_threads_per_block":256,"tag":"","thread_warp_size":32},[["TENSOR","uint8",[4096,4096]],["TENSOR","float16",[1,4096]],["TENSOR","float16",[1,4096]],["TENSOR","float16",[4096,1]],["TENSOR","float16",[4096,1]],["TENSOR","float16",[1,4096]],["TENSOR","float16",[1,4096]],["TENSOR","float16",[1,4096]],["TENSOR","float16",[1,4096]]]]]
[6,[[[["GetBlock",[],["T_softmax_maxelem","main"],["b0"]],["GetBlock",[],["T_softmax_exp","main"],["b1"]],["GetBlock",[],["T_softmax_expsum","main"],["b2"]],["GetBlock",[],["T_softmax_norm","main"],["b3"]],["GetBlock",[],["root","main"],["b4"]],["ComputeInline",["b1"],[],[]],["GetConsumers",["b2"],[],["b5"]],["GetLoops",["b5"],[],["l6","l7","l8"]],["SampleCategorical",[],[[4,8,16,32,64,128,256,512],[0.125,0.125,0.125,0.125,0.125,0.125,0.125,0.125]],["v9"]],["Split",["l8","None","v9"],[1],["l10","l11"]],["Bind",["l11"],["threadIdx.x"],[]],["ComputeAt",["b2","l7"],[1,-1],[]],["SetScope",["b2"],[0,"shared"],[]],["GetLoops",["b2"],[],["l12","l13","l14","l15","l16"]],["Split",["l16","None","v9"],[1],["l17","l18"]],["Bind",["l18"],["threadIdx.x"],[]],["GetConsumers",["b0"],[],["b19","b20"]],["GetLoops",["b19"],[],["l21","l22","l23","l24","l25","l26"]],["ComputeAt",["b0","l22"],[1,-1],[]],["SetScope",["b0"],[0,"shared"],[]],["GetLoops",["b0"],[],["l27","l28","l29","l30","l31"]],["Split",["l31","None","v9"],[1],["l32","l33"]],["Bind",["l33"],["threadIdx.x"],[]],["SampleCategorical",[],[[0,16,64,512,1024],[0.2000000000000000111,0.2000000000000000111,0.2000000000000000111,0.2000000000000000111,0.2000000000000000111]],["v34"]],["Annotate",["b4","v34"],["meta_schedule.unroll_explicit"],[]],["GetLoops",["b3"],[],["l35","l36","l37","l38"]],["Fuse",["l35","l36"],[1],["l39"]],["Bind",["l39"],["blockIdx.x"],[]],["EnterPostproc",[],[],[]],["GetBlock",[],["root","main"],["b40"]],["Unannotate",["b40"],["meta_schedule.unroll_explicit"],[]],["GetChildBlocks",["b40"],[],["b41","b42","b43"]],["GetLoops",["b41"],[],["l44","l45","l46","l47","l48"]],["Annotate",["l44",1024],["pragma_auto_unroll_max_step"],[]],["Annotate",["l44",1],["pragma_unroll_explicit"],[]],["GetLoops",["b42"],[],["l49","l50","l51","l52","l53"]],["Annotate",["l49",1024],["pragma_auto_unroll_max_step"],[]],["Annotate",["l49",1],["pragma_unroll_explicit"],[]],["GetLoops",["b43"],[],["l54","l55","l56"]]],[[8,6],[23,4]]],[8.7132394062078288854e-05],{"host":{"keys":["cpu"],"kind":"llvm","tag":""},"keys":["metal","gpu"],"kind":"metal","max_function_args":31,"max_num_threads":256,"max_shared_memory_per_block":32768,"max_threads_per_block":256,"tag":"","thread_warp_size":32},[["TENSOR","float32",[1,1,50277]],["TENSOR","float32",[1,1,50277]]]]]
[7,[[[["GetBlock",[],["compute","main"],["b0"]],["GetBlock",[],["T_add","main"],["b1"]],["GetBlock",[],["T_multiply","main"],["b2"]],["GetBlock",[],["T_multiply_1","main"],["b3"]],["GetBlock",[],["T_add_1","main"],["b4"]],["GetBlock",[],["T_add_2","main"],["b5"]],["GetBlock",[],["matmul","main"],["b6"]],["GetBlock",[],["compute_1","main"],["b7"]],["GetBlock",[],["root","main"],["b8"]],["Annotate",["b6","\"SSSRRSRS\""],["meta_schedule.tiling_structure"],[]],["GetLoops",["b6"],[],["l9","l10","l11"]],["SamplePerfectTile",["l9"],[5,64],["v12","v13","v14","v15","v16"]],["Split",["l9","v12","v13","v14","v15","v16"],[1],["l17","l18","l19","l20","l21"]],["SamplePerfectTile",["l10"],[5,64],["v22","v23","v24","v25","v26"]],["Split",["l10","v22","v23","v24","v25","v26"],[1],["l27","l28","l29","l30","l31"]],["SamplePerfectTile",["l11"],[3,64],["v32","v33","v34"]],["Split",["l11","v32","v33","v34"],[1],["l35","l36","l37"]],["Reorder",["l17","l27","l18","l28","l19","l29","l35","l36","l20","l30","l37","l21","l31"],[],[]],["Fuse",["l17","l27"],[1],["l38"]],["Bind",["l38"],["blockIdx.x"],[]],["Fuse",["l18","l28"],[1],["l39"]],["Bind",["l39"],["vthread.x"],[]],["Fuse",["l19","l29"],[1],["l40"]],["Bind",["l40"],["threadIdx.x"],[]],["Annotate",["b6",32],["meta_schedule.thread_extent_low_inclusive"],[]],["Annotate",["b6",256],["meta_schedule.thread_extent_high_inclusive"],[]],["CacheWrite",["b6",[]],[0,"local"],["b41"]],["ReverseComputeAt",["b41","l40"],[1,-1],[]],["CacheRead",["b6",["b6"]],[0,"shared"],["b42"]],["ComputeAt",["b42","l35"],[1,-1],[]],["GetLoops",["b42"],[],["l43","l44","l45","l46","l47","l48"]],["Fuse",["l47","l48"],[1],["l49"]],["SampleCategorical",[],[[1,2,4,8],[0.25,0.25,0.25,0.25]],["v50"]],["Annotate",["b42","v50"],["meta_schedule.cooperative_fetch"],[]],["CacheRead",["b6",["b6"]],[1,"shared"],["b51"]],["ComputeAt",["b51","l35"],[1,-1],[]],["GetLoops",["b51"],[],["l52","l53","l54","l55","l56","l57"]],["Fuse",["l56","l57"],[1],["l58"]],["SampleCategorical",[],[[1,2,4,8],[0.25,0.25,0.25,0.25]],["v59"]],["Annotate",["b51","v59"],["meta_schedule.cooperative_fetch"],[]],["ReverseComputeInline",["b7"],[],[]],["ComputeInline",["b5"],[],[]],["ComputeInline",["b4"],[],[]],["ComputeInline",["b3"],[],[]],["ComputeInline",["b2"],[],[]],["ComputeInline",["b1"],[],[]],["ComputeInline",["b0"],[],[]],["SampleCategorical",[],[[0,16,64,512,1024],[0.2000000000000000111,0.2000000000000000111,0.2000000000000000111,0.2000000000000000111,0.2000000000000000111]],["v60"]],["Annotate",["b8","v60"],["meta_schedule.unroll_explicit"],[]],["EnterPostproc",[],[],[]],["Unannotate",["b42"],["meta_schedule.cooperative_fetch"],[]],["GetLoops",["b42"],[],["l61","l62","l63","l64","l65"]],["Split",["l65","None",64,2],[1],["l66","l67","l68"]],["Vectorize",["l68"],[],[]],["Bind",["l67"],["threadIdx.x"],[]],["Unannotate",["b51"],["meta_schedule.cooperative_fetch"],[]],["GetLoops",["b51"],[],["l69","l70","l71","l72","l73"]],["Split",["l73","None",64,4],[1],["l74","l75","l76"]],["Vectorize",["l76"],[],[]],["Bind",["l75"],["threadIdx.x"],[]],["GetBlock",[],["root","main"],["b77"]],["Unannotate",["b77"],["meta_schedule.unroll_explicit"],[]],["GetChildBlocks",["b77"],[],["b78","b79","b80","b81"]],["GetLoops",["b78"],[],["l82","l83","l84","l85","l86","l87","l88"]],["GetLoops",["b79"],[],["l89","l90","l91","l92","l93","l94","l95"]],["GetLoops",["b80"],[],["l96","l97","l98","l99","l100","l101","l102","l103","l104","l105"]],["Annotate",["l96",512],["pragma_auto_unroll_max_step"],[]],["Annotate",["l96",1],["pragma_unroll_explicit"],[]],["GetLoops",["b81"],[],["l106","l107","l108","l109","l110"]],["GetBlock",[],["matmul","main"],["b111"]],["GetLoops",["b111"],[],["l112","l113","l114","l115","l116","l117","l118","l119","l120","l121"]],["DecomposeReduction",["b111","l115"],[],["b122"]]],[[11,[1,1,1,1,1]],[13,[64,1,64,1,1]],[15,[128,2,16]],[32,1],[38,2],[47,3]]],[0.00019050645949720670437],{"host":{"keys":["cpu"],"kind":"llvm","tag":""},"keys":["metal","gpu"],"kind":"metal","max_function_args":31,"max_num_threads":256,"max_shared_memory_per_block":32768,"max_threads_per_block":256,"tag":"","thread_warp_size":32},[["TENSOR","uint8",[4096,4096]],["TENSOR","float16",[1,4096]],["TENSOR","float16",[1,4096]],["TENSOR","float16",[4096,1]],["TENSOR","float16",[4096,1]],["TENSOR","float16",[1,4096]],["TENSOR","float32",[1,4096]]]]]
[8,[[[["GetBlock",[],["T_divide","main"],["b0"]],["GetLoops",["b0"],[],["l1","l2","l3"]],["Fuse",["l1","l2","l3"],[1],["l4"]],["SampleCategorical",[],[[32,64,128,256],[0.25,0.25,0.25,0.25]],["v5"]],["Split",["l4","None","v5"],[1],["l6","l7"]],["Bind",["l6"],["blockIdx.x"],[]],["Bind",["l7"],["threadIdx.x"],[]],["EnterPostproc",[],[],[]]],[[3,2]]],[2.1218983587910303249e-05],{"host":{"keys":["cpu"],"kind":"llvm","tag":""},"keys":["metal","gpu"],"kind":"metal","max_function_args":31,"max_num_threads":256,"max_shared_memory_per_block":32768,"max_threads_per_block":256,"tag":"","thread_warp_size":32},[["TENSOR","float32",[1,1,50277]],["TENSOR","float32",[]],["TENSOR","float32",[1,1,50277]]]]]
[9,[[[["GetBlock",[],["T_multiply","main"],["b0"]],["GetBlock",[],["T_add","main"],["b1"]],["ReverseComputeInline",["b1"],[],[]],["GetLoops",["b0"],[],["l2","l3"]],["Fuse",["l2","l3"],[1],["l4"]],["SampleCategorical",[],[[32,64,128,256],[0.25,0.25,0.25,0.25]],["v5"]],["Split",["l4","None","v5"],[1],["l6","l7"]],["Bind",["l6"],["blockIdx.x"],[]],["Bind",["l7"],["threadIdx.x"],[]],["EnterPostproc",[],[],[]]],[[5,3]]],[2.0570701314217441555e-05],{"host":{"keys":["cpu"],"kind":"llvm","tag":""},"keys":["metal","gpu"],"kind":"metal","max_function_args":31,"max_num_threads":256,"max_shared_memory_per_block":32768,"max_threads_per_block":256,"tag":"","thread_warp_size":32},[["TENSOR","float32",[1,4096]],["TENSOR","float32",[1,4096]],["TENSOR","float32",[1,4096]],["TENSOR","float32",[1,4096]]]]]
[10,[[[["GetBlock",[],["A_red_temp","main"],["b0"]],["GetBlock",[],["T_layer_norm","main"],["b1"]],["GetBlock",[],["root","main"],["b2"]],["SampleCategorical",[],[[4,8,16,32,64,128,256,512],[0.125,0.125,0.125,0.125,0.125,0.125,0.125,0.125]],["v3"]],["GetLoops",["b0"],[],["l4","l5"]],["Split",["l5","None","v3"],[1],["l6","l7"]],["Bind",["l7"],["threadIdx.x"],[]],["SampleCategorical",[],[[0,16,64,512,1024],[0.2000000000000000111,0.2000000000000000111,0.2000000000000000111,0.2000000000000000111,0.2000000000000000111]],["v8"]],["Annotate",["b2","v8"],["meta_schedule.unroll_explicit"],[]],["GetLoops",["b1"],[],["l9","l10"]],["Fuse",["l9","l10"],[1],["l11"]],["SampleCategorical",[],[[32,64,128,256],[0.25,0.25,0.25,0.25]],["v12"]],["Split",["l11","None","v12"],[1],["l13","l14"]],["Bind",["l13"],["blockIdx.x"],[]],["Bind",["l14"],["threadIdx.x"],[]],["GetLoops",["b0"],[],["l15","l16","l17"]],["Fuse",["l15"],[1],["l18"]],["Bind",["l18"],["blockIdx.x"],[]],["EnterPostproc",[],[],[]],["GetBlock",[],["root","main"],["b19"]],["Unannotate",["b19"],["meta_schedule.unroll_explicit"],[]],["GetChildBlocks",["b19"],[],["b20","b21"]],["GetLoops",["b20"],[],["l22","l23","l24"]],["Annotate",["l22",1024],["pragma_auto_unroll_max_step"],[]],["Annotate",["l22",1],["pragma_unroll_explicit"],[]],["GetLoops",["b21"],[],["l25","l26"]]],[[3,6],[7,4],[11,1]]],[4.1822419774501292257e-05],{"host":{"keys":["cpu"],"kind":"llvm","tag":""},"keys":["metal","gpu"],"kind":"metal","max_function_args":31,"max_num_threads":256,"max_shared_memory_per_block":32768,"max_threads_per_block":256,"tag":"","thread_warp_size":32},[["TENSOR","float16",[1,4096]],["TENSOR","float16",[4096]],["TENSOR","float16",[4096]],["TENSOR","float16",[1,4096]]]]]
[11,[[[["GetBlock",[],["T_add","main"],["b0"]],["GetLoops",["b0"],[],["l1","l2"]],["Fuse",["l1","l2"],[1],["l3"]],["SampleCategorical",[],[[32,64,128,256],[0.25,0.25,0.25,0.25]],["v4"]],["Split",["l3","None","v4"],[1],["l5","l6"]],["Bind",["l5"],["blockIdx.x"],[]],["Bind",["l6"],["threadIdx.x"],[]],["EnterPostproc",[],[],[]]],[[3,1]]],[2.0412192791155534514e-05],{"host":{"keys":["cpu"],"kind":"llvm","tag":""},"keys":["metal","gpu"],"kind":"metal","max_function_args":31,"max_num_threads":256,"max_shared_memory_per_block":32768,"max_threads_per_block":256,"tag":"","thread_warp_size":32},[["TENSOR","float32",[1,4096]],["TENSOR","float32",[4096]],["TENSOR","float32",[1,4096]]]]]
[12,[[[["GetBlock",[],["T_multiply","main"],["b0"]],["GetBlock",[],["T_multiply_1","main"],["b1"]],["GetBlock",[],["T_add","main"],["b2"]],["ComputeInline",["b1"],[],[]],["ComputeInline",["b0"],[],[]],["GetLoops",["b2"],[],["l3","l4"]],["Fuse",["l3","l4"],[1],["l5"]],["SampleCategorical",[],[[32,64,128,256],[0.25,0.25,0.25,0.25]],["v6"]],["Split",["l5","None","v6"],[1],["l7","l8"]],["Bind",["l7"],["blockIdx.x"],[]],["Bind",["l8"],["threadIdx.x"],[]],["EnterPostproc",[],[],[]]],[[7,2]]],[2.0715304427761605194e-05],{"host":{"keys":["cpu"],"kind":"llvm","tag":""},"keys":["metal","gpu"],"kind":"metal","max_function_args":31,"max_num_threads":256,"max_shared_memory_per_block":32768,"max_threads_per_block":256,"tag":"","thread_warp_size":32},[["TENSOR","float32",[1,4096]],["TENSOR","float32",[1,4096]],["TENSOR","float32",[1,4096]],["TENSOR","float32",[1,4096]],["TENSOR","float32",[1,4096]]]]]
[13,[[[["GetBlock",[],["T_subtract","main"],["b0"]],["GetBlock",[],["compute","main"],["b1"]],["ReverseComputeInline",["b1"],[],[]],["GetLoops",["b0"],[],["l2","l3"]],["Fuse",["l2","l3"],[1],["l4"]],["SampleCategorical",[],[[32,64,128,256],[0.25,0.25,0.25,0.25]],["v5"]],["Split",["l4","None","v5"],[1],["l6","l7"]],["Bind",["l6"],["blockIdx.x"],[]],["Bind",["l7"],["threadIdx.x"],[]],["EnterPostproc",[],[],[]]],[[5,3]]],[2.0279967334185480837e-05],{"host":{"keys":["cpu"],"kind":"llvm","tag":""},"keys":["metal","gpu"],"kind":"metal","max_function_args":31,"max_num_threads":256,"max_shared_memory_per_block":32768,"max_threads_per_block":256,"tag":"","thread_warp_size":32},[["TENSOR","float32",[1,4096]],["TENSOR","float32",[1,4096]],["TENSOR","float32",[1,4096]]]]]
[14,[[[["GetBlock",[],["T_reshape","main"],["b0"]],["GetLoops",["b0"],[],["l1"]],["Fuse",["l1"],[1],["l2"]],["Split",["l2","None",1],[1],["l3","l4"]],["Bind",["l3"],["blockIdx.x"],[]],["Bind",["l4"],["threadIdx.x"],[]],["EnterPostproc",[],[],[]]],[]],[2.0391690731573157002e-05],{"host":{"keys":["cpu"],"kind":"llvm","tag":""},"keys":["metal","gpu"],"kind":"metal","max_function_args":31,"max_num_threads":256,"max_shared_memory_per_block":32768,"max_threads_per_block":256,"tag":"","thread_warp_size":32},[["TENSOR","int32",[1,1]],["TENSOR","int32",[1]]]]]
[15,[[[["GetBlock",[],["compute","main"],["b0"]],["GetBlock",[],["T_add","main"],["b1"]],["GetBlock",[],["T_multiply","main"],["b2"]],["GetBlock",[],["T_multiply_1","main"],["b3"]],["GetBlock",[],["T_add_1","main"],["b4"]],["GetBlock",[],["T_add_2","main"],["b5"]],["GetBlock",[],["matmul","main"],["b6"]],["GetBlock",[],["compute_1","main"],["b7"]],["GetBlock",[],["T_multiply_2","main"],["b8"]],["GetBlock",[],["root","main"],["b9"]],["Annotate",["b6","\"SSSRRSRS\""],["meta_schedule.tiling_structure"],[]],["GetLoops",["b6"],[],["l10","l11","l12"]],["SamplePerfectTile",["l10"],[5,64],["v13","v14","v15","v16","v17"]],["Split",["l10","v13","v14","v15","v16","v17"],[1],["l18","l19","l20","l21","l22"]],["SamplePerfectTile",["l11"],[5,64],["v23","v24","v25","v26","v27"]],["Split",["l11","v23","v24","v25","v26","v27"],[1],["l28","l29","l30","l31","l32"]],["SamplePerfectTile",["l12"],[3,64],["v33","v34","v35"]],["Split",["l12","v33","v34","v35"],[1],["l36","l37","l38"]],["Reorder",["l18","l28","l19","l29","l20","l30","l36","l37","l21","l31","l38","l22","l32"],[],[]],["Fuse",["l18","l28"],[1],["l39"]],["Bind",["l39"],["blockIdx.x"],[]],["Fuse",["l19","l29"],[1],["l40"]],["Bind",["l40"],["vthread.x"],[]],["Fuse",["l20","l30"],[1],["l41"]],["Bind",["l41"],["threadIdx.x"],[]],["Annotate",["b6",32],["meta_schedule.thread_extent_low_inclusive"],[]],["Annotate",["b6",256],["meta_schedule.thread_extent_high_inclusive"],[]],["CacheWrite",["b6",[]],[0,"local"],["b42"]],["ReverseComputeAt",["b42","l41"],[1,-1],[]],["CacheRead",["b6",["b6"]],[0,"shared"],["b43"]],["ComputeAt",["b43","l36"],[1,-1],[]],["GetLoops",["b43"],[],["l44","l45","l46","l47","l48","l49"]],["Fuse",["l48","l49"],[1],["l50"]],["SampleCategorical",[],[[1,2,4,8],[0.25,0.25,0.25,0.25]],["v51"]],["Annotate",["b43","v51"],["meta_schedule.cooperative_fetch"],[]],["CacheRead",["b6",["b6"]],[1,"shared"],["b52"]],["ComputeAt",["b52","l36"],[1,-1],[]],["GetLoops",["b52"],[],["l53","l54","l55","l56","l57","l58"]],["Fuse",["l57","l58"],[1],["l59"]],["SampleCategorical",[],[[1,2,4,8],[0.25,0.25,0.25,0.25]],["v60"]],["Annotate",["b52","v60"],["meta_schedule.cooperative_fetch"],[]],["ReverseComputeInline",["b8"],[],[]],["ReverseComputeInline",["b7"],[],[]],["ComputeInline",["b5"],[],[]],["ComputeInline",["b4"],[],[]],["ComputeInline",["b3"],[],[]],["ComputeInline",["b2"],[],[]],["ComputeInline",["b1"],[],[]],["ComputeInline",["b0"],[],[]],["SampleCategorical",[],[[0,16,64,512,1024],[0.2000000000000000111,0.2000000000000000111,0.2000000000000000111,0.2000000000000000111,0.2000000000000000111]],["v61"]],["Annotate",["b9","v61"],["meta_schedule.unroll_explicit"],[]],["EnterPostproc",[],[],[]],["Unannotate",["b43"],["meta_schedule.cooperative_fetch"],[]],["GetLoops",["b43"],[],["l62","l63","l64","l65","l66"]],["Split",["l66","None",64],[1],["l67","l68"]],["Bind",["l68"],["threadIdx.x"],[]],["Unannotate",["b52"],["meta_schedule.cooperative_fetch"],[]],["GetLoops",["b52"],[],["l69","l70","l71","l72","l73"]],["Split",["l73","None",64,4],[1],["l74","l75","l76"]],["Vectorize",["l76"],[],[]],["Bind",["l75"],["threadIdx.x"],[]],["GetBlock",[],["root","main"],["b77"]],["Unannotate",["b77"],["meta_schedule.unroll_explicit"],[]],["GetChildBlocks",["b77"],[],["b78","b79","b80","b81"]],["GetLoops",["b78"],[],["l82","l83","l84","l85","l86","l87"]],["GetLoops",["b79"],[],["l88","l89","l90","l91","l92","l93","l94"]],["GetLoops",["b80"],[],["l95","l96","l97","l98","l99","l100","l101","l102","l103","l104"]],["Annotate",["l95",16],["pragma_auto_unroll_max_step"],[]],["Annotate",["l95",1],["pragma_unroll_explicit"],[]],["GetLoops",["b81"],[],["l105","l106","l107","l108","l109"]],["GetBlock",[],["matmul","main"],["b110"]],["GetLoops",["b110"],[],["l111","l112","l113","l114","l115","l116","l117","l118","l119","l120"]],["DecomposeReduction",["b110","l114"],[],["b121"]]],[[12,[1,1,1,1,1]],[14,[256,1,64,1,1]],[16,[256,2,8]],[33,0],[39,2],[49,1]]],[0.0004204532232704402705],{"host":{"keys":["cpu"],"kind":"llvm","tag":""},"keys":["metal","gpu"],"kind":"metal","max_function_args":31,"max_num_threads":256,"max_shared_memory_per_block":32768,"max_threads_per_block":256,"tag":"","thread_warp_size":32},[["TENSOR","uint8",[4096,16384]],["TENSOR","float16",[1,16384]],["TENSOR","float16",[1,16384]],["TENSOR","float16",[4096,1]],["TENSOR","float16",[4096,1]],["TENSOR","float16",[1,4096]],["TENSOR","float16",[1,16384]]]]]
[16,[[[["GetBlock",[],["T_reshape","main"],["b0"]],["GetBlock",[],["compute","main"],["b1"]],["ReverseComputeInline",["b1"],[],[]],["GetLoops",["b0"],[],["l2","l3","l4"]],["Fuse",["l2","l3","l4"],[1],["l5"]],["SampleCategorical",[],[[32,64,128,256],[0.25,0.25,0.25,0.25]],["v6"]],["Split",["l5","None","v6"],[1],["l7","l8"]],["Bind",["l7"],["blockIdx.x"],[]],["Bind",["l8"],["threadIdx.x"],[]],["EnterPostproc",[],[],[]]],[[5,0]]],[2.1067384144266760492e-05],{"host":{"keys":["cpu"],"kind":"llvm","tag":""},"keys":["metal","gpu"],"kind":"metal","max_function_args":31,"max_num_threads":256,"max_shared_memory_per_block":32768,"max_threads_per_block":256,"tag":"","thread_warp_size":32},[["TENSOR","float16",[1,50277]],["TENSOR","float32",[1,1,50277]]]]]
[17,[[[["GetBlock",[],["T_multiply","main"],["b0"]],["GetBlock",[],["T_subtract","main"],["b1"]],["GetBlock",[],["T_multiply_1","main"],["b2"]],["GetBlock",[],["T_add","main"],["b3"]],["ComputeInline",["b2"],[],[]],["ComputeInline",["b1"],[],[]],["ComputeInline",["b0"],[],[]],["GetLoops",["b3"],[],["l4","l5"]],["Fuse",["l4","l5"],[1],["l6"]],["SampleCategorical",[],[[32,64,128,256],[0.25,0.25,0.25,0.25]],["v7"]],["Split",["l6","None","v7"],[1],["l8","l9"]],["Bind",["l8"],["blockIdx.x"],[]],["Bind",["l9"],["threadIdx.x"],[]],["EnterPostproc",[],[],[]]],[[9,0]]],[2.0323786296900489589e-05],{"host":{"keys":["cpu"],"kind":"llvm","tag":""},"keys":["metal","gpu"],"kind":"metal","max_function_args":31,"max_num_threads":256,"max_shared_memory_per_block":32768,"max_threads_per_block":256,"tag":"","thread_warp_size":32},[["TENSOR","float16",[1,4096]],["TENSOR","float16",[4096]],["TENSOR","float16",[4096]],["TENSOR","float16",[1,4096]],["TENSOR","float16",[1,4096]]]]]
[18,[[[["GetBlock",[],["T_take","main"],["b0"]],["GetLoops",["b0"],[],["l1","l2"]],["Fuse",["l1","l2"],[1],["l3"]],["SampleCategorical",[],[[32,64,128,256],[0.25,0.25,0.25,0.25]],["v4"]],["Split",["l3","None","v4"],[1],["l5","l6"]],["Bind",["l5"],["blockIdx.x"],[]],["Bind",["l6"],["threadIdx.x"],[]],["EnterPostproc",[],[],[]]],[[3,0]]],[2.0618773823884196803e-05],{"host":{"keys":["cpu"],"kind":"llvm","tag":""},"keys":["metal","gpu"],"kind":"metal","max_function_args":31,"max_num_threads":256,"max_shared_memory_per_block":32768,"max_threads_per_block":256,"tag":"","thread_warp_size":32},[["TENSOR","float16",[50277,4096]],["TENSOR","int32",[1]],["TENSOR","float16",[1,4096]]]]]
[19,[[[["GetBlock",[],["T_maximum","main"],["b0"]],["GetLoops",["b0"],[],["l1","l2"]],["Fuse",["l1","l2"],[1],["l3"]],["SampleCategorical",[],[[32,64,128,256],[0.25,0.25,0.25,0.25]],["v4"]],["Split",["l3","None","v4"],[1],["l5","l6"]],["Bind",["l5"],["blockIdx.x"],[]],["Bind",["l6"],["threadIdx.x"],[]],["EnterPostproc",[],[],[]]],[[3,2]]],[2.0291588540914997361e-05],{"host":{"keys":["cpu"],"kind":"llvm","tag":""},"keys":["metal","gpu"],"kind":"metal","max_function_args":31,"max_num_threads":256,"max_shared_memory_per_block":32768,"max_threads_per_block":256,"tag":"","thread_warp_size":32},[["TENSOR","float32",[1,4096]],["TENSOR","float32",[1,4096]],["TENSOR","float32",[1,4096]]]]]
